09:12:56.064171 IP localhost.60826 > localhost.7777: UDP, length 4
09:12:56.076246 IP localhost.35224 > localhost.7777: UDP, length 4
09:12:56.087403 IP localhost.34982 > localhost.7777: UDP, length 4
09:12:56.095332 IP localhost.40663 > localhost.7777: UDP, length 4
09:12:56.107087 IP localhost.58397 > localhost.7777: UDP, length 4
09:12:56.121160 IP localhost.39474 > localhost.7777: UDP, length 4
09:12:56.129402 IP localhost.58096 > localhost.7777: UDP, length 4
09:12:56.140944 IP localhost.54772 > localhost.7777: UDP, length 4
09:12:56.152692 IP localhost.53683 > localhost.7777: UDP, length 4
09:12:56.162306 IP localhost.43015 > localhost.7777: UDP, length 4
09:12:56.174056 IP localhost.58305 > localhost.7777: UDP, length 4
09:12:56.186797 IP localhost.41816 > localhost.7777: UDP, length 4
09:12:56.195221 IP localhost.47801 > localhost.7777: UDP, length 4
09:12:56.206514 IP localhost.41540 > localhost.7777: UDP, length 4
09:12:56.219422 IP localhost.59368 > localhost.7777: UDP, length 4
09:12:56.228638 IP localhost.43640 > localhost.7777: UDP, length 4
09:12:56.240593 IP localhost.36249 > localhost.7777: UDP, length 4
09:12:56.250851 IP localhost.37794 > localhost.7777: UDP, length 4
09:12:56.261024 IP localhost.59898 > localhost.7777: UDP, length 4
09:12:56.272862 IP localhost.56529 > localhost.7777: UDP, length 4
09:12:56.281439 IP localhost.49823 > localhost.7777: UDP, length 4
09:12:56.292410 IP localhost.44974 > localhost.7777: UDP, length 4
09:12:56.304599 IP localhost.45045 > localhost.7777: UDP, length 4
09:12:56.312963 IP localhost.57567 > localhost.7777: UDP, length 4
09:12:56.324498 IP localhost.39100 > localhost.7777: UDP, length 4
09:12:56.335997 IP localhost.44053 > localhost.7777: UDP, length 4
09:12:56.344627 IP localhost.51485 > localhost.7777: UDP, length 4
09:12:56.355522 IP localhost.52495 > localhost.7777: UDP, length 4
09:12:56.366425 IP localhost.49139 > localhost.7777: UDP, length 4
09:12:56.378057 IP localhost.53096 > localhost.7777: UDP, length 4
09:12:56.389842 IP localhost.55638 > localhost.7777: UDP, length 4
09:12:56.402367 IP localhost.48574 > localhost.7777: UDP, length 4
09:12:56.412816 IP localhost.52837 > localhost.7777: UDP, length 4
09:12:56.426366 IP localhost.46280 > localhost.7777: UDP, length 4
09:12:56.440655 IP localhost.40491 > localhost.7777: UDP, length 4
09:12:56.454432 IP localhost.60099 > localhost.7777: UDP, length 4
09:12:56.467530 IP localhost.60267 > localhost.7777: UDP, length 4
09:12:56.481213 IP localhost.51405 > localhost.7777: UDP, length 4
09:12:56.497890 IP localhost.40340 > localhost.7777: UDP, length 4
09:12:56.511453 IP localhost.40362 > localhost.7777: UDP, length 4
09:12:56.526023 IP localhost.56885 > localhost.7777: UDP, length 4
09:12:56.540173 IP localhost.46696 > localhost.7777: UDP, length 4
09:12:56.553411 IP localhost.58223 > localhost.7777: UDP, length 4
09:12:56.562627 IP localhost.43255 > localhost.7777: UDP, length 4
09:12:56.575031 IP localhost.40298 > localhost.7777: UDP, length 4
09:12:56.587855 IP localhost.38985 > localhost.7777: UDP, length 4
09:12:56.596706 IP localhost.51218 > localhost.7777: UDP, length 4
09:12:56.608550 IP localhost.54104 > localhost.7777: UDP, length 4
09:12:56.621419 IP localhost.42077 > localhost.7777: UDP, length 4
09:12:56.630603 IP localhost.34857 > localhost.7777: UDP, length 4
09:12:56.642639 IP localhost.37021 > localhost.7777: UDP, length 4
09:12:56.653746 IP localhost.35597 > localhost.7777: UDP, length 4
09:12:56.662252 IP localhost.50035 > localhost.7777: UDP, length 4
09:12:56.673791 IP localhost.51018 > localhost.7777: UDP, length 4
09:12:56.684408 IP localhost.33764 > localhost.7777: UDP, length 4
09:12:56.694300 IP localhost.58365 > localhost.7777: UDP, length 4
09:12:56.706441 IP localhost.47845 > localhost.7777: UDP, length 4
09:12:56.716854 IP localhost.33359 > localhost.7777: UDP, length 4
09:12:56.727216 IP localhost.38847 > localhost.7777: UDP, length 4
09:12:56.738635 IP localhost.46336 > localhost.7777: UDP, length 4
09:12:56.747209 IP localhost.46917 > localhost.7777: UDP, length 4
09:12:56.758670 IP localhost.55284 > localhost.7777: UDP, length 4
09:12:56.770602 IP localhost.44867 > localhost.7777: UDP, length 4
09:12:56.779620 IP localhost.55687 > localhost.7777: UDP, length 4
09:12:56.791843 IP localhost.53133 > localhost.7777: UDP, length 4
09:12:56.804722 IP localhost.35534 > localhost.7777: UDP, length 4
09:12:56.813758 IP localhost.36128 > localhost.7777: UDP, length 4
09:12:56.826285 IP localhost.49790 > localhost.7777: UDP, length 4
09:12:56.841351 IP localhost.46707 > localhost.7777: UDP, length 4
09:12:56.852609 IP localhost.40418 > localhost.7777: UDP, length 4
09:12:56.861576 IP localhost.56491 > localhost.7777: UDP, length 4
09:12:56.872730 IP localhost.35168 > localhost.7777: UDP, length 4
09:12:56.881351 IP localhost.39534 > localhost.7777: UDP, length 4
09:12:56.892792 IP localhost.41419 > localhost.7777: UDP, length 4
09:12:56.903656 IP localhost.39693 > localhost.7777: UDP, length 4
09:12:56.912794 IP localhost.49495 > localhost.7777: UDP, length 4
09:12:56.924752 IP localhost.57345 > localhost.7777: UDP, length 4
09:12:56.937495 IP localhost.44019 > localhost.7777: UDP, length 4
09:12:56.945850 IP localhost.54193 > localhost.7777: UDP, length 4
09:12:56.957513 IP localhost.47525 > localhost.7777: UDP, length 4
09:12:56.969046 IP localhost.43369 > localhost.7777: UDP, length 4
09:12:56.989452 IP localhost.50270 > localhost.7777: UDP, length 4
09:12:57.005677 IP localhost.60578 > localhost.7777: UDP, length 4
09:12:57.021447 IP localhost.58012 > localhost.7777: UDP, length 4
09:12:57.032309 IP localhost.34993 > localhost.7777: UDP, length 4
09:12:57.045179 IP localhost.33331 > localhost.7777: UDP, length 4
09:12:57.058113 IP localhost.33095 > localhost.7777: UDP, length 4
09:12:57.070422 IP localhost.41361 > localhost.7777: UDP, length 4
09:12:57.079204 IP localhost.43477 > localhost.7777: UDP, length 4
09:12:57.090712 IP localhost.47920 > localhost.7777: UDP, length 4
09:12:57.101335 IP localhost.37922 > localhost.7777: UDP, length 4
09:12:57.112533 IP localhost.43885 > localhost.7777: UDP, length 4
09:12:57.123980 IP localhost.53408 > localhost.7777: UDP, length 4
09:12:57.135124 IP localhost.57034 > localhost.7777: UDP, length 4
09:12:57.144228 IP localhost.47850 > localhost.7777: UDP, length 4
09:12:57.155722 IP localhost.54659 > localhost.7777: UDP, length 4
09:12:57.163833 IP localhost.45006 > localhost.7777: UDP, length 4
09:12:57.174591 IP localhost.37873 > localhost.7777: UDP, length 4
09:12:57.185927 IP localhost.51274 > localhost.7777: UDP, length 4
09:12:57.193771 IP localhost.50463 > localhost.7777: UDP, length 4
09:12:57.204861 IP localhost.56134 > localhost.7777: UDP, length 4
09:12:57.213817 IP localhost.42446 > localhost.7777: UDP, length 4
09:12:57.224926 IP localhost.46459 > localhost.7777: UDP, length 4
09:12:57.236035 IP localhost.36805 > localhost.7777: UDP, length 4
09:12:57.244776 IP localhost.38293 > localhost.7777: UDP, length 4
09:12:57.256295 IP localhost.47281 > localhost.7777: UDP, length 4
09:12:57.268133 IP localhost.51248 > localhost.7777: UDP, length 4
09:12:57.277669 IP localhost.54149 > localhost.7777: UDP, length 4
09:12:57.289318 IP localhost.58181 > localhost.7777: UDP, length 4
09:12:57.298071 IP localhost.38993 > localhost.7777: UDP, length 4
09:12:57.308909 IP localhost.33856 > localhost.7777: UDP, length 4
09:12:57.320891 IP localhost.50506 > localhost.7777: UDP, length 4
09:12:57.330043 IP localhost.46851 > localhost.7777: UDP, length 4
09:12:57.342334 IP localhost.57645 > localhost.7777: UDP, length 4
09:12:57.353786 IP localhost.49478 > localhost.7777: UDP, length 4
09:12:57.361850 IP localhost.56495 > localhost.7777: UDP, length 4
09:12:57.373466 IP localhost.44470 > localhost.7777: UDP, length 4
09:12:57.386121 IP localhost.38303 > localhost.7777: UDP, length 4
09:12:57.394068 IP localhost.52539 > localhost.7777: UDP, length 4
09:12:57.405302 IP localhost.40762 > localhost.7777: UDP, length 4
09:12:57.413708 IP localhost.57567 > localhost.7777: UDP, length 4
09:12:57.425336 IP localhost.54056 > localhost.7777: UDP, length 4
09:12:57.436938 IP localhost.36075 > localhost.7777: UDP, length 4
09:12:57.445468 IP localhost.55392 > localhost.7777: UDP, length 4
09:12:57.457413 IP localhost.54562 > localhost.7777: UDP, length 4
09:12:57.467495 IP localhost.57307 > localhost.7777: UDP, length 4
09:12:57.477568 IP localhost.54325 > localhost.7777: UDP, length 4
09:12:57.488064 IP localhost.58242 > localhost.7777: UDP, length 4
09:12:57.496901 IP localhost.33277 > localhost.7777: UDP, length 4
09:12:57.507590 IP localhost.43360 > localhost.7777: UDP, length 4
09:12:57.519708 IP localhost.46832 > localhost.7777: UDP, length 4
09:12:57.529431 IP localhost.52801 > localhost.7777: UDP, length 4
09:12:57.541504 IP localhost.46543 > localhost.7777: UDP, length 4
09:12:57.553281 IP localhost.48703 > localhost.7777: UDP, length 4
09:12:57.561781 IP localhost.53531 > localhost.7777: UDP, length 4
09:12:57.573030 IP localhost.50834 > localhost.7777: UDP, length 4
09:12:57.582590 IP localhost.44644 > localhost.7777: UDP, length 4
09:12:57.593596 IP localhost.58211 > localhost.7777: UDP, length 4
09:12:57.604690 IP localhost.47509 > localhost.7777: UDP, length 4
09:12:57.613072 IP localhost.56165 > localhost.7777: UDP, length 4
09:12:57.624529 IP localhost.52985 > localhost.7777: UDP, length 4
09:12:57.637320 IP localhost.41851 > localhost.7777: UDP, length 4
09:12:57.651254 IP localhost.59647 > localhost.7777: UDP, length 4
09:12:57.661261 IP localhost.58564 > localhost.7777: UDP, length 4
09:12:57.672723 IP localhost.41761 > localhost.7777: UDP, length 4
09:12:57.680728 IP localhost.39580 > localhost.7777: UDP, length 4
09:12:57.691088 IP localhost.40882 > localhost.7777: UDP, length 4
09:12:57.702841 IP localhost.36168 > localhost.7777: UDP, length 4
09:12:57.710978 IP localhost.34684 > localhost.7777: UDP, length 4
09:12:57.722584 IP localhost.38722 > localhost.7777: UDP, length 4
09:12:57.731722 IP localhost.46350 > localhost.7777: UDP, length 4
09:12:57.743126 IP localhost.43913 > localhost.7777: UDP, length 4
09:12:57.754248 IP localhost.48105 > localhost.7777: UDP, length 4
09:12:57.763188 IP localhost.46715 > localhost.7777: UDP, length 4
09:12:57.775292 IP localhost.56261 > localhost.7777: UDP, length 4
09:12:57.787343 IP localhost.36589 > localhost.7777: UDP, length 4
09:12:57.795594 IP localhost.54748 > localhost.7777: UDP, length 4
09:12:57.807057 IP localhost.36842 > localhost.7777: UDP, length 4
09:12:57.819468 IP localhost.46640 > localhost.7777: UDP, length 4
09:12:57.829235 IP localhost.36733 > localhost.7777: UDP, length 4
09:12:57.841993 IP localhost.37686 > localhost.7777: UDP, length 4
09:12:57.854407 IP localhost.52806 > localhost.7777: UDP, length 4
09:12:57.873517 IP localhost.46386 > localhost.7777: UDP, length 4
09:12:57.884689 IP localhost.49935 > localhost.7777: UDP, length 4
09:12:57.893505 IP localhost.39221 > localhost.7777: UDP, length 4
09:12:57.904740 IP localhost.37275 > localhost.7777: UDP, length 4
09:12:57.913072 IP localhost.54051 > localhost.7777: UDP, length 4
09:12:57.924404 IP localhost.54464 > localhost.7777: UDP, length 4
09:12:57.935883 IP localhost.38420 > localhost.7777: UDP, length 4
09:12:57.944763 IP localhost.57085 > localhost.7777: UDP, length 4
09:12:57.954839 IP localhost.54568 > localhost.7777: UDP, length 4
09:12:57.964352 IP localhost.37745 > localhost.7777: UDP, length 4
09:12:57.975853 IP localhost.55544 > localhost.7777: UDP, length 4
09:12:57.993682 IP localhost.36133 > localhost.7777: UDP, length 4
09:12:58.008482 IP localhost.34099 > localhost.7777: UDP, length 4
09:12:58.022959 IP localhost.48105 > localhost.7777: UDP, length 4
09:12:58.037427 IP localhost.43777 > localhost.7777: UDP, length 4
09:12:58.047323 IP localhost.41563 > localhost.7777: UDP, length 4
09:12:58.061923 IP localhost.45547 > localhost.7777: UDP, length 4
09:12:58.073899 IP localhost.47139 > localhost.7777: UDP, length 4
09:12:58.083983 IP localhost.48501 > localhost.7777: UDP, length 4
09:12:58.094213 IP localhost.52493 > localhost.7777: UDP, length 4
09:12:58.105492 IP localhost.59507 > localhost.7777: UDP, length 4
09:12:58.118523 IP localhost.57496 > localhost.7777: UDP, length 4
09:12:58.127373 IP localhost.46810 > localhost.7777: UDP, length 4
09:12:58.138975 IP localhost.54566 > localhost.7777: UDP, length 4
09:12:58.147130 IP localhost.41490 > localhost.7777: UDP, length 4
09:12:58.160583 IP localhost.44441 > localhost.7777: UDP, length 4
09:12:58.172632 IP localhost.55452 > localhost.7777: UDP, length 4
09:12:58.181871 IP localhost.42641 > localhost.7777: UDP, length 4
09:12:58.193913 IP localhost.52552 > localhost.7777: UDP, length 4
09:12:58.205828 IP localhost.47898 > localhost.7777: UDP, length 4
09:12:58.214114 IP localhost.43728 > localhost.7777: UDP, length 4
09:12:58.225069 IP localhost.51155 > localhost.7777: UDP, length 4
09:12:58.236602 IP localhost.46194 > localhost.7777: UDP, length 4
09:12:58.244591 IP localhost.42085 > localhost.7777: UDP, length 4
09:12:58.255834 IP localhost.52682 > localhost.7777: UDP, length 4
09:12:58.263914 IP localhost.36937 > localhost.7777: UDP, length 4
09:12:58.275091 IP localhost.42897 > localhost.7777: UDP, length 4
09:12:58.286802 IP localhost.37274 > localhost.7777: UDP, length 4
09:12:58.294903 IP localhost.54638 > localhost.7777: UDP, length 4
09:12:58.306958 IP localhost.39695 > localhost.7777: UDP, length 4
09:12:58.318052 IP localhost.35190 > localhost.7777: UDP, length 4
09:12:58.326819 IP localhost.40172 > localhost.7777: UDP, length 4
09:12:58.338504 IP localhost.43321 > localhost.7777: UDP, length 4
09:12:58.346588 IP localhost.49023 > localhost.7777: UDP, length 4
09:12:58.358732 IP localhost.44253 > localhost.7777: UDP, length 4
09:12:58.370277 IP localhost.46952 > localhost.7777: UDP, length 4
09:12:58.378599 IP localhost.36741 > localhost.7777: UDP, length 4
09:12:58.390287 IP localhost.39935 > localhost.7777: UDP, length 4
09:12:58.399592 IP localhost.46937 > localhost.7777: UDP, length 4
09:12:58.411257 IP localhost.58378 > localhost.7777: UDP, length 4
09:12:58.422928 IP localhost.45682 > localhost.7777: UDP, length 4
09:12:58.431424 IP localhost.40026 > localhost.7777: UDP, length 4
09:12:58.443052 IP localhost.40259 > localhost.7777: UDP, length 4
09:12:58.454613 IP localhost.41629 > localhost.7777: UDP, length 4
09:12:58.463134 IP localhost.56124 > localhost.7777: UDP, length 4
09:12:58.474802 IP localhost.33300 > localhost.7777: UDP, length 4
09:12:58.486935 IP localhost.46377 > localhost.7777: UDP, length 4
09:12:58.495280 IP localhost.57472 > localhost.7777: UDP, length 4
09:12:58.506616 IP localhost.53654 > localhost.7777: UDP, length 4
09:12:58.519759 IP localhost.40097 > localhost.7777: UDP, length 4
09:12:58.528795 IP localhost.55571 > localhost.7777: UDP, length 4
09:12:58.541414 IP localhost.58678 > localhost.7777: UDP, length 4
09:12:58.552545 IP localhost.48157 > localhost.7777: UDP, length 4
09:12:58.560697 IP localhost.53814 > localhost.7777: UDP, length 4
09:12:58.571602 IP localhost.47746 > localhost.7777: UDP, length 4
09:12:58.580393 IP localhost.33604 > localhost.7777: UDP, length 4
09:12:58.592558 IP localhost.54861 > localhost.7777: UDP, length 4
09:12:58.603714 IP localhost.43311 > localhost.7777: UDP, length 4
09:12:58.613334 IP localhost.37758 > localhost.7777: UDP, length 4
09:12:58.625059 IP localhost.47719 > localhost.7777: UDP, length 4
09:12:58.636990 IP localhost.55480 > localhost.7777: UDP, length 4
09:12:58.645749 IP localhost.44761 > localhost.7777: UDP, length 4
09:12:58.657446 IP localhost.47498 > localhost.7777: UDP, length 4
09:12:58.667804 IP localhost.36508 > localhost.7777: UDP, length 4
09:12:58.677410 IP localhost.40827 > localhost.7777: UDP, length 4
09:12:58.688734 IP localhost.36265 > localhost.7777: UDP, length 4
09:12:58.700448 IP localhost.52706 > localhost.7777: UDP, length 4
09:12:58.711363 IP localhost.60614 > localhost.7777: UDP, length 4
09:12:58.723334 IP localhost.46020 > localhost.7777: UDP, length 4
09:12:58.735281 IP localhost.49965 > localhost.7777: UDP, length 4
09:12:58.744693 IP localhost.59853 > localhost.7777: UDP, length 4
09:12:58.755499 IP localhost.53925 > localhost.7777: UDP, length 4
09:12:58.768837 IP localhost.41810 > localhost.7777: UDP, length 4
09:12:58.777820 IP localhost.45814 > localhost.7777: UDP, length 4
09:12:58.788849 IP localhost.47434 > localhost.7777: UDP, length 4
09:12:58.798929 IP localhost.55926 > localhost.7777: UDP, length 4
09:12:58.811380 IP localhost.41114 > localhost.7777: UDP, length 4
09:12:58.823706 IP localhost.59343 > localhost.7777: UDP, length 4
09:12:58.837256 IP localhost.44483 > localhost.7777: UDP, length 4
09:12:58.845988 IP localhost.34285 > localhost.7777: UDP, length 4
09:12:58.858149 IP localhost.45647 > localhost.7777: UDP, length 4
09:12:58.869381 IP localhost.43200 > localhost.7777: UDP, length 4
09:12:58.879992 IP localhost.34727 > localhost.7777: UDP, length 4
09:12:58.895192 IP localhost.38043 > localhost.7777: UDP, length 4
09:12:58.905779 IP localhost.47568 > localhost.7777: UDP, length 4
09:12:58.917275 IP localhost.41324 > localhost.7777: UDP, length 4
09:12:58.928417 IP localhost.46114 > localhost.7777: UDP, length 4
09:12:58.939752 IP localhost.38684 > localhost.7777: UDP, length 4
09:12:58.950611 IP localhost.59793 > localhost.7777: UDP, length 4
09:12:58.960809 IP localhost.34129 > localhost.7777: UDP, length 4
09:12:58.972854 IP localhost.52596 > localhost.7777: UDP, length 4
09:12:58.980950 IP localhost.49799 > localhost.7777: UDP, length 4
09:12:59.007067 IP localhost.47659 > localhost.7777: UDP, length 4
09:12:59.021827 IP localhost.55524 > localhost.7777: UDP, length 4
09:12:59.036615 IP localhost.39990 > localhost.7777: UDP, length 4
09:12:59.046641 IP localhost.40788 > localhost.7777: UDP, length 4
09:12:59.058846 IP localhost.44772 > localhost.7777: UDP, length 4
09:12:59.072231 IP localhost.59887 > localhost.7777: UDP, length 4
09:12:59.080864 IP localhost.42166 > localhost.7777: UDP, length 4
09:12:59.092524 IP localhost.60580 > localhost.7777: UDP, length 4
09:12:59.103700 IP localhost.38191 > localhost.7777: UDP, length 4
09:12:59.113943 IP localhost.34484 > localhost.7777: UDP, length 4
09:12:59.126361 IP localhost.46920 > localhost.7777: UDP, length 4
09:12:59.137939 IP localhost.42151 > localhost.7777: UDP, length 4
09:12:59.145963 IP localhost.52870 > localhost.7777: UDP, length 4
09:12:59.158321 IP localhost.57291 > localhost.7777: UDP, length 4
09:12:59.171042 IP localhost.45319 > localhost.7777: UDP, length 4
09:12:59.179324 IP localhost.55601 > localhost.7777: UDP, length 4
09:12:59.191014 IP localhost.41750 > localhost.7777: UDP, length 4
09:12:59.203854 IP localhost.48314 > localhost.7777: UDP, length 4
09:12:59.212764 IP localhost.32790 > localhost.7777: UDP, length 4
09:12:59.224537 IP localhost.36443 > localhost.7777: UDP, length 4
09:12:59.236940 IP localhost.54188 > localhost.7777: UDP, length 4
09:12:59.245076 IP localhost.33916 > localhost.7777: UDP, length 4
09:12:59.256941 IP localhost.47641 > localhost.7777: UDP, length 4
09:12:59.266603 IP localhost.45725 > localhost.7777: UDP, length 4
09:12:59.276903 IP localhost.36568 > localhost.7777: UDP, length 4
09:12:59.288629 IP localhost.49691 > localhost.7777: UDP, length 4
09:12:59.296805 IP localhost.57572 > localhost.7777: UDP, length 4
09:12:59.309698 IP localhost.36917 > localhost.7777: UDP, length 4
09:12:59.320969 IP localhost.35345 > localhost.7777: UDP, length 4
09:12:59.329527 IP localhost.56396 > localhost.7777: UDP, length 4
09:12:59.341320 IP localhost.50913 > localhost.7777: UDP, length 4
09:12:59.353700 IP localhost.44691 > localhost.7777: UDP, length 4
09:12:59.361954 IP localhost.49058 > localhost.7777: UDP, length 4
09:12:59.373383 IP localhost.53014 > localhost.7777: UDP, length 4
09:12:59.383429 IP localhost.36139 > localhost.7777: UDP, length 4
09:12:59.393506 IP localhost.57337 > localhost.7777: UDP, length 4
09:12:59.404959 IP localhost.40286 > localhost.7777: UDP, length 4
09:12:59.414261 IP localhost.60847 > localhost.7777: UDP, length 4
09:12:59.425547 IP localhost.41297 > localhost.7777: UDP, length 4
09:12:59.436989 IP localhost.34253 > localhost.7777: UDP, length 4
09:12:59.445485 IP localhost.59423 > localhost.7777: UDP, length 4
09:12:59.457837 IP localhost.34524 > localhost.7777: UDP, length 4
09:12:59.470430 IP localhost.43323 > localhost.7777: UDP, length 4
09:12:59.479755 IP localhost.40972 > localhost.7777: UDP, length 4
09:12:59.491701 IP localhost.39544 > localhost.7777: UDP, length 4
09:12:59.503712 IP localhost.48554 > localhost.7777: UDP, length 4
09:12:59.512504 IP localhost.56731 > localhost.7777: UDP, length 4
09:12:59.524710 IP localhost.60721 > localhost.7777: UDP, length 4
09:12:59.535849 IP localhost.52415 > localhost.7777: UDP, length 4
09:12:59.544783 IP localhost.59552 > localhost.7777: UDP, length 4
09:12:59.555430 IP localhost.38429 > localhost.7777: UDP, length 4
09:12:59.566918 IP localhost.38748 > localhost.7777: UDP, length 4
09:12:59.576790 IP localhost.40161 > localhost.7777: UDP, length 4
09:12:59.589038 IP localhost.46449 > localhost.7777: UDP, length 4
09:12:59.597264 IP localhost.51698 > localhost.7777: UDP, length 4
09:12:59.609934 IP localhost.46373 > localhost.7777: UDP, length 4
09:12:59.621148 IP localhost.53814 > localhost.7777: UDP, length 4
09:12:59.630076 IP localhost.52491 > localhost.7777: UDP, length 4
09:12:59.642142 IP localhost.34522 > localhost.7777: UDP, length 4
09:12:59.653811 IP localhost.52976 > localhost.7777: UDP, length 4
09:12:59.669073 IP localhost.50498 > localhost.7777: UDP, length 4
09:12:59.678791 IP localhost.43397 > localhost.7777: UDP, length 4
09:12:59.689470 IP localhost.46310 > localhost.7777: UDP, length 4
09:12:59.701064 IP localhost.48180 > localhost.7777: UDP, length 4
09:12:59.710738 IP localhost.46129 > localhost.7777: UDP, length 4
09:12:59.722853 IP localhost.37160 > localhost.7777: UDP, length 4
09:12:59.734489 IP localhost.53834 > localhost.7777: UDP, length 4
09:12:59.743346 IP localhost.55057 > localhost.7777: UDP, length 4
09:12:59.754851 IP localhost.56724 > localhost.7777: UDP, length 4
09:12:59.766153 IP localhost.47107 > localhost.7777: UDP, length 4
09:12:59.776568 IP localhost.56608 > localhost.7777: UDP, length 4
09:12:59.788533 IP localhost.51378 > localhost.7777: UDP, length 4
09:12:59.796901 IP localhost.49170 > localhost.7777: UDP, length 4
09:12:59.809087 IP localhost.46908 > localhost.7777: UDP, length 4
09:12:59.821469 IP localhost.52975 > localhost.7777: UDP, length 4
09:12:59.835511 IP localhost.60629 > localhost.7777: UDP, length 4
09:12:59.844620 IP localhost.57479 > localhost.7777: UDP, length 4
09:12:59.854787 IP localhost.47369 > localhost.7777: UDP, length 4
09:12:59.866017 IP localhost.41916 > localhost.7777: UDP, length 4
09:12:59.876996 IP localhost.58790 > localhost.7777: UDP, length 4
09:12:59.889379 IP localhost.50619 > localhost.7777: UDP, length 4
09:12:59.897816 IP localhost.42732 > localhost.7777: UDP, length 4
09:12:59.919012 IP localhost.45376 > localhost.7777: UDP, length 4
09:12:59.927290 IP localhost.50355 > localhost.7777: UDP, length 4
09:12:59.939060 IP localhost.58919 > localhost.7777: UDP, length 4
09:12:59.952308 IP localhost.33469 > localhost.7777: UDP, length 4
09:12:59.961495 IP localhost.57694 > localhost.7777: UDP, length 4
09:12:59.972562 IP localhost.47715 > localhost.7777: UDP, length 4
09:12:59.988471 IP localhost.54572 > localhost.7777: UDP, length 4
09:13:00.006502 IP localhost.55628 > localhost.7777: UDP, length 4
09:13:00.022165 IP localhost.58198 > localhost.7777: UDP, length 4
09:13:00.036627 IP localhost.60318 > localhost.7777: UDP, length 4
09:13:00.045979 IP localhost.36675 > localhost.7777: UDP, length 4
09:13:00.059793 IP localhost.54816 > localhost.7777: UDP, length 4
09:13:00.072662 IP localhost.49515 > localhost.7777: UDP, length 4
09:13:00.081036 IP localhost.42486 > localhost.7777: UDP, length 4
09:13:00.093084 IP localhost.51099 > localhost.7777: UDP, length 4
09:13:00.105799 IP localhost.60472 > localhost.7777: UDP, length 4
09:13:00.116478 IP localhost.54094 > localhost.7777: UDP, length 4
09:13:00.125954 IP localhost.49817 > localhost.7777: UDP, length 4
09:13:00.137642 IP localhost.40395 > localhost.7777: UDP, length 4
09:13:00.145584 IP localhost.39664 > localhost.7777: UDP, length 4
09:13:00.159082 IP localhost.45303 > localhost.7777: UDP, length 4
09:13:00.170494 IP localhost.53003 > localhost.7777: UDP, length 4
09:13:00.178992 IP localhost.52319 > localhost.7777: UDP, length 4
09:13:00.191723 IP localhost.36348 > localhost.7777: UDP, length 4
09:13:00.205349 IP localhost.58169 > localhost.7777: UDP, length 4
09:13:00.216655 IP localhost.60201 > localhost.7777: UDP, length 4
09:13:00.226856 IP localhost.57866 > localhost.7777: UDP, length 4
09:13:00.238441 IP localhost.48251 > localhost.7777: UDP, length 4
09:13:00.246962 IP localhost.52755 > localhost.7777: UDP, length 4
09:13:00.259237 IP localhost.56883 > localhost.7777: UDP, length 4
09:13:00.271089 IP localhost.60239 > localhost.7777: UDP, length 4
09:13:00.279876 IP localhost.50297 > localhost.7777: UDP, length 4
09:13:00.290705 IP localhost.46242 > localhost.7777: UDP, length 4
09:13:00.302595 IP localhost.49410 > localhost.7777: UDP, length 4
09:13:00.312738 IP localhost.58376 > localhost.7777: UDP, length 4
09:13:00.323529 IP localhost.35760 > localhost.7777: UDP, length 4
09:13:00.333857 IP localhost.57676 > localhost.7777: UDP, length 4
09:13:00.342845 IP localhost.59584 > localhost.7777: UDP, length 4
09:13:00.354559 IP localhost.41337 > localhost.7777: UDP, length 4
09:13:00.367933 IP localhost.53614 > localhost.7777: UDP, length 4
09:13:00.377821 IP localhost.46707 > localhost.7777: UDP, length 4
09:13:00.389454 IP localhost.51908 > localhost.7777: UDP, length 4
09:13:00.401782 IP localhost.56644 > localhost.7777: UDP, length 4
09:13:00.411038 IP localhost.51667 > localhost.7777: UDP, length 4
09:13:00.422658 IP localhost.55013 > localhost.7777: UDP, length 4
09:13:00.434071 IP localhost.42806 > localhost.7777: UDP, length 4
09:13:00.443718 IP localhost.34504 > localhost.7777: UDP, length 4
09:13:00.455117 IP localhost.47374 > localhost.7777: UDP, length 4
09:13:00.466413 IP localhost.51428 > localhost.7777: UDP, length 4
09:13:00.477558 IP localhost.46391 > localhost.7777: UDP, length 4
09:13:00.488107 IP localhost.52513 > localhost.7777: UDP, length 4
09:13:00.499920 IP localhost.50513 > localhost.7777: UDP, length 4
09:13:00.509993 IP localhost.35439 > localhost.7777: UDP, length 4
09:13:00.522139 IP localhost.43958 > localhost.7777: UDP, length 4
09:13:00.531150 IP localhost.60536 > localhost.7777: UDP, length 4
09:13:00.544600 IP localhost.39205 > localhost.7777: UDP, length 4
09:13:00.556695 IP localhost.59869 > localhost.7777: UDP, length 4
09:13:00.566998 IP localhost.43905 > localhost.7777: UDP, length 4
09:13:00.576436 IP localhost.33813 > localhost.7777: UDP, length 4
09:13:00.587228 IP localhost.53394 > localhost.7777: UDP, length 4
09:13:00.595630 IP localhost.42020 > localhost.7777: UDP, length 4
09:13:00.607284 IP localhost.39983 > localhost.7777: UDP, length 4
09:13:00.618889 IP localhost.50030 > localhost.7777: UDP, length 4
09:13:00.627089 IP localhost.39777 > localhost.7777: UDP, length 4
09:13:00.638931 IP localhost.33245 > localhost.7777: UDP, length 4
09:13:00.647408 IP localhost.58167 > localhost.7777: UDP, length 4
09:13:00.659166 IP localhost.60471 > localhost.7777: UDP, length 4
09:13:00.670565 IP localhost.37871 > localhost.7777: UDP, length 4
09:13:00.679539 IP localhost.39942 > localhost.7777: UDP, length 4
09:13:00.691018 IP localhost.58331 > localhost.7777: UDP, length 4
09:13:00.702187 IP localhost.39069 > localhost.7777: UDP, length 4
09:13:00.711033 IP localhost.53241 > localhost.7777: UDP, length 4
09:13:00.721902 IP localhost.48878 > localhost.7777: UDP, length 4
09:13:00.730869 IP localhost.47585 > localhost.7777: UDP, length 4
09:13:00.742782 IP localhost.57110 > localhost.7777: UDP, length 4
09:13:00.754880 IP localhost.51852 > localhost.7777: UDP, length 4
09:13:00.766448 IP localhost.56881 > localhost.7777: UDP, length 4
09:13:00.776862 IP localhost.46069 > localhost.7777: UDP, length 4
09:13:00.788064 IP localhost.56108 > localhost.7777: UDP, length 4
09:13:00.800340 IP localhost.36730 > localhost.7777: UDP, length 4
09:13:00.810545 IP localhost.60758 > localhost.7777: UDP, length 4
09:13:00.822777 IP localhost.33806 > localhost.7777: UDP, length 4
09:13:00.835801 IP localhost.41727 > localhost.7777: UDP, length 4
09:13:00.844583 IP localhost.50935 > localhost.7777: UDP, length 4
09:13:00.856075 IP localhost.42986 > localhost.7777: UDP, length 4
09:13:00.869245 IP localhost.49727 > localhost.7777: UDP, length 4
09:13:00.877628 IP localhost.50688 > localhost.7777: UDP, length 4
09:13:00.889099 IP localhost.60640 > localhost.7777: UDP, length 4
09:13:00.898048 IP localhost.38720 > localhost.7777: UDP, length 4
09:13:00.909407 IP localhost.56178 > localhost.7777: UDP, length 4
09:13:00.921600 IP localhost.41244 > localhost.7777: UDP, length 4
09:13:00.939612 IP localhost.35388 > localhost.7777: UDP, length 4
09:13:00.950505 IP localhost.57071 > localhost.7777: UDP, length 4
09:13:00.960976 IP localhost.54879 > localhost.7777: UDP, length 4
09:13:00.972722 IP localhost.37747 > localhost.7777: UDP, length 4
09:13:00.988638 IP localhost.48586 > localhost.7777: UDP, length 4
09:13:01.005067 IP localhost.56797 > localhost.7777: UDP, length 4
09:13:01.019226 IP localhost.45215 > localhost.7777: UDP, length 4
09:13:01.036959 IP localhost.36402 > localhost.7777: UDP, length 4
09:13:01.052113 IP localhost.53353 > localhost.7777: UDP, length 4
09:13:01.062159 IP localhost.43657 > localhost.7777: UDP, length 4
09:13:01.075553 IP localhost.35862 > localhost.7777: UDP, length 4
09:13:01.087698 IP localhost.57808 > localhost.7777: UDP, length 4
09:13:01.097032 IP localhost.40233 > localhost.7777: UDP, length 4
09:13:01.108972 IP localhost.49456 > localhost.7777: UDP, length 4
09:13:01.120909 IP localhost.34378 > localhost.7777: UDP, length 4
09:13:01.133135 IP localhost.39791 > localhost.7777: UDP, length 4
09:13:01.143640 IP localhost.35481 > localhost.7777: UDP, length 4
09:13:01.156602 IP localhost.59225 > localhost.7777: UDP, length 4
09:13:01.168959 IP localhost.55114 > localhost.7777: UDP, length 4
09:13:01.177970 IP localhost.48329 > localhost.7777: UDP, length 4
09:13:01.189385 IP localhost.56026 > localhost.7777: UDP, length 4
09:13:01.199401 IP localhost.56218 > localhost.7777: UDP, length 4
09:13:01.211087 IP localhost.33297 > localhost.7777: UDP, length 4
09:13:01.222541 IP localhost.45586 > localhost.7777: UDP, length 4
09:13:01.234989 IP localhost.53949 > localhost.7777: UDP, length 4
09:13:01.244216 IP localhost.60800 > localhost.7777: UDP, length 4
09:13:01.255110 IP localhost.50084 > localhost.7777: UDP, length 4
09:13:01.267738 IP localhost.46627 > localhost.7777: UDP, length 4
09:13:01.277666 IP localhost.48308 > localhost.7777: UDP, length 4
09:13:01.289348 IP localhost.37879 > localhost.7777: UDP, length 4
09:13:01.299967 IP localhost.55646 > localhost.7777: UDP, length 4
09:13:01.309463 IP localhost.50277 > localhost.7777: UDP, length 4
09:13:01.320812 IP localhost.34400 > localhost.7777: UDP, length 4
09:13:01.329166 IP localhost.44239 > localhost.7777: UDP, length 4
09:13:01.339948 IP localhost.42824 > localhost.7777: UDP, length 4
09:13:01.350787 IP localhost.53062 > localhost.7777: UDP, length 4
09:13:01.360301 IP localhost.42042 > localhost.7777: UDP, length 4
09:13:01.371851 IP localhost.43207 > localhost.7777: UDP, length 4
09:13:01.382559 IP localhost.38053 > localhost.7777: UDP, length 4
09:13:01.392687 IP localhost.51742 > localhost.7777: UDP, length 4
09:13:01.404454 IP localhost.60140 > localhost.7777: UDP, length 4
09:13:01.412971 IP localhost.50964 > localhost.7777: UDP, length 4
09:13:01.424469 IP localhost.43554 > localhost.7777: UDP, length 4
09:13:01.436821 IP localhost.40834 > localhost.7777: UDP, length 4
09:13:01.445467 IP localhost.45318 > localhost.7777: UDP, length 4
09:13:01.456700 IP localhost.43781 > localhost.7777: UDP, length 4
09:13:01.468864 IP localhost.54546 > localhost.7777: UDP, length 4
09:13:01.477135 IP localhost.41725 > localhost.7777: UDP, length 4
09:13:01.490812 IP localhost.51801 > localhost.7777: UDP, length 4
09:13:01.501999 IP localhost.37042 > localhost.7777: UDP, length 4
09:13:01.510050 IP localhost.48124 > localhost.7777: UDP, length 4
09:13:01.521131 IP localhost.47040 > localhost.7777: UDP, length 4
09:13:01.529707 IP localhost.38332 > localhost.7777: UDP, length 4
09:13:01.542054 IP localhost.57722 > localhost.7777: UDP, length 4
09:13:01.553614 IP localhost.33649 > localhost.7777: UDP, length 4
09:13:01.562738 IP localhost.57553 > localhost.7777: UDP, length 4
09:13:01.574365 IP localhost.49982 > localhost.7777: UDP, length 4
09:13:01.585299 IP localhost.48646 > localhost.7777: UDP, length 4
09:13:01.593654 IP localhost.33279 > localhost.7777: UDP, length 4
09:13:01.605540 IP localhost.44371 > localhost.7777: UDP, length 4
09:13:01.617040 IP localhost.58642 > localhost.7777: UDP, length 4
09:13:01.626908 IP localhost.52539 > localhost.7777: UDP, length 4
09:13:01.639077 IP localhost.53638 > localhost.7777: UDP, length 4
09:13:01.648097 IP localhost.47037 > localhost.7777: UDP, length 4
09:13:01.661055 IP localhost.48574 > localhost.7777: UDP, length 4
09:13:01.677070 IP localhost.37512 > localhost.7777: UDP, length 4
09:13:01.689063 IP localhost.44874 > localhost.7777: UDP, length 4
09:13:01.701211 IP localhost.37994 > localhost.7777: UDP, length 4
09:13:01.710961 IP localhost.52549 > localhost.7777: UDP, length 4
09:13:01.722735 IP localhost.42099 > localhost.7777: UDP, length 4
09:13:01.734781 IP localhost.52064 > localhost.7777: UDP, length 4
09:13:01.743112 IP localhost.45319 > localhost.7777: UDP, length 4
09:13:01.754462 IP localhost.50630 > localhost.7777: UDP, length 4
09:13:01.769054 IP localhost.33618 > localhost.7777: UDP, length 4
09:13:01.777689 IP localhost.54970 > localhost.7777: UDP, length 4
09:13:01.789246 IP localhost.58507 > localhost.7777: UDP, length 4
09:13:01.802314 IP localhost.51111 > localhost.7777: UDP, length 4
09:13:01.811485 IP localhost.60242 > localhost.7777: UDP, length 4
09:13:01.823507 IP localhost.46664 > localhost.7777: UDP, length 4
09:13:01.838572 IP localhost.34907 > localhost.7777: UDP, length 4
09:13:01.848368 IP localhost.50703 > localhost.7777: UDP, length 4
09:13:01.861449 IP localhost.37016 > localhost.7777: UDP, length 4
09:13:01.873383 IP localhost.48789 > localhost.7777: UDP, length 4
09:13:01.885343 IP localhost.44432 > localhost.7777: UDP, length 4
09:13:01.893653 IP localhost.57658 > localhost.7777: UDP, length 4
09:13:01.904678 IP localhost.55041 > localhost.7777: UDP, length 4
09:13:01.914453 IP localhost.57038 > localhost.7777: UDP, length 4
09:13:01.926627 IP localhost.39003 > localhost.7777: UDP, length 4
09:13:01.939550 IP localhost.45873 > localhost.7777: UDP, length 4
09:13:01.954571 IP localhost.55458 > localhost.7777: UDP, length 4
09:13:01.970359 IP localhost.37810 > localhost.7777: UDP, length 4
09:13:01.979556 IP localhost.44084 > localhost.7777: UDP, length 4
09:13:02.000091 IP localhost.40594 > localhost.7777: UDP, length 4
09:13:02.014271 IP localhost.37777 > localhost.7777: UDP, length 4
09:13:02.029819 IP localhost.37213 > localhost.7777: UDP, length 4
09:13:02.043911 IP localhost.50750 > localhost.7777: UDP, length 4
09:13:02.057299 IP localhost.50261 > localhost.7777: UDP, length 4
09:13:02.070664 IP localhost.55906 > localhost.7777: UDP, length 4
09:13:02.079310 IP localhost.57079 > localhost.7777: UDP, length 4
09:13:02.090784 IP localhost.52496 > localhost.7777: UDP, length 4
09:13:02.103769 IP localhost.41336 > localhost.7777: UDP, length 4
09:13:02.113770 IP localhost.35381 > localhost.7777: UDP, length 4
09:13:02.125604 IP localhost.57123 > localhost.7777: UDP, length 4
09:13:02.137745 IP localhost.52033 > localhost.7777: UDP, length 4
09:13:02.145861 IP localhost.53820 > localhost.7777: UDP, length 4
09:13:02.158074 IP localhost.38395 > localhost.7777: UDP, length 4
09:13:02.169573 IP localhost.53338 > localhost.7777: UDP, length 4
09:13:02.177852 IP localhost.53194 > localhost.7777: UDP, length 4
09:13:02.188999 IP localhost.56310 > localhost.7777: UDP, length 4
09:13:02.201663 IP localhost.58882 > localhost.7777: UDP, length 4
09:13:02.210360 IP localhost.55005 > localhost.7777: UDP, length 4
09:13:02.221512 IP localhost.60312 > localhost.7777: UDP, length 4
09:13:02.229753 IP localhost.48485 > localhost.7777: UDP, length 4
09:13:02.240630 IP localhost.57082 > localhost.7777: UDP, length 4
09:13:02.251867 IP localhost.37426 > localhost.7777: UDP, length 4
09:13:02.260765 IP localhost.41757 > localhost.7777: UDP, length 4
09:13:02.271990 IP localhost.44884 > localhost.7777: UDP, length 4
09:13:02.282263 IP localhost.56205 > localhost.7777: UDP, length 4
09:13:02.292678 IP localhost.45554 > localhost.7777: UDP, length 4
09:13:02.303287 IP localhost.36946 > localhost.7777: UDP, length 4
09:13:02.312632 IP localhost.41274 > localhost.7777: UDP, length 4
09:13:02.323254 IP localhost.35105 > localhost.7777: UDP, length 4
09:13:02.334337 IP localhost.42978 > localhost.7777: UDP, length 4
09:13:02.343901 IP localhost.41684 > localhost.7777: UDP, length 4
09:13:02.355199 IP localhost.39916 > localhost.7777: UDP, length 4
09:13:02.367574 IP localhost.51116 > localhost.7777: UDP, length 4
09:13:02.376606 IP localhost.60584 > localhost.7777: UDP, length 4
09:13:02.388686 IP localhost.44661 > localhost.7777: UDP, length 4
09:13:02.396822 IP localhost.35934 > localhost.7777: UDP, length 4
09:13:02.409453 IP localhost.45223 > localhost.7777: UDP, length 4
09:13:02.420628 IP localhost.53692 > localhost.7777: UDP, length 4
09:13:02.429091 IP localhost.35620 > localhost.7777: UDP, length 4
09:13:02.441522 IP localhost.45035 > localhost.7777: UDP, length 4
09:13:02.452953 IP localhost.49076 > localhost.7777: UDP, length 4
09:13:02.462127 IP localhost.35928 > localhost.7777: UDP, length 4
09:13:02.473501 IP localhost.49649 > localhost.7777: UDP, length 4
09:13:02.484661 IP localhost.44703 > localhost.7777: UDP, length 4
09:13:02.493471 IP localhost.49277 > localhost.7777: UDP, length 4
09:13:02.504840 IP localhost.33145 > localhost.7777: UDP, length 4
09:13:02.513655 IP localhost.53462 > localhost.7777: UDP, length 4
09:13:02.524820 IP localhost.57368 > localhost.7777: UDP, length 4
09:13:02.535677 IP localhost.60748 > localhost.7777: UDP, length 4
09:13:02.544641 IP localhost.49060 > localhost.7777: UDP, length 4
09:13:02.556943 IP localhost.40150 > localhost.7777: UDP, length 4
09:13:02.569646 IP localhost.33003 > localhost.7777: UDP, length 4
09:13:02.577669 IP localhost.36629 > localhost.7777: UDP, length 4
09:13:02.589439 IP localhost.59193 > localhost.7777: UDP, length 4
09:13:02.599164 IP localhost.42491 > localhost.7777: UDP, length 4
09:13:02.611618 IP localhost.32927 > localhost.7777: UDP, length 4
09:13:02.624217 IP localhost.38542 > localhost.7777: UDP, length 4
09:13:02.635510 IP localhost.49668 > localhost.7777: UDP, length 4
09:13:02.644367 IP localhost.51225 > localhost.7777: UDP, length 4
09:13:02.655366 IP localhost.42480 > localhost.7777: UDP, length 4
09:13:02.663509 IP localhost.60742 > localhost.7777: UDP, length 4
09:13:02.675060 IP localhost.60335 > localhost.7777: UDP, length 4
09:13:02.686156 IP localhost.43883 > localhost.7777: UDP, length 4
09:13:02.694816 IP localhost.45882 > localhost.7777: UDP, length 4
09:13:02.705761 IP localhost.32793 > localhost.7777: UDP, length 4
09:13:02.718442 IP localhost.49210 > localhost.7777: UDP, length 4
09:13:02.727296 IP localhost.53093 > localhost.7777: UDP, length 4
09:13:02.738796 IP localhost.47296 > localhost.7777: UDP, length 4
09:13:02.750956 IP localhost.60249 > localhost.7777: UDP, length 4
09:13:02.760967 IP localhost.41115 > localhost.7777: UDP, length 4
09:13:02.772970 IP localhost.59961 > localhost.7777: UDP, length 4
09:13:02.785422 IP localhost.50373 > localhost.7777: UDP, length 4
09:13:02.793881 IP localhost.33889 > localhost.7777: UDP, length 4
09:13:02.805348 IP localhost.59024 > localhost.7777: UDP, length 4
09:13:02.816610 IP localhost.41777 > localhost.7777: UDP, length 4
09:13:02.829059 IP localhost.59687 > localhost.7777: UDP, length 4
09:13:02.841092 IP localhost.49921 > localhost.7777: UDP, length 4
09:13:02.852674 IP localhost.34439 > localhost.7777: UDP, length 4
09:13:02.861532 IP localhost.55247 > localhost.7777: UDP, length 4
09:13:02.873521 IP localhost.52085 > localhost.7777: UDP, length 4
09:13:02.885906 IP localhost.56266 > localhost.7777: UDP, length 4
09:13:02.894161 IP localhost.42769 > localhost.7777: UDP, length 4
09:13:02.905540 IP localhost.56660 > localhost.7777: UDP, length 4
09:13:02.916769 IP localhost.36660 > localhost.7777: UDP, length 4
09:13:02.926734 IP localhost.44888 > localhost.7777: UDP, length 4
09:13:02.938979 IP localhost.60963 > localhost.7777: UDP, length 4
09:13:02.949125 IP localhost.54973 > localhost.7777: UDP, length 4
09:13:02.960702 IP localhost.60237 > localhost.7777: UDP, length 4
09:13:02.976356 IP localhost.48044 > localhost.7777: UDP, length 4
09:13:02.999890 IP localhost.59325 > localhost.7777: UDP, length 4
09:13:03.019142 IP localhost.34913 > localhost.7777: UDP, length 4
09:13:03.035091 IP localhost.34412 > localhost.7777: UDP, length 4
09:13:03.045470 IP localhost.49302 > localhost.7777: UDP, length 4
09:13:03.058082 IP localhost.52360 > localhost.7777: UDP, length 4
09:13:03.071377 IP localhost.52044 > localhost.7777: UDP, length 4
09:13:03.082781 IP localhost.33119 > localhost.7777: UDP, length 4
09:13:03.092742 IP localhost.57506 > localhost.7777: UDP, length 4
09:13:03.103228 IP localhost.37945 > localhost.7777: UDP, length 4
09:13:03.112931 IP localhost.37776 > localhost.7777: UDP, length 4
09:13:03.125521 IP localhost.52510 > localhost.7777: UDP, length 4
09:13:03.137469 IP localhost.39721 > localhost.7777: UDP, length 4
09:13:03.145573 IP localhost.37984 > localhost.7777: UDP, length 4
09:13:03.157159 IP localhost.57030 > localhost.7777: UDP, length 4
09:13:03.168993 IP localhost.59600 > localhost.7777: UDP, length 4
09:13:03.177248 IP localhost.44959 > localhost.7777: UDP, length 4
09:13:03.188529 IP localhost.44971 > localhost.7777: UDP, length 4
09:13:03.196590 IP localhost.58984 > localhost.7777: UDP, length 4
09:13:03.207448 IP localhost.42388 > localhost.7777: UDP, length 4
09:13:03.219466 IP localhost.46476 > localhost.7777: UDP, length 4
09:13:03.227728 IP localhost.33752 > localhost.7777: UDP, length 4
09:13:03.239504 IP localhost.58755 > localhost.7777: UDP, length 4
09:13:03.251406 IP localhost.37023 > localhost.7777: UDP, length 4
09:13:03.260552 IP localhost.36125 > localhost.7777: UDP, length 4
09:13:03.273632 IP localhost.58463 > localhost.7777: UDP, length 4
09:13:03.286177 IP localhost.48254 > localhost.7777: UDP, length 4
09:13:03.295002 IP localhost.37014 > localhost.7777: UDP, length 4
09:13:03.306458 IP localhost.55366 > localhost.7777: UDP, length 4
09:13:03.319133 IP localhost.57578 > localhost.7777: UDP, length 4
09:13:03.327394 IP localhost.43698 > localhost.7777: UDP, length 4
09:13:03.338689 IP localhost.58445 > localhost.7777: UDP, length 4
09:13:03.348399 IP localhost.57652 > localhost.7777: UDP, length 4
09:13:03.359367 IP localhost.53771 > localhost.7777: UDP, length 4
09:13:03.371624 IP localhost.45751 > localhost.7777: UDP, length 4
09:13:03.382423 IP localhost.48296 > localhost.7777: UDP, length 4
09:13:03.393106 IP localhost.49378 > localhost.7777: UDP, length 4
09:13:03.405053 IP localhost.58343 > localhost.7777: UDP, length 4
09:13:03.417772 IP localhost.59303 > localhost.7777: UDP, length 4
09:13:03.426798 IP localhost.34600 > localhost.7777: UDP, length 4
09:13:03.438742 IP localhost.49746 > localhost.7777: UDP, length 4
09:13:03.448534 IP localhost.49638 > localhost.7777: UDP, length 4
09:13:03.459271 IP localhost.49200 > localhost.7777: UDP, length 4
09:13:03.470964 IP localhost.46895 > localhost.7777: UDP, length 4
09:13:03.480204 IP localhost.40136 > localhost.7777: UDP, length 4
09:13:03.492630 IP localhost.52364 > localhost.7777: UDP, length 4
09:13:03.504149 IP localhost.53405 > localhost.7777: UDP, length 4
09:13:03.514040 IP localhost.36019 > localhost.7777: UDP, length 4
09:13:03.525528 IP localhost.45452 > localhost.7777: UDP, length 4
09:13:03.537549 IP localhost.37345 > localhost.7777: UDP, length 4
09:13:03.545728 IP localhost.42836 > localhost.7777: UDP, length 4
09:13:03.557077 IP localhost.33825 > localhost.7777: UDP, length 4
09:13:03.568747 IP localhost.53045 > localhost.7777: UDP, length 4
09:13:03.577060 IP localhost.59100 > localhost.7777: UDP, length 4
09:13:03.588462 IP localhost.48927 > localhost.7777: UDP, length 4
09:13:03.596652 IP localhost.48016 > localhost.7777: UDP, length 4
09:13:03.609001 IP localhost.38283 > localhost.7777: UDP, length 4
09:13:03.619899 IP localhost.39030 > localhost.7777: UDP, length 4
09:13:03.628659 IP localhost.37802 > localhost.7777: UDP, length 4
09:13:03.640982 IP localhost.56341 > localhost.7777: UDP, length 4
09:13:03.652751 IP localhost.45658 > localhost.7777: UDP, length 4
09:13:03.661521 IP localhost.46373 > localhost.7777: UDP, length 4
09:13:03.673849 IP localhost.43794 > localhost.7777: UDP, length 4
09:13:03.685632 IP localhost.59034 > localhost.7777: UDP, length 4
09:13:03.697870 IP localhost.36446 > localhost.7777: UDP, length 4
09:13:03.709616 IP localhost.50582 > localhost.7777: UDP, length 4
09:13:03.721605 IP localhost.56209 > localhost.7777: UDP, length 4
09:13:03.730084 IP localhost.47066 > localhost.7777: UDP, length 4
09:13:03.741478 IP localhost.36067 > localhost.7777: UDP, length 4
09:13:03.752724 IP localhost.54089 > localhost.7777: UDP, length 4
09:13:03.762458 IP localhost.57247 > localhost.7777: UDP, length 4
09:13:03.774001 IP localhost.50112 > localhost.7777: UDP, length 4
09:13:03.785769 IP localhost.35769 > localhost.7777: UDP, length 4
09:13:03.794329 IP localhost.33443 > localhost.7777: UDP, length 4
09:13:03.805814 IP localhost.45854 > localhost.7777: UDP, length 4
09:13:03.818805 IP localhost.47858 > localhost.7777: UDP, length 4
09:13:03.829063 IP localhost.41464 > localhost.7777: UDP, length 4
09:13:03.842918 IP localhost.50197 > localhost.7777: UDP, length 4
09:13:03.854241 IP localhost.56703 > localhost.7777: UDP, length 4
09:13:03.864017 IP localhost.35879 > localhost.7777: UDP, length 4
09:13:03.875429 IP localhost.37760 > localhost.7777: UDP, length 4
09:13:03.887186 IP localhost.55681 > localhost.7777: UDP, length 4
09:13:03.895834 IP localhost.35979 > localhost.7777: UDP, length 4
09:13:03.906890 IP localhost.52886 > localhost.7777: UDP, length 4
09:13:03.920744 IP localhost.36281 > localhost.7777: UDP, length 4
09:13:03.929237 IP localhost.40197 > localhost.7777: UDP, length 4
09:13:03.940910 IP localhost.48824 > localhost.7777: UDP, length 4
09:13:03.953202 IP localhost.37644 > localhost.7777: UDP, length 4
09:13:03.962526 IP localhost.42036 > localhost.7777: UDP, length 4
09:13:03.974106 IP localhost.33470 > localhost.7777: UDP, length 4
09:13:03.989427 IP localhost.34750 > localhost.7777: UDP, length 4
09:13:04.020835 IP localhost.35898 > localhost.7777: UDP, length 4
09:13:04.036045 IP localhost.57164 > localhost.7777: UDP, length 4
09:13:04.049018 IP localhost.57747 > localhost.7777: UDP, length 4
09:13:04.060894 IP localhost.40614 > localhost.7777: UDP, length 4
09:13:04.073960 IP localhost.34343 > localhost.7777: UDP, length 4
09:13:04.085815 IP localhost.41233 > localhost.7777: UDP, length 4
09:13:04.094018 IP localhost.50192 > localhost.7777: UDP, length 4
09:13:04.104806 IP localhost.49068 > localhost.7777: UDP, length 4
09:13:04.118449 IP localhost.40990 > localhost.7777: UDP, length 4
09:13:04.127252 IP localhost.37195 > localhost.7777: UDP, length 4
09:13:04.138475 IP localhost.43883 > localhost.7777: UDP, length 4
09:13:04.148641 IP localhost.56121 > localhost.7777: UDP, length 4
09:13:04.160190 IP localhost.40179 > localhost.7777: UDP, length 4
09:13:04.171530 IP localhost.48723 > localhost.7777: UDP, length 4
09:13:04.182915 IP localhost.47342 > localhost.7777: UDP, length 4
09:13:04.193337 IP localhost.60064 > localhost.7777: UDP, length 4
09:13:04.205549 IP localhost.55363 > localhost.7777: UDP, length 4
09:13:04.218801 IP localhost.44216 > localhost.7777: UDP, length 4
09:13:04.227425 IP localhost.41779 > localhost.7777: UDP, length 4
09:13:04.239299 IP localhost.37964 > localhost.7777: UDP, length 4
09:13:04.251019 IP localhost.50739 > localhost.7777: UDP, length 4
09:13:04.260278 IP localhost.55455 > localhost.7777: UDP, length 4
09:13:04.270573 IP localhost.41676 > localhost.7777: UDP, length 4
09:13:04.280002 IP localhost.46117 > localhost.7777: UDP, length 4
09:13:04.291879 IP localhost.46474 > localhost.7777: UDP, length 4
09:13:04.303096 IP localhost.56040 > localhost.7777: UDP, length 4
09:13:04.311926 IP localhost.56549 > localhost.7777: UDP, length 4
09:13:04.324645 IP localhost.33745 > localhost.7777: UDP, length 4
09:13:04.336577 IP localhost.44369 > localhost.7777: UDP, length 4
09:13:04.345245 IP localhost.44498 > localhost.7777: UDP, length 4
09:13:04.357103 IP localhost.44683 > localhost.7777: UDP, length 4
09:13:04.370119 IP localhost.36172 > localhost.7777: UDP, length 4
09:13:04.378224 IP localhost.37691 > localhost.7777: UDP, length 4
09:13:04.388884 IP localhost.49987 > localhost.7777: UDP, length 4
09:13:04.399393 IP localhost.43371 > localhost.7777: UDP, length 4
09:13:04.409005 IP localhost.49449 > localhost.7777: UDP, length 4
09:13:04.420317 IP localhost.41604 > localhost.7777: UDP, length 4
09:13:04.428753 IP localhost.38375 > localhost.7777: UDP, length 4
09:13:04.440620 IP localhost.60845 > localhost.7777: UDP, length 4
09:13:04.452380 IP localhost.37523 > localhost.7777: UDP, length 4
09:13:04.460934 IP localhost.43849 > localhost.7777: UDP, length 4
09:13:04.471580 IP localhost.57872 > localhost.7777: UDP, length 4
09:13:04.481684 IP localhost.59137 > localhost.7777: UDP, length 4
09:13:04.492699 IP localhost.41663 > localhost.7777: UDP, length 4
09:13:04.503143 IP localhost.32952 > localhost.7777: UDP, length 4
09:13:04.511531 IP localhost.52173 > localhost.7777: UDP, length 4
09:13:04.523631 IP localhost.57081 > localhost.7777: UDP, length 4
09:13:04.535523 IP localhost.49342 > localhost.7777: UDP, length 4
09:13:04.544533 IP localhost.53335 > localhost.7777: UDP, length 4
09:13:04.554903 IP localhost.54190 > localhost.7777: UDP, length 4
09:13:04.563662 IP localhost.50519 > localhost.7777: UDP, length 4
09:13:04.575347 IP localhost.54913 > localhost.7777: UDP, length 4
09:13:04.586964 IP localhost.46777 > localhost.7777: UDP, length 4
09:13:04.595157 IP localhost.60945 > localhost.7777: UDP, length 4
09:13:04.606721 IP localhost.46611 > localhost.7777: UDP, length 4
09:13:04.620117 IP localhost.47656 > localhost.7777: UDP, length 4
09:13:04.629006 IP localhost.37933 > localhost.7777: UDP, length 4
09:13:04.639379 IP localhost.44233 > localhost.7777: UDP, length 4
09:13:04.650860 IP localhost.46762 > localhost.7777: UDP, length 4
09:13:04.659355 IP localhost.55235 > localhost.7777: UDP, length 4
09:13:04.670849 IP localhost.35287 > localhost.7777: UDP, length 4
09:13:04.679056 IP localhost.54691 > localhost.7777: UDP, length 4
09:13:04.690643 IP localhost.45070 > localhost.7777: UDP, length 4
09:13:04.703170 IP localhost.33331 > localhost.7777: UDP, length 4
09:13:04.712714 IP localhost.53223 > localhost.7777: UDP, length 4
09:13:04.724706 IP localhost.60797 > localhost.7777: UDP, length 4
09:13:04.736752 IP localhost.57552 > localhost.7777: UDP, length 4
09:13:04.745250 IP localhost.51618 > localhost.7777: UDP, length 4
09:13:04.756690 IP localhost.36200 > localhost.7777: UDP, length 4
09:13:04.769990 IP localhost.36290 > localhost.7777: UDP, length 4
09:13:04.778935 IP localhost.39940 > localhost.7777: UDP, length 4
09:13:04.789848 IP localhost.51257 > localhost.7777: UDP, length 4
09:13:04.800320 IP localhost.43079 > localhost.7777: UDP, length 4
09:13:04.810674 IP localhost.41975 > localhost.7777: UDP, length 4
09:13:04.823509 IP localhost.35899 > localhost.7777: UDP, length 4
09:13:04.837175 IP localhost.44812 > localhost.7777: UDP, length 4
09:13:04.845388 IP localhost.41878 > localhost.7777: UDP, length 4
09:13:04.856749 IP localhost.37583 > localhost.7777: UDP, length 4
09:13:04.870023 IP localhost.51047 > localhost.7777: UDP, length 4
09:13:04.878188 IP localhost.38454 > localhost.7777: UDP, length 4
09:13:04.889456 IP localhost.45756 > localhost.7777: UDP, length 4
09:13:04.899610 IP localhost.34609 > localhost.7777: UDP, length 4
09:13:04.909486 IP localhost.35157 > localhost.7777: UDP, length 4
09:13:04.921214 IP localhost.44752 > localhost.7777: UDP, length 4
09:13:04.930126 IP localhost.43645 > localhost.7777: UDP, length 4
09:13:04.941484 IP localhost.36039 > localhost.7777: UDP, length 4
09:13:04.952858 IP localhost.58322 > localhost.7777: UDP, length 4
09:13:04.961416 IP localhost.53161 > localhost.7777: UDP, length 4
09:13:04.973791 IP localhost.50748 > localhost.7777: UDP, length 4
09:13:04.985852 IP localhost.46763 > localhost.7777: UDP, length 4
09:13:05.003067 IP localhost.38709 > localhost.7777: UDP, length 4
09:13:05.023638 IP localhost.57606 > localhost.7777: UDP, length 4
09:13:05.043306 IP localhost.59061 > localhost.7777: UDP, length 4
09:13:05.056913 IP localhost.54381 > localhost.7777: UDP, length 4
09:13:05.071232 IP localhost.49454 > localhost.7777: UDP, length 4
09:13:05.082849 IP localhost.58354 > localhost.7777: UDP, length 4
09:13:05.092913 IP localhost.52349 > localhost.7777: UDP, length 4
09:13:05.104947 IP localhost.53425 > localhost.7777: UDP, length 4
09:13:05.118419 IP localhost.54209 > localhost.7777: UDP, length 4
09:13:05.127109 IP localhost.35333 > localhost.7777: UDP, length 4
09:13:05.137846 IP localhost.38584 > localhost.7777: UDP, length 4
09:13:05.147459 IP localhost.57279 > localhost.7777: UDP, length 4
09:13:05.159557 IP localhost.47194 > localhost.7777: UDP, length 4
09:13:05.171303 IP localhost.59904 > localhost.7777: UDP, length 4
09:13:05.179393 IP localhost.46273 > localhost.7777: UDP, length 4
09:13:05.190600 IP localhost.41088 > localhost.7777: UDP, length 4
09:13:05.203167 IP localhost.36162 > localhost.7777: UDP, length 4
09:13:05.212497 IP localhost.46402 > localhost.7777: UDP, length 4
09:13:05.223608 IP localhost.60509 > localhost.7777: UDP, length 4
09:13:05.235053 IP localhost.55797 > localhost.7777: UDP, length 4
09:13:05.243622 IP localhost.58253 > localhost.7777: UDP, length 4
09:13:05.254808 IP localhost.52120 > localhost.7777: UDP, length 4
09:13:05.266845 IP localhost.37684 > localhost.7777: UDP, length 4
09:13:05.276396 IP localhost.40885 > localhost.7777: UDP, length 4
09:13:05.287241 IP localhost.44080 > localhost.7777: UDP, length 4
09:13:05.295257 IP localhost.55999 > localhost.7777: UDP, length 4
09:13:05.308068 IP localhost.51178 > localhost.7777: UDP, length 4
09:13:05.319577 IP localhost.36449 > localhost.7777: UDP, length 4
09:13:05.327661 IP localhost.42236 > localhost.7777: UDP, length 4
09:13:05.340562 IP localhost.56840 > localhost.7777: UDP, length 4
09:13:05.351349 IP localhost.37560 > localhost.7777: UDP, length 4
09:13:05.360364 IP localhost.43682 > localhost.7777: UDP, length 4
09:13:05.372519 IP localhost.49633 > localhost.7777: UDP, length 4
09:13:05.383356 IP localhost.47240 > localhost.7777: UDP, length 4
09:13:05.393097 IP localhost.32991 > localhost.7777: UDP, length 4
09:13:05.404323 IP localhost.50807 > localhost.7777: UDP, length 4
09:13:05.412704 IP localhost.37291 > localhost.7777: UDP, length 4
09:13:05.425125 IP localhost.36140 > localhost.7777: UDP, length 4
09:13:05.436787 IP localhost.46666 > localhost.7777: UDP, length 4
09:13:05.444848 IP localhost.33954 > localhost.7777: UDP, length 4
09:13:05.456247 IP localhost.51095 > localhost.7777: UDP, length 4
09:13:05.468848 IP localhost.39628 > localhost.7777: UDP, length 4
09:13:05.478174 IP localhost.55942 > localhost.7777: UDP, length 4
09:13:05.489991 IP localhost.50134 > localhost.7777: UDP, length 4
09:13:05.500920 IP localhost.55521 > localhost.7777: UDP, length 4
09:13:05.509240 IP localhost.38930 > localhost.7777: UDP, length 4
09:13:05.521276 IP localhost.34471 > localhost.7777: UDP, length 4
09:13:05.532527 IP localhost.59965 > localhost.7777: UDP, length 4
09:13:05.544997 IP localhost.33835 > localhost.7777: UDP, length 4
09:13:05.557112 IP localhost.52102 > localhost.7777: UDP, length 4
09:13:05.569221 IP localhost.56007 > localhost.7777: UDP, length 4
09:13:05.577830 IP localhost.44648 > localhost.7777: UDP, length 4
09:13:05.590311 IP localhost.53730 > localhost.7777: UDP, length 4
09:13:05.602311 IP localhost.54200 > localhost.7777: UDP, length 4
09:13:05.611525 IP localhost.49998 > localhost.7777: UDP, length 4
09:13:05.623242 IP localhost.33493 > localhost.7777: UDP, length 4
09:13:05.635380 IP localhost.52033 > localhost.7777: UDP, length 4
09:13:05.644404 IP localhost.45949 > localhost.7777: UDP, length 4
09:13:05.655317 IP localhost.47783 > localhost.7777: UDP, length 4
09:13:05.665401 IP localhost.52334 > localhost.7777: UDP, length 4
09:13:05.675382 IP localhost.54756 > localhost.7777: UDP, length 4
09:13:05.688617 IP localhost.55832 > localhost.7777: UDP, length 4
09:13:05.699092 IP localhost.43135 > localhost.7777: UDP, length 4
09:13:05.712384 IP localhost.51123 > localhost.7777: UDP, length 4
09:13:05.723521 IP localhost.41388 > localhost.7777: UDP, length 4
09:13:05.736031 IP localhost.52594 > localhost.7777: UDP, length 4
09:13:05.744527 IP localhost.33190 > localhost.7777: UDP, length 4
09:13:05.755073 IP localhost.50386 > localhost.7777: UDP, length 4
09:13:05.767714 IP localhost.48410 > localhost.7777: UDP, length 4
09:13:05.776756 IP localhost.39564 > localhost.7777: UDP, length 4
09:13:05.788634 IP localhost.33826 > localhost.7777: UDP, length 4
09:13:05.801542 IP localhost.47585 > localhost.7777: UDP, length 4
09:13:05.810270 IP localhost.47564 > localhost.7777: UDP, length 4
09:13:05.823925 IP localhost.57967 > localhost.7777: UDP, length 4
09:13:05.839198 IP localhost.45400 > localhost.7777: UDP, length 4
09:13:05.850426 IP localhost.40581 > localhost.7777: UDP, length 4
09:13:05.859331 IP localhost.46821 > localhost.7777: UDP, length 4
09:13:05.870680 IP localhost.44839 > localhost.7777: UDP, length 4
09:13:05.880445 IP localhost.42634 > localhost.7777: UDP, length 4
09:13:05.891543 IP localhost.50599 > localhost.7777: UDP, length 4
09:13:05.902637 IP localhost.56547 > localhost.7777: UDP, length 4
09:13:05.912409 IP localhost.50449 > localhost.7777: UDP, length 4
09:13:05.925250 IP localhost.44758 > localhost.7777: UDP, length 4
09:13:05.937438 IP localhost.56258 > localhost.7777: UDP, length 4
09:13:05.945902 IP localhost.46256 > localhost.7777: UDP, length 4
09:13:05.958016 IP localhost.39939 > localhost.7777: UDP, length 4
09:13:05.969539 IP localhost.44952 > localhost.7777: UDP, length 4
09:13:05.977674 IP localhost.40772 > localhost.7777: UDP, length 4
09:13:05.989368 IP localhost.36705 > localhost.7777: UDP, length 4
09:13:06.008674 IP localhost.41064 > localhost.7777: UDP, length 4
09:13:06.022790 IP localhost.56181 > localhost.7777: UDP, length 4
09:13:06.038242 IP localhost.58562 > localhost.7777: UDP, length 4
09:13:06.057746 IP localhost.52089 > localhost.7777: UDP, length 4
09:13:06.074290 IP localhost.58873 > localhost.7777: UDP, length 4
09:13:06.086694 IP localhost.55400 > localhost.7777: UDP, length 4
09:13:06.095269 IP localhost.55818 > localhost.7777: UDP, length 4
09:13:06.106773 IP localhost.58894 > localhost.7777: UDP, length 4
09:13:06.119146 IP localhost.52157 > localhost.7777: UDP, length 4
09:13:06.127940 IP localhost.38022 > localhost.7777: UDP, length 4
09:13:06.139410 IP localhost.39572 > localhost.7777: UDP, length 4
09:13:06.149517 IP localhost.53396 > localhost.7777: UDP, length 4
09:13:06.159850 IP localhost.48573 > localhost.7777: UDP, length 4
09:13:06.171993 IP localhost.49261 > localhost.7777: UDP, length 4
09:13:06.184077 IP localhost.40202 > localhost.7777: UDP, length 4
09:13:06.192851 IP localhost.40755 > localhost.7777: UDP, length 4
09:13:06.203931 IP localhost.59200 > localhost.7777: UDP, length 4
09:13:06.212671 IP localhost.43209 > localhost.7777: UDP, length 4
09:13:06.224063 IP localhost.35882 > localhost.7777: UDP, length 4
09:13:06.235784 IP localhost.48080 > localhost.7777: UDP, length 4
09:13:06.244719 IP localhost.58605 > localhost.7777: UDP, length 4
09:13:06.256476 IP localhost.40440 > localhost.7777: UDP, length 4
09:13:06.267757 IP localhost.57111 > localhost.7777: UDP, length 4
09:13:06.276620 IP localhost.55940 > localhost.7777: UDP, length 4
09:13:06.287648 IP localhost.39676 > localhost.7777: UDP, length 4
09:13:06.295744 IP localhost.40542 > localhost.7777: UDP, length 4
09:13:06.306802 IP localhost.59033 > localhost.7777: UDP, length 4
09:13:06.318971 IP localhost.46659 > localhost.7777: UDP, length 4
09:13:06.327272 IP localhost.41894 > localhost.7777: UDP, length 4
09:13:06.339465 IP localhost.46390 > localhost.7777: UDP, length 4
09:13:06.351095 IP localhost.44895 > localhost.7777: UDP, length 4
09:13:06.359325 IP localhost.54858 > localhost.7777: UDP, length 4
09:13:06.371039 IP localhost.58506 > localhost.7777: UDP, length 4
09:13:06.382165 IP localhost.44698 > localhost.7777: UDP, length 4
09:13:06.393081 IP localhost.48822 > localhost.7777: UDP, length 4
09:13:06.405379 IP localhost.40283 > localhost.7777: UDP, length 4
09:13:06.417502 IP localhost.43665 > localhost.7777: UDP, length 4
09:13:06.425836 IP localhost.36395 > localhost.7777: UDP, length 4
09:13:06.437857 IP localhost.47079 > localhost.7777: UDP, length 4
09:13:06.448396 IP localhost.40965 > localhost.7777: UDP, length 4
09:13:06.459717 IP localhost.39965 > localhost.7777: UDP, length 4
09:13:06.470995 IP localhost.58813 > localhost.7777: UDP, length 4
09:13:06.482469 IP localhost.45934 > localhost.7777: UDP, length 4
09:13:06.492643 IP localhost.60852 > localhost.7777: UDP, length 4
09:13:06.505866 IP localhost.57023 > localhost.7777: UDP, length 4
09:13:06.521299 IP localhost.48287 > localhost.7777: UDP, length 4
09:13:06.535604 IP localhost.36414 > localhost.7777: UDP, length 4
09:13:06.550038 IP localhost.35209 > localhost.7777: UDP, length 4
09:13:06.567739 IP localhost.53810 > localhost.7777: UDP, length 4
09:13:06.582102 IP localhost.54720 > localhost.7777: UDP, length 4
09:13:06.594078 IP localhost.46131 > localhost.7777: UDP, length 4
09:13:06.608842 IP localhost.41560 > localhost.7777: UDP, length 4
09:13:06.621805 IP localhost.36914 > localhost.7777: UDP, length 4
09:13:06.634042 IP localhost.51092 > localhost.7777: UDP, length 4
09:13:06.642960 IP localhost.45626 > localhost.7777: UDP, length 4
09:13:06.654997 IP localhost.35706 > localhost.7777: UDP, length 4
09:13:06.667591 IP localhost.38185 > localhost.7777: UDP, length 4
09:13:06.676957 IP localhost.44481 > localhost.7777: UDP, length 4
09:13:06.688841 IP localhost.38896 > localhost.7777: UDP, length 4
09:13:06.699406 IP localhost.47528 > localhost.7777: UDP, length 4
09:13:06.710370 IP localhost.41635 > localhost.7777: UDP, length 4
09:13:06.722783 IP localhost.53940 > localhost.7777: UDP, length 4
09:13:06.734604 IP localhost.48189 > localhost.7777: UDP, length 4
09:13:06.743166 IP localhost.54849 > localhost.7777: UDP, length 4
09:13:06.754496 IP localhost.54617 > localhost.7777: UDP, length 4
09:13:06.766136 IP localhost.51723 > localhost.7777: UDP, length 4
09:13:06.775240 IP localhost.53503 > localhost.7777: UDP, length 4
09:13:06.786976 IP localhost.59360 > localhost.7777: UDP, length 4
09:13:06.795290 IP localhost.46870 > localhost.7777: UDP, length 4
09:13:06.807731 IP localhost.57776 > localhost.7777: UDP, length 4
09:13:06.819682 IP localhost.52710 > localhost.7777: UDP, length 4
09:13:06.832324 IP localhost.60538 > localhost.7777: UDP, length 4
09:13:06.842950 IP localhost.35559 > localhost.7777: UDP, length 4
09:13:06.854963 IP localhost.36417 > localhost.7777: UDP, length 4
09:13:06.866972 IP localhost.57236 > localhost.7777: UDP, length 4
09:13:06.876512 IP localhost.49304 > localhost.7777: UDP, length 4
09:13:06.887424 IP localhost.48117 > localhost.7777: UDP, length 4
09:13:06.898933 IP localhost.39972 > localhost.7777: UDP, length 4
09:13:06.908873 IP localhost.43449 > localhost.7777: UDP, length 4
09:13:06.920552 IP localhost.44460 > localhost.7777: UDP, length 4
09:13:06.929044 IP localhost.57336 > localhost.7777: UDP, length 4
09:13:06.942432 IP localhost.35320 > localhost.7777: UDP, length 4
09:13:06.953651 IP localhost.32925 > localhost.7777: UDP, length 4
09:13:06.962595 IP localhost.45697 > localhost.7777: UDP, length 4
09:13:06.974363 IP localhost.40267 > localhost.7777: UDP, length 4
09:13:06.990477 IP localhost.48309 > localhost.7777: UDP, length 4
09:13:07.007335 IP localhost.49622 > localhost.7777: UDP, length 4
09:13:07.022174 IP localhost.60450 > localhost.7777: UDP, length 4
09:13:07.038219 IP localhost.58060 > localhost.7777: UDP, length 4
09:13:07.052413 IP localhost.38885 > localhost.7777: UDP, length 4
09:13:07.066708 IP localhost.52642 > localhost.7777: UDP, length 4
09:13:07.089533 IP localhost.50203 > localhost.7777: UDP, length 4
09:13:07.100524 IP localhost.34261 > localhost.7777: UDP, length 4
09:13:07.109474 IP localhost.37436 > localhost.7777: UDP, length 4
09:13:07.122003 IP localhost.52052 > localhost.7777: UDP, length 4
09:13:07.134200 IP localhost.33095 > localhost.7777: UDP, length 4
09:13:07.143100 IP localhost.44559 > localhost.7777: UDP, length 4
09:13:07.155060 IP localhost.55314 > localhost.7777: UDP, length 4
09:13:07.166146 IP localhost.52824 > localhost.7777: UDP, length 4
09:13:07.175212 IP localhost.37113 > localhost.7777: UDP, length 4
09:13:07.186382 IP localhost.58079 > localhost.7777: UDP, length 4
09:13:07.194389 IP localhost.50869 > localhost.7777: UDP, length 4
09:13:07.206174 IP localhost.35032 > localhost.7777: UDP, length 4
09:13:07.218975 IP localhost.44691 > localhost.7777: UDP, length 4
09:13:07.227233 IP localhost.47872 > localhost.7777: UDP, length 4
09:13:07.238544 IP localhost.55716 > localhost.7777: UDP, length 4
09:13:07.250652 IP localhost.52066 > localhost.7777: UDP, length 4
09:13:07.259233 IP localhost.46083 > localhost.7777: UDP, length 4
09:13:07.271049 IP localhost.47784 > localhost.7777: UDP, length 4
09:13:07.280186 IP localhost.56660 > localhost.7777: UDP, length 4
09:13:07.291433 IP localhost.52811 > localhost.7777: UDP, length 4
09:13:07.303258 IP localhost.32956 > localhost.7777: UDP, length 4
09:13:07.313118 IP localhost.58400 > localhost.7777: UDP, length 4
