10:09:45.200259 IP 192.168.0.100.49868 > overload.7777: UDP, length 4
10:09:45.207117 IP 192.168.0.100.51556 > overload.6666: UDP, length 4
10:09:45.212237 IP 192.168.0.100.37294 > overload.6666: UDP, length 4
10:09:45.215222 IP 192.168.0.100.40810 > overload.6666: UDP, length 4
10:09:45.218181 IP 192.168.0.100.47287 > overload.6666: UDP, length 4
10:09:45.221340 IP 192.168.0.100.59470 > overload.6666: UDP, length 4
10:09:45.224433 IP 192.168.0.100.32786 > overload.6666: UDP, length 4
10:09:45.227641 IP 192.168.0.100.33778 > overload.6666: UDP, length 4
10:09:45.231079 IP 192.168.0.100.56536 > overload.6666: UDP, length 4
10:09:45.235031 IP 192.168.0.100.41650 > overload.6666: UDP, length 4
10:09:45.238828 IP 192.168.0.100.41702 > overload.6666: UDP, length 4
10:09:45.243038 IP 192.168.0.100.54643 > overload.6666: UDP, length 4
10:09:45.247209 IP 192.168.0.100.37606 > overload.6666: UDP, length 4
10:09:45.251876 IP 192.168.0.100.44267 > overload.6666: UDP, length 4
10:09:45.255986 IP 192.168.0.100.39728 > overload.6666: UDP, length 4
10:09:45.260054 IP 192.168.0.100.41952 > overload.6666: UDP, length 4
10:09:45.264186 IP 192.168.0.100.42223 > overload.6666: UDP, length 4
10:09:45.268490 IP 192.168.0.100.37257 > overload.6666: UDP, length 4
10:09:45.272564 IP 192.168.0.100.49578 > overload.6666: UDP, length 4
10:09:45.276708 IP 192.168.0.100.56369 > overload.6666: UDP, length 4
10:09:45.280820 IP 192.168.0.100.55276 > overload.6666: UDP, length 4
10:09:45.284994 IP 192.168.0.100.36016 > overload.6666: UDP, length 4
10:09:45.285496 IP 192.168.0.100.49354 > overload.7777: UDP, length 4
10:09:45.285526 IP 192.168.0.100.54611 > overload.7777: UDP, length 4
10:09:45.285530 IP 192.168.0.100.53294 > overload.7777: UDP, length 4
10:09:45.285534 IP 192.168.0.100.52085 > overload.7777: UDP, length 4
10:09:45.285537 IP 192.168.0.100.51961 > overload.7777: UDP, length 4
10:09:45.285541 IP 192.168.0.100.37879 > overload.7777: UDP, length 4
10:09:45.285545 IP 192.168.0.100.50148 > overload.7777: UDP, length 4
10:09:45.285548 IP 192.168.0.100.46722 > overload.7777: UDP, length 4
10:09:45.285552 IP 192.168.0.100.35341 > overload.7777: UDP, length 4
10:09:45.285556 IP 192.168.0.100.49202 > overload.7777: UDP, length 4
10:09:45.285559 IP 192.168.0.100.57857 > overload.7777: UDP, length 4
10:09:45.285563 IP 192.168.0.100.49336 > overload.7777: UDP, length 4
10:09:45.285567 IP 192.168.0.100.47155 > overload.7777: UDP, length 4
10:09:45.285570 IP 192.168.0.100.33832 > overload.7777: UDP, length 4
10:09:45.285574 IP 192.168.0.100.60239 > overload.7777: UDP, length 4
10:09:45.285577 IP 192.168.0.100.54785 > overload.7777: UDP, length 4
10:09:45.285582 IP 192.168.0.100.53661 > overload.7777: UDP, length 4
10:09:45.285586 IP 192.168.0.100.51768 > overload.7777: UDP, length 4
10:09:45.285589 IP 192.168.0.100.45176 > overload.7777: UDP, length 4
10:09:45.285593 IP 192.168.0.100.38788 > overload.7777: UDP, length 4
10:09:45.286947 IP 192.168.0.100.54992 > overload.7777: UDP, length 4
10:09:45.290658 IP 192.168.0.100.42426 > overload.7777: UDP, length 4
10:09:45.294810 IP 192.168.0.100.38101 > overload.7777: UDP, length 4
10:09:45.299000 IP 192.168.0.100.58933 > overload.7777: UDP, length 4
10:09:45.303451 IP 192.168.0.100.34487 > overload.7777: UDP, length 4
10:09:45.305479 IP 192.168.0.100.39574 > overload.6666: UDP, length 4
10:09:45.305508 IP 192.168.0.100.57819 > overload.6666: UDP, length 4
10:09:45.305512 IP 192.168.0.100.43001 > overload.6666: UDP, length 4
10:09:45.305515 IP 192.168.0.100.35517 > overload.6666: UDP, length 4
10:09:45.305519 IP 192.168.0.100.34992 > overload.6666: UDP, length 4
10:09:45.309580 IP 192.168.0.100.52971 > overload.6666: UDP, length 4
10:09:45.313895 IP 192.168.0.100.49517 > overload.6666: UDP, length 4
10:09:45.318178 IP 192.168.0.100.42011 > overload.6666: UDP, length 4
10:09:45.322346 IP 192.168.0.100.59160 > overload.6666: UDP, length 4
10:09:45.326447 IP 192.168.0.100.53194 > overload.6666: UDP, length 4
10:09:45.330365 IP 192.168.0.100.41250 > overload.6666: UDP, length 4
10:09:45.334493 IP 192.168.0.100.36523 > overload.6666: UDP, length 4
10:09:45.338688 IP 192.168.0.100.43448 > overload.6666: UDP, length 4
10:09:45.342815 IP 192.168.0.100.44159 > overload.6666: UDP, length 4
10:09:45.346960 IP 192.168.0.100.37938 > overload.6666: UDP, length 4
10:09:45.351479 IP 192.168.0.100.44873 > overload.6666: UDP, length 4
10:09:45.355417 IP 192.168.0.100.37280 > overload.6666: UDP, length 4
10:09:45.359346 IP 192.168.0.100.34839 > overload.6666: UDP, length 4
10:09:45.363571 IP 192.168.0.100.55934 > overload.6666: UDP, length 4
10:09:45.367638 IP 192.168.0.100.35228 > overload.6666: UDP, length 4
10:09:45.371816 IP 192.168.0.100.33533 > overload.6666: UDP, length 4
10:09:45.375889 IP 192.168.0.100.53761 > overload.6666: UDP, length 4
10:09:45.380057 IP 192.168.0.100.35027 > overload.6666: UDP, length 4
10:09:45.384404 IP 192.168.0.100.59029 > overload.6666: UDP, length 4
10:09:45.385598 IP 192.168.0.100.38269 > overload.7777: UDP, length 4
10:09:45.385627 IP 192.168.0.100.45056 > overload.7777: UDP, length 4
10:09:45.385631 IP 192.168.0.100.55737 > overload.7777: UDP, length 4
10:09:45.385635 IP 192.168.0.100.47506 > overload.7777: UDP, length 4
10:09:45.385639 IP 192.168.0.100.53162 > overload.7777: UDP, length 4
10:09:45.385642 IP 192.168.0.100.43994 > overload.7777: UDP, length 4
10:09:45.385646 IP 192.168.0.100.46979 > overload.7777: UDP, length 4
10:09:45.385649 IP 192.168.0.100.35221 > overload.7777: UDP, length 4
10:09:45.385653 IP 192.168.0.100.56021 > overload.7777: UDP, length 4
10:09:45.385657 IP 192.168.0.100.34634 > overload.7777: UDP, length 4
10:09:45.385660 IP 192.168.0.100.36574 > overload.7777: UDP, length 4
10:09:45.385664 IP 192.168.0.100.38192 > overload.7777: UDP, length 4
10:09:45.385667 IP 192.168.0.100.47051 > overload.7777: UDP, length 4
10:09:45.385671 IP 192.168.0.100.37193 > overload.7777: UDP, length 4
10:09:45.385674 IP 192.168.0.100.55815 > overload.7777: UDP, length 4
10:09:45.385678 IP 192.168.0.100.39129 > overload.7777: UDP, length 4
10:09:45.385683 IP 192.168.0.100.38852 > overload.7777: UDP, length 4
10:09:45.385686 IP 192.168.0.100.42738 > overload.7777: UDP, length 4
10:09:45.385690 IP 192.168.0.100.35132 > overload.7777: UDP, length 4
10:09:45.386335 IP 192.168.0.100.42441 > overload.7777: UDP, length 4
10:09:45.390225 IP 192.168.0.100.48390 > overload.7777: UDP, length 4
10:09:45.394529 IP 192.168.0.100.51944 > overload.7777: UDP, length 4
10:09:45.398614 IP 192.168.0.100.36281 > overload.7777: UDP, length 4
10:09:45.402772 IP 192.168.0.100.36121 > overload.7777: UDP, length 4
10:09:45.405696 IP 192.168.0.100.39322 > overload.6666: UDP, length 4
10:09:45.405725 IP 192.168.0.100.53644 > overload.6666: UDP, length 4
10:09:45.405729 IP 192.168.0.100.34925 > overload.6666: UDP, length 4
10:09:45.405733 IP 192.168.0.100.38885 > overload.6666: UDP, length 4
10:09:45.405736 IP 192.168.0.100.33630 > overload.6666: UDP, length 4
10:09:45.408987 IP 192.168.0.100.56337 > overload.6666: UDP, length 4
10:09:45.413044 IP 192.168.0.100.53143 > overload.6666: UDP, length 4
10:09:45.417327 IP 192.168.0.100.49062 > overload.6666: UDP, length 4
10:09:45.421402 IP 192.168.0.100.37284 > overload.6666: UDP, length 4
10:09:45.425433 IP 192.168.0.100.57399 > overload.6666: UDP, length 4
10:09:45.429463 IP 192.168.0.100.38254 > overload.6666: UDP, length 4
10:09:45.433676 IP 192.168.0.100.53912 > overload.6666: UDP, length 4
10:09:45.437785 IP 192.168.0.100.48466 > overload.6666: UDP, length 4
10:09:45.441808 IP 192.168.0.100.55179 > overload.6666: UDP, length 4
10:09:45.445894 IP 192.168.0.100.58745 > overload.6666: UDP, length 4
10:09:45.450117 IP 192.168.0.100.44184 > overload.6666: UDP, length 4
10:09:45.454235 IP 192.168.0.100.41397 > overload.6666: UDP, length 4
10:09:45.458340 IP 192.168.0.100.53755 > overload.6666: UDP, length 4
10:09:45.462355 IP 192.168.0.100.55136 > overload.6666: UDP, length 4
10:09:45.466513 IP 192.168.0.100.40784 > overload.6666: UDP, length 4
10:09:45.470722 IP 192.168.0.100.38715 > overload.6666: UDP, length 4
10:09:45.474899 IP 192.168.0.100.56223 > overload.6666: UDP, length 4
10:09:45.478975 IP 192.168.0.100.50007 > overload.6666: UDP, length 4
10:09:45.483204 IP 192.168.0.100.44841 > overload.6666: UDP, length 4
10:09:45.485529 IP 192.168.0.100.41719 > overload.7777: UDP, length 4
10:09:45.485558 IP 192.168.0.100.37534 > overload.7777: UDP, length 4
10:09:45.485562 IP 192.168.0.100.54955 > overload.7777: UDP, length 4
10:09:45.485565 IP 192.168.0.100.49491 > overload.7777: UDP, length 4
10:09:45.485569 IP 192.168.0.100.37918 > overload.7777: UDP, length 4
10:09:45.485573 IP 192.168.0.100.60045 > overload.7777: UDP, length 4
10:09:45.485576 IP 192.168.0.100.52921 > overload.7777: UDP, length 4
10:09:45.485580 IP 192.168.0.100.41211 > overload.7777: UDP, length 4
10:09:45.485583 IP 192.168.0.100.52656 > overload.7777: UDP, length 4
10:09:45.485587 IP 192.168.0.100.59783 > overload.7777: UDP, length 4
10:09:45.485590 IP 192.168.0.100.41082 > overload.7777: UDP, length 4
10:09:45.485594 IP 192.168.0.100.47016 > overload.7777: UDP, length 4
10:09:45.485598 IP 192.168.0.100.57450 > overload.7777: UDP, length 4
10:09:45.485601 IP 192.168.0.100.36943 > overload.7777: UDP, length 4
10:09:45.485605 IP 192.168.0.100.49149 > overload.7777: UDP, length 4
10:09:45.485608 IP 192.168.0.100.54418 > overload.7777: UDP, length 4
10:09:45.485613 IP 192.168.0.100.38012 > overload.7777: UDP, length 4
10:09:45.485617 IP 192.168.0.100.37877 > overload.7777: UDP, length 4
10:09:45.485621 IP 192.168.0.100.57884 > overload.7777: UDP, length 4
10:09:45.485624 IP 192.168.0.100.53519 > overload.7777: UDP, length 4
10:09:45.489429 IP 192.168.0.100.51389 > overload.7777: UDP, length 4
10:09:45.493208 IP 192.168.0.100.56111 > overload.7777: UDP, length 4
10:09:45.497394 IP 192.168.0.100.50329 > overload.7777: UDP, length 4
10:09:45.501542 IP 192.168.0.100.46544 > overload.7777: UDP, length 4
10:09:45.505613 IP 192.168.0.100.38865 > overload.6666: UDP, length 4
10:09:45.505641 IP 192.168.0.100.52952 > overload.6666: UDP, length 4
10:09:45.505646 IP 192.168.0.100.54826 > overload.6666: UDP, length 4
10:09:45.505649 IP 192.168.0.100.46160 > overload.6666: UDP, length 4
10:09:45.505653 IP 192.168.0.100.59232 > overload.6666: UDP, length 4
10:09:45.507497 IP 192.168.0.100.40779 > overload.6666: UDP, length 4
10:09:45.511850 IP 192.168.0.100.33785 > overload.6666: UDP, length 4
10:09:45.515990 IP 192.168.0.100.43651 > overload.6666: UDP, length 4
10:09:45.520172 IP 192.168.0.100.40936 > overload.6666: UDP, length 4
10:09:45.524224 IP 192.168.0.100.46567 > overload.6666: UDP, length 4
10:09:45.528263 IP 192.168.0.100.60728 > overload.6666: UDP, length 4
10:09:45.532605 IP 192.168.0.100.51980 > overload.6666: UDP, length 4
10:09:45.536901 IP 192.168.0.100.48063 > overload.6666: UDP, length 4
10:09:45.541011 IP 192.168.0.100.33688 > overload.6666: UDP, length 4
10:09:45.545112 IP 192.168.0.100.51214 > overload.6666: UDP, length 4
10:09:45.549167 IP 192.168.0.100.39109 > overload.6666: UDP, length 4
10:09:45.553223 IP 192.168.0.100.52214 > overload.6666: UDP, length 4
10:09:45.557277 IP 192.168.0.100.41600 > overload.6666: UDP, length 4
10:09:45.561395 IP 192.168.0.100.52303 > overload.6666: UDP, length 4
10:09:45.565699 IP 192.168.0.100.40454 > overload.6666: UDP, length 4
10:09:45.569908 IP 192.168.0.100.34331 > overload.6666: UDP, length 4
10:09:45.573943 IP 192.168.0.100.48478 > overload.6666: UDP, length 4
10:09:45.577952 IP 192.168.0.100.49127 > overload.6666: UDP, length 4
10:09:45.581991 IP 192.168.0.100.48403 > overload.6666: UDP, length 4
10:09:45.585655 IP 192.168.0.100.41092 > overload.7777: UDP, length 4
10:09:45.585684 IP 192.168.0.100.51828 > overload.7777: UDP, length 4
10:09:45.585688 IP 192.168.0.100.41537 > overload.7777: UDP, length 4
10:09:45.585692 IP 192.168.0.100.54650 > overload.7777: UDP, length 4
10:09:45.585696 IP 192.168.0.100.53628 > overload.7777: UDP, length 4
10:09:45.585699 IP 192.168.0.100.52714 > overload.7777: UDP, length 4
10:09:45.585703 IP 192.168.0.100.32950 > overload.7777: UDP, length 4
10:09:45.585707 IP 192.168.0.100.38437 > overload.7777: UDP, length 4
10:09:45.585710 IP 192.168.0.100.60465 > overload.7777: UDP, length 4
10:09:45.585714 IP 192.168.0.100.43869 > overload.7777: UDP, length 4
10:09:45.585717 IP 192.168.0.100.45062 > overload.7777: UDP, length 4
10:09:45.585721 IP 192.168.0.100.44173 > overload.7777: UDP, length 4
10:09:45.585724 IP 192.168.0.100.44313 > overload.7777: UDP, length 4
10:09:45.585728 IP 192.168.0.100.42031 > overload.7777: UDP, length 4
10:09:45.585731 IP 192.168.0.100.42296 > overload.7777: UDP, length 4
10:09:45.585735 IP 192.168.0.100.54992 > overload.7777: UDP, length 4
10:09:45.585740 IP 192.168.0.100.59273 > overload.7777: UDP, length 4
10:09:45.585743 IP 192.168.0.100.50399 > overload.7777: UDP, length 4
10:09:45.585747 IP 192.168.0.100.44940 > overload.7777: UDP, length 4
10:09:45.585751 IP 192.168.0.100.58801 > overload.7777: UDP, length 4
10:09:45.588107 IP 192.168.0.100.45262 > overload.7777: UDP, length 4
10:09:45.592266 IP 192.168.0.100.44895 > overload.7777: UDP, length 4
10:09:45.596505 IP 192.168.0.100.55256 > overload.7777: UDP, length 4
10:09:45.600594 IP 192.168.0.100.52018 > overload.7777: UDP, length 4
10:09:45.604941 IP 192.168.0.100.47673 > overload.7777: UDP, length 4
10:09:45.605543 IP 192.168.0.100.54959 > overload.6666: UDP, length 4
10:09:45.605572 IP 192.168.0.100.51312 > overload.6666: UDP, length 4
10:09:45.605576 IP 192.168.0.100.50021 > overload.6666: UDP, length 4
10:09:45.605579 IP 192.168.0.100.54181 > overload.6666: UDP, length 4
10:09:45.605583 IP 192.168.0.100.51422 > overload.6666: UDP, length 4
10:09:45.606607 IP 192.168.0.100.37326 > overload.6666: UDP, length 4
10:09:45.611018 IP 192.168.0.100.44878 > overload.6666: UDP, length 4
10:09:45.615083 IP 192.168.0.100.41210 > overload.6666: UDP, length 4
10:09:45.619053 IP 192.168.0.100.45031 > overload.6666: UDP, length 4
10:09:45.623408 IP 192.168.0.100.49619 > overload.6666: UDP, length 4
10:09:45.627503 IP 192.168.0.100.48131 > overload.6666: UDP, length 4
10:09:45.631627 IP 192.168.0.100.47454 > overload.6666: UDP, length 4
10:09:45.635898 IP 192.168.0.100.38614 > overload.6666: UDP, length 4
10:09:45.639944 IP 192.168.0.100.33818 > overload.6666: UDP, length 4
10:09:45.643913 IP 192.168.0.100.38935 > overload.6666: UDP, length 4
10:09:45.647946 IP 192.168.0.100.56044 > overload.6666: UDP, length 4
10:09:45.652093 IP 192.168.0.100.34082 > overload.6666: UDP, length 4
10:09:45.656408 IP 192.168.0.100.38514 > overload.6666: UDP, length 4
10:09:45.660451 IP 192.168.0.100.39195 > overload.6666: UDP, length 4
10:09:45.664652 IP 192.168.0.100.56884 > overload.6666: UDP, length 4
10:09:45.668950 IP 192.168.0.100.46513 > overload.6666: UDP, length 4
10:09:45.672996 IP 192.168.0.100.36649 > overload.6666: UDP, length 4
10:09:45.677042 IP 192.168.0.100.36894 > overload.6666: UDP, length 4
10:09:45.681158 IP 192.168.0.100.55818 > overload.6666: UDP, length 4
10:09:45.685266 IP 192.168.0.100.49542 > overload.6666: UDP, length 4
10:09:45.685297 IP 192.168.0.100.49810 > overload.7777: UDP, length 4
10:09:45.685301 IP 192.168.0.100.34476 > overload.7777: UDP, length 4
10:09:45.685305 IP 192.168.0.100.46832 > overload.7777: UDP, length 4
10:09:45.685308 IP 192.168.0.100.42930 > overload.7777: UDP, length 4
10:09:45.685312 IP 192.168.0.100.57357 > overload.7777: UDP, length 4
10:09:45.685315 IP 192.168.0.100.39443 > overload.7777: UDP, length 4
10:09:45.685319 IP 192.168.0.100.59028 > overload.7777: UDP, length 4
10:09:45.685323 IP 192.168.0.100.54991 > overload.7777: UDP, length 4
10:09:45.685326 IP 192.168.0.100.48382 > overload.7777: UDP, length 4
10:09:45.685330 IP 192.168.0.100.34442 > overload.7777: UDP, length 4
10:09:45.685334 IP 192.168.0.100.43429 > overload.7777: UDP, length 4
10:09:45.685337 IP 192.168.0.100.39706 > overload.7777: UDP, length 4
10:09:45.685341 IP 192.168.0.100.60196 > overload.7777: UDP, length 4
10:09:45.685344 IP 192.168.0.100.49580 > overload.7777: UDP, length 4
10:09:45.685348 IP 192.168.0.100.52184 > overload.7777: UDP, length 4
10:09:45.685353 IP 192.168.0.100.56347 > overload.7777: UDP, length 4
10:09:45.685356 IP 192.168.0.100.59276 > overload.7777: UDP, length 4
10:09:45.685360 IP 192.168.0.100.42477 > overload.7777: UDP, length 4
10:09:45.685364 IP 192.168.0.100.55101 > overload.7777: UDP, length 4
10:09:45.687309 IP 192.168.0.100.51796 > overload.7777: UDP, length 4
10:09:45.691380 IP 192.168.0.100.49049 > overload.7777: UDP, length 4
10:09:45.695179 IP 192.168.0.100.33302 > overload.7777: UDP, length 4
10:09:45.699586 IP 192.168.0.100.33857 > overload.7777: UDP, length 4
10:09:45.703718 IP 192.168.0.100.56015 > overload.7777: UDP, length 4
10:09:45.705364 IP 192.168.0.100.54655 > overload.6666: UDP, length 4
10:09:45.705400 IP 192.168.0.100.34198 > overload.6666: UDP, length 4
10:09:45.705407 IP 192.168.0.100.37157 > overload.6666: UDP, length 4
10:09:45.705412 IP 192.168.0.100.38709 > overload.6666: UDP, length 4
10:09:45.705417 IP 192.168.0.100.35289 > overload.6666: UDP, length 4
10:09:45.709682 IP 192.168.0.100.45279 > overload.6666: UDP, length 4
10:09:45.713602 IP 192.168.0.100.55921 > overload.6666: UDP, length 4
10:09:45.718005 IP 192.168.0.100.41012 > overload.6666: UDP, length 4
10:09:45.722124 IP 192.168.0.100.52411 > overload.6666: UDP, length 4
10:09:45.726207 IP 192.168.0.100.47845 > overload.6666: UDP, length 4
10:09:45.730191 IP 192.168.0.100.32938 > overload.6666: UDP, length 4
10:09:45.734469 IP 192.168.0.100.53552 > overload.6666: UDP, length 4
10:09:45.738630 IP 192.168.0.100.47005 > overload.6666: UDP, length 4
10:09:45.742851 IP 192.168.0.100.54493 > overload.6666: UDP, length 4
10:09:45.746902 IP 192.168.0.100.51579 > overload.6666: UDP, length 4
10:09:45.751324 IP 192.168.0.100.53343 > overload.6666: UDP, length 4
10:09:45.755444 IP 192.168.0.100.45320 > overload.6666: UDP, length 4
10:09:45.759503 IP 192.168.0.100.52798 > overload.6666: UDP, length 4
10:09:45.763525 IP 192.168.0.100.35392 > overload.6666: UDP, length 4
10:09:45.767624 IP 192.168.0.100.49609 > overload.6666: UDP, length 4
10:09:45.771747 IP 192.168.0.100.42346 > overload.6666: UDP, length 4
10:09:45.775959 IP 192.168.0.100.50722 > overload.6666: UDP, length 4
10:09:45.780208 IP 192.168.0.100.47266 > overload.6666: UDP, length 4
10:09:45.784566 IP 192.168.0.100.41866 > overload.6666: UDP, length 4
10:09:45.785583 IP 192.168.0.100.39144 > overload.7777: UDP, length 4
10:09:45.785611 IP 192.168.0.100.46726 > overload.7777: UDP, length 4
10:09:45.785616 IP 192.168.0.100.36578 > overload.7777: UDP, length 4
10:09:45.785619 IP 192.168.0.100.55341 > overload.7777: UDP, length 4
10:09:45.785623 IP 192.168.0.100.52710 > overload.7777: UDP, length 4
10:09:45.785626 IP 192.168.0.100.39045 > overload.7777: UDP, length 4
10:09:45.785630 IP 192.168.0.100.53818 > overload.7777: UDP, length 4
10:09:45.785634 IP 192.168.0.100.54450 > overload.7777: UDP, length 4
10:09:45.785637 IP 192.168.0.100.45845 > overload.7777: UDP, length 4
10:09:45.785641 IP 192.168.0.100.52884 > overload.7777: UDP, length 4
10:09:45.785644 IP 192.168.0.100.48245 > overload.7777: UDP, length 4
10:09:45.785648 IP 192.168.0.100.36652 > overload.7777: UDP, length 4
10:09:45.785651 IP 192.168.0.100.45720 > overload.7777: UDP, length 4
10:09:45.785655 IP 192.168.0.100.49598 > overload.7777: UDP, length 4
10:09:45.785658 IP 192.168.0.100.58870 > overload.7777: UDP, length 4
10:09:45.785662 IP 192.168.0.100.58433 > overload.7777: UDP, length 4
10:09:45.785667 IP 192.168.0.100.47214 > overload.7777: UDP, length 4
10:09:45.785670 IP 192.168.0.100.43468 > overload.7777: UDP, length 4
10:09:45.785674 IP 192.168.0.100.53520 > overload.7777: UDP, length 4
10:09:45.786472 IP 192.168.0.100.47838 > overload.7777: UDP, length 4
10:09:45.790615 IP 192.168.0.100.49546 > overload.7777: UDP, length 4
10:09:45.794612 IP 192.168.0.100.39345 > overload.7777: UDP, length 4
10:09:45.798722 IP 192.168.0.100.39345 > overload.7777: UDP, length 4
10:09:45.802818 IP 192.168.0.100.57092 > overload.7777: UDP, length 4
10:09:45.805696 IP 192.168.0.100.49649 > overload.6666: UDP, length 4
10:09:45.805726 IP 192.168.0.100.36437 > overload.6666: UDP, length 4
10:09:45.805730 IP 192.168.0.100.36333 > overload.6666: UDP, length 4
10:09:45.805733 IP 192.168.0.100.34911 > overload.6666: UDP, length 4
10:09:45.805737 IP 192.168.0.100.34368 > overload.6666: UDP, length 4
10:09:45.809071 IP 192.168.0.100.47684 > overload.6666: UDP, length 4
10:09:45.813141 IP 192.168.0.100.44988 > overload.6666: UDP, length 4
10:09:45.817478 IP 192.168.0.100.40940 > overload.6666: UDP, length 4
10:09:45.821533 IP 192.168.0.100.53697 > overload.6666: UDP, length 4
10:09:45.825694 IP 192.168.0.100.43642 > overload.6666: UDP, length 4
10:09:45.829771 IP 192.168.0.100.48281 > overload.6666: UDP, length 4
10:09:45.833805 IP 192.168.0.100.40996 > overload.6666: UDP, length 4
10:09:45.837921 IP 192.168.0.100.56437 > overload.6666: UDP, length 4
10:09:45.842091 IP 192.168.0.100.37055 > overload.6666: UDP, length 4
10:09:45.845910 IP 192.168.0.100.48557 > overload.6666: UDP, length 4
10:09:45.850550 IP 192.168.0.100.57645 > overload.6666: UDP, length 4
10:09:45.854687 IP 192.168.0.100.55565 > overload.6666: UDP, length 4
10:09:45.858809 IP 192.168.0.100.54741 > overload.6666: UDP, length 4
10:09:45.862810 IP 192.168.0.100.57809 > overload.6666: UDP, length 4
10:09:45.866966 IP 192.168.0.100.38043 > overload.6666: UDP, length 4
10:09:45.871116 IP 192.168.0.100.34285 > overload.6666: UDP, length 4
10:09:45.875037 IP 192.168.0.100.37032 > overload.6666: UDP, length 4
10:09:45.879318 IP 192.168.0.100.43163 > overload.6666: UDP, length 4
10:09:45.883584 IP 192.168.0.100.32800 > overload.6666: UDP, length 4
10:09:45.885613 IP 192.168.0.100.58622 > overload.7777: UDP, length 4
10:09:45.885643 IP 192.168.0.100.37191 > overload.7777: UDP, length 4
10:09:45.885647 IP 192.168.0.100.46379 > overload.7777: UDP, length 4
10:09:45.885651 IP 192.168.0.100.54857 > overload.7777: UDP, length 4
10:09:45.885654 IP 192.168.0.100.48711 > overload.7777: UDP, length 4
10:09:45.885658 IP 192.168.0.100.56995 > overload.7777: UDP, length 4
10:09:45.885661 IP 192.168.0.100.43364 > overload.7777: UDP, length 4
10:09:45.885665 IP 192.168.0.100.39495 > overload.7777: UDP, length 4
10:09:45.885669 IP 192.168.0.100.48770 > overload.7777: UDP, length 4
10:09:45.885672 IP 192.168.0.100.43816 > overload.7777: UDP, length 4
10:09:45.885676 IP 192.168.0.100.54910 > overload.7777: UDP, length 4
10:09:45.885680 IP 192.168.0.100.47026 > overload.7777: UDP, length 4
10:09:45.885683 IP 192.168.0.100.51797 > overload.7777: UDP, length 4
10:09:45.885687 IP 192.168.0.100.49867 > overload.7777: UDP, length 4
10:09:45.885690 IP 192.168.0.100.33471 > overload.7777: UDP, length 4
10:09:45.885694 IP 192.168.0.100.41188 > overload.7777: UDP, length 4
10:09:45.885699 IP 192.168.0.100.41144 > overload.7777: UDP, length 4
10:09:45.885702 IP 192.168.0.100.41907 > overload.7777: UDP, length 4
10:09:45.885706 IP 192.168.0.100.37446 > overload.7777: UDP, length 4
10:09:45.885709 IP 192.168.0.100.42817 > overload.7777: UDP, length 4
10:09:45.889819 IP 192.168.0.100.60956 > overload.7777: UDP, length 4
10:09:45.893604 IP 192.168.0.100.42820 > overload.7777: UDP, length 4
10:09:45.897664 IP 192.168.0.100.51822 > overload.7777: UDP, length 4
10:09:45.901960 IP 192.168.0.100.55693 > overload.7777: UDP, length 4
10:09:45.905578 IP 192.168.0.100.40464 > overload.6666: UDP, length 4
10:09:45.905606 IP 192.168.0.100.40469 > overload.6666: UDP, length 4
10:09:45.905611 IP 192.168.0.100.34645 > overload.6666: UDP, length 4
10:09:45.905614 IP 192.168.0.100.37813 > overload.6666: UDP, length 4
10:09:45.905618 IP 192.168.0.100.46235 > overload.6666: UDP, length 4
10:09:45.907992 IP 192.168.0.100.35626 > overload.6666: UDP, length 4
10:09:45.912343 IP 192.168.0.100.44831 > overload.6666: UDP, length 4
10:09:45.916553 IP 192.168.0.100.42937 > overload.6666: UDP, length 4
10:09:45.920716 IP 192.168.0.100.36897 > overload.6666: UDP, length 4
10:09:45.924869 IP 192.168.0.100.57448 > overload.6666: UDP, length 4
10:09:45.929122 IP 192.168.0.100.51144 > overload.6666: UDP, length 4
10:09:45.933206 IP 192.168.0.100.52452 > overload.6666: UDP, length 4
10:09:45.937150 IP 192.168.0.100.41311 > overload.6666: UDP, length 4
10:09:45.941275 IP 192.168.0.100.60451 > overload.6666: UDP, length 4
10:09:45.945468 IP 192.168.0.100.57295 > overload.6666: UDP, length 4
10:09:45.949704 IP 192.168.0.100.46541 > overload.6666: UDP, length 4
10:09:45.953916 IP 192.168.0.100.50247 > overload.6666: UDP, length 4
10:09:45.957977 IP 192.168.0.100.38192 > overload.6666: UDP, length 4
10:09:45.961904 IP 192.168.0.100.55068 > overload.6666: UDP, length 4
10:09:45.966708 IP 192.168.0.100.43080 > overload.6666: UDP, length 4
10:09:45.970860 IP 192.168.0.100.50156 > overload.6666: UDP, length 4
10:09:45.974951 IP 192.168.0.100.49748 > overload.6666: UDP, length 4
10:09:45.979063 IP 192.168.0.100.60466 > overload.6666: UDP, length 4
10:09:45.983121 IP 192.168.0.100.46463 > overload.6666: UDP, length 4
10:09:45.985596 IP 192.168.0.100.39642 > overload.7777: UDP, length 4
10:09:45.985626 IP 192.168.0.100.46037 > overload.7777: UDP, length 4
10:09:45.985630 IP 192.168.0.100.36783 > overload.7777: UDP, length 4
10:09:45.985633 IP 192.168.0.100.40980 > overload.7777: UDP, length 4
10:09:45.985637 IP 192.168.0.100.33001 > overload.7777: UDP, length 4
10:09:45.985640 IP 192.168.0.100.60563 > overload.7777: UDP, length 4
10:09:45.985644 IP 192.168.0.100.44168 > overload.7777: UDP, length 4
10:09:45.985647 IP 192.168.0.100.52468 > overload.7777: UDP, length 4
10:09:45.985651 IP 192.168.0.100.42593 > overload.7777: UDP, length 4
10:09:45.985654 IP 192.168.0.100.34131 > overload.7777: UDP, length 4
10:09:45.985658 IP 192.168.0.100.59746 > overload.7777: UDP, length 4
10:09:45.985662 IP 192.168.0.100.47115 > overload.7777: UDP, length 4
10:09:45.985665 IP 192.168.0.100.45796 > overload.7777: UDP, length 4
10:09:45.985669 IP 192.168.0.100.34316 > overload.7777: UDP, length 4
10:09:45.985673 IP 192.168.0.100.34942 > overload.7777: UDP, length 4
10:09:45.985676 IP 192.168.0.100.58379 > overload.7777: UDP, length 4
10:09:45.985681 IP 192.168.0.100.50064 > overload.7777: UDP, length 4
10:09:45.985684 IP 192.168.0.100.48805 > overload.7777: UDP, length 4
10:09:45.985688 IP 192.168.0.100.58665 > overload.7777: UDP, length 4
10:09:45.985691 IP 192.168.0.100.57056 > overload.7777: UDP, length 4
10:09:45.989193 IP 192.168.0.100.47097 > overload.7777: UDP, length 4
10:09:45.993224 IP 192.168.0.100.34274 > overload.7777: UDP, length 4
10:09:45.997420 IP 192.168.0.100.46203 > overload.7777: UDP, length 4
10:09:46.001701 IP 192.168.0.100.42233 > overload.7777: UDP, length 4
10:09:46.005463 IP 192.168.0.100.57904 > overload.6666: UDP, length 4
10:09:46.005493 IP 192.168.0.100.51245 > overload.6666: UDP, length 4
10:09:46.005497 IP 192.168.0.100.33893 > overload.6666: UDP, length 4
10:09:46.005500 IP 192.168.0.100.46170 > overload.6666: UDP, length 4
10:09:46.005504 IP 192.168.0.100.57559 > overload.6666: UDP, length 4
10:09:46.007788 IP 192.168.0.100.35911 > overload.6666: UDP, length 4
10:09:46.012065 IP 192.168.0.100.58091 > overload.6666: UDP, length 4
10:09:46.016094 IP 192.168.0.100.52151 > overload.6666: UDP, length 4
10:09:46.020091 IP 192.168.0.100.43294 > overload.6666: UDP, length 4
10:09:46.024300 IP 192.168.0.100.55255 > overload.6666: UDP, length 4
10:09:46.028584 IP 192.168.0.100.47994 > overload.6666: UDP, length 4
10:09:46.032825 IP 192.168.0.100.53778 > overload.6666: UDP, length 4
10:09:46.036846 IP 192.168.0.100.37502 > overload.6666: UDP, length 4
10:09:46.041128 IP 192.168.0.100.51253 > overload.6666: UDP, length 4
10:09:46.045083 IP 192.168.0.100.38267 > overload.6666: UDP, length 4
10:09:46.049214 IP 192.168.0.100.59861 > overload.6666: UDP, length 4
10:09:46.053483 IP 192.168.0.100.56895 > overload.6666: UDP, length 4
10:09:46.057647 IP 192.168.0.100.51678 > overload.6666: UDP, length 4
10:09:46.061653 IP 192.168.0.100.56106 > overload.6666: UDP, length 4
10:09:46.065834 IP 192.168.0.100.40989 > overload.6666: UDP, length 4
10:09:46.070081 IP 192.168.0.100.48129 > overload.6666: UDP, length 4
10:09:46.074107 IP 192.168.0.100.51052 > overload.6666: UDP, length 4
10:09:46.078142 IP 192.168.0.100.57952 > overload.6666: UDP, length 4
10:09:46.082146 IP 192.168.0.100.43835 > overload.6666: UDP, length 4
10:09:46.085647 IP 192.168.0.100.53773 > overload.7777: UDP, length 4
10:09:46.085676 IP 192.168.0.100.35563 > overload.7777: UDP, length 4
10:09:46.085680 IP 192.168.0.100.53222 > overload.7777: UDP, length 4
10:09:46.085684 IP 192.168.0.100.41847 > overload.7777: UDP, length 4
10:09:46.085687 IP 192.168.0.100.52434 > overload.7777: UDP, length 4
10:09:46.085691 IP 192.168.0.100.35027 > overload.7777: UDP, length 4
10:09:46.085694 IP 192.168.0.100.47459 > overload.7777: UDP, length 4
10:09:46.085698 IP 192.168.0.100.54848 > overload.7777: UDP, length 4
10:09:46.085701 IP 192.168.0.100.56817 > overload.7777: UDP, length 4
10:09:46.085705 IP 192.168.0.100.44178 > overload.7777: UDP, length 4
10:09:46.085708 IP 192.168.0.100.34300 > overload.7777: UDP, length 4
10:09:46.085712 IP 192.168.0.100.55101 > overload.7777: UDP, length 4
10:09:46.085715 IP 192.168.0.100.43826 > overload.7777: UDP, length 4
10:09:46.085719 IP 192.168.0.100.43352 > overload.7777: UDP, length 4
10:09:46.085722 IP 192.168.0.100.53436 > overload.7777: UDP, length 4
10:09:46.085726 IP 192.168.0.100.36834 > overload.7777: UDP, length 4
10:09:46.085731 IP 192.168.0.100.43247 > overload.7777: UDP, length 4
10:09:46.085734 IP 192.168.0.100.49219 > overload.7777: UDP, length 4
10:09:46.085738 IP 192.168.0.100.41277 > overload.7777: UDP, length 4
10:09:46.085741 IP 192.168.0.100.39613 > overload.7777: UDP, length 4
10:09:46.088282 IP 192.168.0.100.46468 > overload.7777: UDP, length 4
10:09:46.092372 IP 192.168.0.100.42264 > overload.7777: UDP, length 4
10:09:46.096153 IP 192.168.0.100.43082 > overload.7777: UDP, length 4
10:09:46.100466 IP 192.168.0.100.55031 > overload.7777: UDP, length 4
10:09:46.104598 IP 192.168.0.100.48913 > overload.7777: UDP, length 4
10:09:46.105576 IP 192.168.0.100.58260 > overload.6666: UDP, length 4
10:09:46.105605 IP 192.168.0.100.53296 > overload.6666: UDP, length 4
10:09:46.105609 IP 192.168.0.100.33827 > overload.6666: UDP, length 4
10:09:46.105613 IP 192.168.0.100.60595 > overload.6666: UDP, length 4
10:09:46.105616 IP 192.168.0.100.46264 > overload.6666: UDP, length 4
10:09:46.106497 IP 192.168.0.100.51328 > overload.6666: UDP, length 4
10:09:46.110758 IP 192.168.0.100.50114 > overload.6666: UDP, length 4
10:09:46.114751 IP 192.168.0.100.54014 > overload.6666: UDP, length 4
10:09:46.119114 IP 192.168.0.100.60843 > overload.6666: UDP, length 4
10:09:46.123183 IP 192.168.0.100.43740 > overload.6666: UDP, length 4
10:09:46.127282 IP 192.168.0.100.60351 > overload.6666: UDP, length 4
10:09:46.131416 IP 192.168.0.100.49251 > overload.6666: UDP, length 4
10:09:46.135440 IP 192.168.0.100.38763 > overload.6666: UDP, length 4
10:09:46.139401 IP 192.168.0.100.57365 > overload.6666: UDP, length 4
10:09:46.143525 IP 192.168.0.100.58087 > overload.6666: UDP, length 4
10:09:46.147644 IP 192.168.0.100.45529 > overload.6666: UDP, length 4
10:09:46.151847 IP 192.168.0.100.33639 > overload.6666: UDP, length 4
10:09:46.155914 IP 192.168.0.100.33008 > overload.6666: UDP, length 4
10:09:46.159906 IP 192.168.0.100.54074 > overload.6666: UDP, length 4
10:09:46.163911 IP 192.168.0.100.43854 > overload.6666: UDP, length 4
10:09:46.168349 IP 192.168.0.100.60199 > overload.6666: UDP, length 4
10:09:46.172427 IP 192.168.0.100.43154 > overload.6666: UDP, length 4
10:09:46.176419 IP 192.168.0.100.57506 > overload.6666: UDP, length 4
10:09:46.180669 IP 192.168.0.100.36356 > overload.6666: UDP, length 4
10:09:46.184903 IP 192.168.0.100.35416 > overload.6666: UDP, length 4
10:09:46.185365 IP 192.168.0.100.44510 > overload.7777: UDP, length 4
10:09:46.185393 IP 192.168.0.100.57105 > overload.7777: UDP, length 4
10:09:46.185397 IP 192.168.0.100.36625 > overload.7777: UDP, length 4
10:09:46.185401 IP 192.168.0.100.37202 > overload.7777: UDP, length 4
10:09:46.185404 IP 192.168.0.100.57348 > overload.7777: UDP, length 4
10:09:46.185408 IP 192.168.0.100.54738 > overload.7777: UDP, length 4
10:09:46.185412 IP 192.168.0.100.46699 > overload.7777: UDP, length 4
10:09:46.185415 IP 192.168.0.100.47448 > overload.7777: UDP, length 4
10:09:46.185419 IP 192.168.0.100.56028 > overload.7777: UDP, length 4
10:09:46.185422 IP 192.168.0.100.56377 > overload.7777: UDP, length 4
10:09:46.185426 IP 192.168.0.100.45742 > overload.7777: UDP, length 4
10:09:46.185429 IP 192.168.0.100.45799 > overload.7777: UDP, length 4
10:09:46.185433 IP 192.168.0.100.57919 > overload.7777: UDP, length 4
10:09:46.185437 IP 192.168.0.100.55667 > overload.7777: UDP, length 4
10:09:46.185440 IP 192.168.0.100.59522 > overload.7777: UDP, length 4
10:09:46.185444 IP 192.168.0.100.56795 > overload.7777: UDP, length 4
10:09:46.185448 IP 192.168.0.100.41043 > overload.7777: UDP, length 4
10:09:46.185452 IP 192.168.0.100.54240 > overload.7777: UDP, length 4
10:09:46.185456 IP 192.168.0.100.48687 > overload.7777: UDP, length 4
10:09:46.186853 IP 192.168.0.100.51381 > overload.7777: UDP, length 4
10:09:46.191038 IP 192.168.0.100.37310 > overload.7777: UDP, length 4
10:09:46.194957 IP 192.168.0.100.43096 > overload.7777: UDP, length 4
10:09:46.198923 IP 192.168.0.100.33422 > overload.7777: UDP, length 4
10:09:46.202918 IP 192.168.0.100.50314 > overload.7777: UDP, length 4
10:09:46.205380 IP 192.168.0.100.46690 > overload.6666: UDP, length 4
10:09:46.205411 IP 192.168.0.100.36662 > overload.6666: UDP, length 4
10:09:46.205415 IP 192.168.0.100.54756 > overload.6666: UDP, length 4
10:09:46.205419 IP 192.168.0.100.37573 > overload.6666: UDP, length 4
10:09:46.205422 IP 192.168.0.100.56682 > overload.6666: UDP, length 4
10:09:46.209227 IP 192.168.0.100.50704 > overload.6666: UDP, length 4
10:09:46.213467 IP 192.168.0.100.44779 > overload.6666: UDP, length 4
10:09:46.217485 IP 192.168.0.100.49332 > overload.6666: UDP, length 4
10:09:46.221788 IP 192.168.0.100.38101 > overload.6666: UDP, length 4
10:09:46.225796 IP 192.168.0.100.35981 > overload.6666: UDP, length 4
10:09:46.229781 IP 192.168.0.100.33384 > overload.6666: UDP, length 4
10:09:46.233843 IP 192.168.0.100.45365 > overload.6666: UDP, length 4
10:09:46.237662 IP 192.168.0.100.42109 > overload.6666: UDP, length 4
10:09:46.241791 IP 192.168.0.100.52927 > overload.6666: UDP, length 4
10:09:46.246020 IP 192.168.0.100.36453 > overload.6666: UDP, length 4
10:09:46.250323 IP 192.168.0.100.49922 > overload.6666: UDP, length 4
10:09:46.254445 IP 192.168.0.100.50611 > overload.6666: UDP, length 4
10:09:46.258506 IP 192.168.0.100.48952 > overload.6666: UDP, length 4
10:09:46.262204 IP 192.168.0.100.48868 > overload.6666: UDP, length 4
10:09:46.266484 IP 192.168.0.100.57771 > overload.6666: UDP, length 4
10:09:46.270708 IP 192.168.0.100.37032 > overload.6666: UDP, length 4
10:09:46.274971 IP 192.168.0.100.45319 > overload.6666: UDP, length 4
10:09:46.279106 IP 192.168.0.100.54736 > overload.6666: UDP, length 4
10:09:46.283160 IP 192.168.0.100.33247 > overload.6666: UDP, length 4
10:09:46.285575 IP 192.168.0.100.43239 > overload.7777: UDP, length 4
10:09:46.285605 IP 192.168.0.100.40611 > overload.7777: UDP, length 4
10:09:46.285610 IP 192.168.0.100.51427 > overload.7777: UDP, length 4
10:09:46.285613 IP 192.168.0.100.54113 > overload.7777: UDP, length 4
10:09:46.285617 IP 192.168.0.100.54805 > overload.7777: UDP, length 4
10:09:46.285620 IP 192.168.0.100.47425 > overload.7777: UDP, length 4
10:09:46.285624 IP 192.168.0.100.33282 > overload.7777: UDP, length 4
10:09:46.285628 IP 192.168.0.100.36216 > overload.7777: UDP, length 4
10:09:46.285631 IP 192.168.0.100.34600 > overload.7777: UDP, length 4
10:09:46.285635 IP 192.168.0.100.40323 > overload.7777: UDP, length 4
10:09:46.285639 IP 192.168.0.100.51330 > overload.7777: UDP, length 4
10:09:46.285642 IP 192.168.0.100.32841 > overload.7777: UDP, length 4
10:09:46.285646 IP 192.168.0.100.37365 > overload.7777: UDP, length 4
10:09:46.285650 IP 192.168.0.100.44827 > overload.7777: UDP, length 4
10:09:46.285653 IP 192.168.0.100.49440 > overload.7777: UDP, length 4
10:09:46.285657 IP 192.168.0.100.41195 > overload.7777: UDP, length 4
10:09:46.285661 IP 192.168.0.100.57712 > overload.7777: UDP, length 4
10:09:46.285665 IP 192.168.0.100.47720 > overload.7777: UDP, length 4
10:09:46.285669 IP 192.168.0.100.44551 > overload.7777: UDP, length 4
10:09:46.285672 IP 192.168.0.100.43077 > overload.7777: UDP, length 4
10:09:46.289421 IP 192.168.0.100.56127 > overload.7777: UDP, length 4
10:09:46.293316 IP 192.168.0.100.37891 > overload.7777: UDP, length 4
10:09:46.297386 IP 192.168.0.100.36511 > overload.7777: UDP, length 4
10:09:46.301317 IP 192.168.0.100.43374 > overload.7777: UDP, length 4
10:09:46.305495 IP 192.168.0.100.43733 > overload.6666: UDP, length 4
10:09:46.305525 IP 192.168.0.100.49435 > overload.6666: UDP, length 4
10:09:46.305529 IP 192.168.0.100.40796 > overload.6666: UDP, length 4
10:09:46.305532 IP 192.168.0.100.36154 > overload.6666: UDP, length 4
10:09:46.305536 IP 192.168.0.100.50280 > overload.6666: UDP, length 4
10:09:46.307507 IP 192.168.0.100.52820 > overload.6666: UDP, length 4
10:09:46.311507 IP 192.168.0.100.33961 > overload.6666: UDP, length 4
10:09:46.315562 IP 192.168.0.100.34793 > overload.6666: UDP, length 4
10:09:46.319777 IP 192.168.0.100.41676 > overload.6666: UDP, length 4
10:09:46.323739 IP 192.168.0.100.51140 > overload.6666: UDP, length 4
10:09:46.328079 IP 192.168.0.100.36465 > overload.6666: UDP, length 4
10:09:46.332127 IP 192.168.0.100.54097 > overload.6666: UDP, length 4
10:09:46.336369 IP 192.168.0.100.43714 > overload.6666: UDP, length 4
10:09:46.340248 IP 192.168.0.100.37727 > overload.6666: UDP, length 4
10:09:46.344300 IP 192.168.0.100.33264 > overload.6666: UDP, length 4
10:09:46.348359 IP 192.168.0.100.41999 > overload.6666: UDP, length 4
10:09:46.352882 IP 192.168.0.100.37346 > overload.6666: UDP, length 4
10:09:46.356756 IP 192.168.0.100.54047 > overload.6666: UDP, length 4
10:09:46.360829 IP 192.168.0.100.47685 > overload.6666: UDP, length 4
10:09:46.365033 IP 192.168.0.100.47045 > overload.6666: UDP, length 4
10:09:46.369411 IP 192.168.0.100.45708 > overload.6666: UDP, length 4
10:09:46.373574 IP 192.168.0.100.38107 > overload.6666: UDP, length 4
10:09:46.377549 IP 192.168.0.100.40864 > overload.6666: UDP, length 4
10:09:46.381497 IP 192.168.0.100.48334 > overload.6666: UDP, length 4
10:09:46.385566 IP 192.168.0.100.42022 > overload.7777: UDP, length 4
10:09:46.385595 IP 192.168.0.100.40365 > overload.7777: UDP, length 4
10:09:46.385599 IP 192.168.0.100.50378 > overload.7777: UDP, length 4
10:09:46.385603 IP 192.168.0.100.33220 > overload.7777: UDP, length 4
10:09:46.385606 IP 192.168.0.100.44539 > overload.7777: UDP, length 4
10:09:46.385610 IP 192.168.0.100.44120 > overload.7777: UDP, length 4
10:09:46.385614 IP 192.168.0.100.53897 > overload.7777: UDP, length 4
10:09:46.385617 IP 192.168.0.100.56141 > overload.7777: UDP, length 4
10:09:46.385621 IP 192.168.0.100.54895 > overload.7777: UDP, length 4
10:09:46.385625 IP 192.168.0.100.49281 > overload.7777: UDP, length 4
10:09:46.385628 IP 192.168.0.100.58991 > overload.7777: UDP, length 4
10:09:46.385632 IP 192.168.0.100.47322 > overload.7777: UDP, length 4
10:09:46.385636 IP 192.168.0.100.60196 > overload.7777: UDP, length 4
10:09:46.385639 IP 192.168.0.100.59746 > overload.7777: UDP, length 4
10:09:46.385643 IP 192.168.0.100.52907 > overload.7777: UDP, length 4
10:09:46.385647 IP 192.168.0.100.44734 > overload.7777: UDP, length 4
10:09:46.385651 IP 192.168.0.100.50678 > overload.7777: UDP, length 4
10:09:46.385655 IP 192.168.0.100.34373 > overload.7777: UDP, length 4
10:09:46.385658 IP 192.168.0.100.55392 > overload.7777: UDP, length 4
10:09:46.385662 IP 192.168.0.100.39153 > overload.7777: UDP, length 4
10:09:46.387550 IP 192.168.0.100.48026 > overload.7777: UDP, length 4
10:09:46.391667 IP 192.168.0.100.54319 > overload.7777: UDP, length 4
10:09:46.395823 IP 192.168.0.100.51879 > overload.7777: UDP, length 4
10:09:46.400046 IP 192.168.0.100.34953 > overload.7777: UDP, length 4
10:09:46.404101 IP 192.168.0.100.55786 > overload.7777: UDP, length 4
10:09:46.405699 IP 192.168.0.100.38336 > overload.6666: UDP, length 4
10:09:46.405727 IP 192.168.0.100.35712 > overload.6666: UDP, length 4
10:09:46.405732 IP 192.168.0.100.38117 > overload.6666: UDP, length 4
10:09:46.405735 IP 192.168.0.100.46092 > overload.6666: UDP, length 4
10:09:46.405739 IP 192.168.0.100.41231 > overload.6666: UDP, length 4
10:09:46.405765 IP 192.168.0.100.53020 > overload.6666: UDP, length 4
10:09:46.410140 IP 192.168.0.100.52608 > overload.6666: UDP, length 4
10:09:46.414470 IP 192.168.0.100.57692 > overload.6666: UDP, length 4
10:09:46.418520 IP 192.168.0.100.46829 > overload.6666: UDP, length 4
10:09:46.422324 IP 192.168.0.100.58395 > overload.6666: UDP, length 4
10:09:46.426780 IP 192.168.0.100.37157 > overload.6666: UDP, length 4
10:09:46.431012 IP 192.168.0.100.34853 > overload.6666: UDP, length 4
10:09:46.435323 IP 192.168.0.100.53132 > overload.6666: UDP, length 4
10:09:46.439317 IP 192.168.0.100.60802 > overload.6666: UDP, length 4
10:09:46.443347 IP 192.168.0.100.56838 > overload.6666: UDP, length 4
10:09:46.447372 IP 192.168.0.100.51083 > overload.6666: UDP, length 4
10:09:46.451359 IP 192.168.0.100.33849 > overload.6666: UDP, length 4
10:09:46.455349 IP 192.168.0.100.57264 > overload.6666: UDP, length 4
10:09:46.459490 IP 192.168.0.100.53179 > overload.6666: UDP, length 4
10:09:46.463285 IP 192.168.0.100.52624 > overload.6666: UDP, length 4
10:09:46.467873 IP 192.168.0.100.42737 > overload.6666: UDP, length 4
10:09:46.471929 IP 192.168.0.100.44917 > overload.6666: UDP, length 4
10:09:46.475954 IP 192.168.0.100.48148 > overload.6666: UDP, length 4
10:09:46.480000 IP 192.168.0.100.45445 > overload.6666: UDP, length 4
10:09:46.483999 IP 192.168.0.100.50540 > overload.6666: UDP, length 4
10:09:46.485568 IP 192.168.0.100.54425 > overload.7777: UDP, length 4
10:09:46.485597 IP 192.168.0.100.43185 > overload.7777: UDP, length 4
10:09:46.485601 IP 192.168.0.100.60944 > overload.7777: UDP, length 4
10:09:46.485605 IP 192.168.0.100.38279 > overload.7777: UDP, length 4
10:09:46.485609 IP 192.168.0.100.33941 > overload.7777: UDP, length 4
10:09:46.485612 IP 192.168.0.100.56244 > overload.7777: UDP, length 4
10:09:46.485616 IP 192.168.0.100.60310 > overload.7777: UDP, length 4
10:09:46.485619 IP 192.168.0.100.51063 > overload.7777: UDP, length 4
10:09:46.485623 IP 192.168.0.100.58019 > overload.7777: UDP, length 4
10:09:46.485627 IP 192.168.0.100.44122 > overload.7777: UDP, length 4
10:09:46.485630 IP 192.168.0.100.41124 > overload.7777: UDP, length 4
10:09:46.485634 IP 192.168.0.100.59293 > overload.7777: UDP, length 4
10:09:46.485637 IP 192.168.0.100.47383 > overload.7777: UDP, length 4
10:09:46.485641 IP 192.168.0.100.56311 > overload.7777: UDP, length 4
10:09:46.485644 IP 192.168.0.100.33430 > overload.7777: UDP, length 4
10:09:46.485648 IP 192.168.0.100.53919 > overload.7777: UDP, length 4
10:09:46.485652 IP 192.168.0.100.57481 > overload.7777: UDP, length 4
10:09:46.485656 IP 192.168.0.100.40067 > overload.7777: UDP, length 4
10:09:46.485660 IP 192.168.0.100.39276 > overload.7777: UDP, length 4
10:09:46.485663 IP 192.168.0.100.55419 > overload.7777: UDP, length 4
10:09:46.490199 IP 192.168.0.100.47840 > overload.7777: UDP, length 4
10:09:46.494293 IP 192.168.0.100.46115 > overload.7777: UDP, length 4
10:09:46.498366 IP 192.168.0.100.40572 > overload.7777: UDP, length 4
10:09:46.502383 IP 192.168.0.100.49996 > overload.7777: UDP, length 4
10:09:46.505469 IP 192.168.0.100.57103 > overload.6666: UDP, length 4
10:09:46.505494 IP 192.168.0.100.57796 > overload.6666: UDP, length 4
10:09:46.505498 IP 192.168.0.100.44000 > overload.6666: UDP, length 4
10:09:46.505502 IP 192.168.0.100.59283 > overload.6666: UDP, length 4
10:09:46.505505 IP 192.168.0.100.45460 > overload.6666: UDP, length 4
10:09:46.508557 IP 192.168.0.100.39933 > overload.6666: UDP, length 4
10:09:46.512627 IP 192.168.0.100.46806 > overload.6666: UDP, length 4
10:09:46.516849 IP 192.168.0.100.37204 > overload.6666: UDP, length 4
10:09:46.521062 IP 192.168.0.100.60178 > overload.6666: UDP, length 4
10:09:46.525197 IP 192.168.0.100.43000 > overload.6666: UDP, length 4
10:09:46.529501 IP 192.168.0.100.39506 > overload.6666: UDP, length 4
10:09:46.533793 IP 192.168.0.100.52474 > overload.6666: UDP, length 4
10:09:46.537927 IP 192.168.0.100.49411 > overload.6666: UDP, length 4
10:09:46.541725 IP 192.168.0.100.41115 > overload.6666: UDP, length 4
10:09:46.545899 IP 192.168.0.100.34899 > overload.6666: UDP, length 4
10:09:46.550167 IP 192.168.0.100.51281 > overload.6666: UDP, length 4
10:09:46.554285 IP 192.168.0.100.46440 > overload.6666: UDP, length 4
10:09:46.558309 IP 192.168.0.100.47321 > overload.6666: UDP, length 4
10:09:46.562377 IP 192.168.0.100.43756 > overload.6666: UDP, length 4
10:09:46.566479 IP 192.168.0.100.45586 > overload.6666: UDP, length 4
10:09:46.570670 IP 192.168.0.100.57495 > overload.6666: UDP, length 4
10:09:46.574724 IP 192.168.0.100.43394 > overload.6666: UDP, length 4
10:09:46.578915 IP 192.168.0.100.58441 > overload.6666: UDP, length 4
10:09:46.583257 IP 192.168.0.100.43428 > overload.6666: UDP, length 4
10:09:46.585507 IP 192.168.0.100.60856 > overload.7777: UDP, length 4
10:09:46.585536 IP 192.168.0.100.56408 > overload.7777: UDP, length 4
10:09:46.585540 IP 192.168.0.100.56544 > overload.7777: UDP, length 4
10:09:46.585544 IP 192.168.0.100.36672 > overload.7777: UDP, length 4
10:09:46.585547 IP 192.168.0.100.59234 > overload.7777: UDP, length 4
10:09:46.585551 IP 192.168.0.100.37962 > overload.7777: UDP, length 4
10:09:46.585555 IP 192.168.0.100.53596 > overload.7777: UDP, length 4
10:09:46.585558 IP 192.168.0.100.50665 > overload.7777: UDP, length 4
10:09:46.585562 IP 192.168.0.100.34985 > overload.7777: UDP, length 4
10:09:46.585565 IP 192.168.0.100.36064 > overload.7777: UDP, length 4
10:09:46.585569 IP 192.168.0.100.38292 > overload.7777: UDP, length 4
10:09:46.585572 IP 192.168.0.100.36538 > overload.7777: UDP, length 4
10:09:46.585576 IP 192.168.0.100.34902 > overload.7777: UDP, length 4
10:09:46.585579 IP 192.168.0.100.56773 > overload.7777: UDP, length 4
10:09:46.585583 IP 192.168.0.100.50358 > overload.7777: UDP, length 4
10:09:46.585586 IP 192.168.0.100.48506 > overload.7777: UDP, length 4
10:09:46.585591 IP 192.168.0.100.53976 > overload.7777: UDP, length 4
10:09:46.585595 IP 192.168.0.100.33440 > overload.7777: UDP, length 4
10:09:46.585598 IP 192.168.0.100.51576 > overload.7777: UDP, length 4
10:09:46.585602 IP 192.168.0.100.57808 > overload.7777: UDP, length 4
10:09:46.589530 IP 192.168.0.100.54400 > overload.7777: UDP, length 4
10:09:46.593544 IP 192.168.0.100.36320 > overload.7777: UDP, length 4
10:09:46.597564 IP 192.168.0.100.37910 > overload.7777: UDP, length 4
10:09:46.601583 IP 192.168.0.100.45776 > overload.7777: UDP, length 4
10:09:46.605523 IP 192.168.0.100.55565 > overload.6666: UDP, length 4
10:09:46.605553 IP 192.168.0.100.50751 > overload.6666: UDP, length 4
10:09:46.605557 IP 192.168.0.100.44880 > overload.6666: UDP, length 4
10:09:46.605560 IP 192.168.0.100.47340 > overload.6666: UDP, length 4
10:09:46.605564 IP 192.168.0.100.60305 > overload.6666: UDP, length 4
10:09:46.607369 IP 192.168.0.100.32974 > overload.6666: UDP, length 4
10:09:46.611498 IP 192.168.0.100.52145 > overload.6666: UDP, length 4
10:09:46.615699 IP 192.168.0.100.46833 > overload.6666: UDP, length 4
10:09:46.619931 IP 192.168.0.100.59542 > overload.6666: UDP, length 4
10:09:46.624050 IP 192.168.0.100.47179 > overload.6666: UDP, length 4
10:09:46.628130 IP 192.168.0.100.55148 > overload.6666: UDP, length 4
10:09:46.632278 IP 192.168.0.100.56107 > overload.6666: UDP, length 4
10:09:46.636380 IP 192.168.0.100.34330 > overload.6666: UDP, length 4
10:09:46.640515 IP 192.168.0.100.53714 > overload.6666: UDP, length 4
10:09:46.644810 IP 192.168.0.100.49661 > overload.6666: UDP, length 4
10:09:46.648961 IP 192.168.0.100.43747 > overload.6666: UDP, length 4
10:09:46.653340 IP 192.168.0.100.37566 > overload.6666: UDP, length 4
10:09:46.657389 IP 192.168.0.100.40256 > overload.6666: UDP, length 4
10:09:46.661486 IP 192.168.0.100.44491 > overload.6666: UDP, length 4
10:09:46.665533 IP 192.168.0.100.58065 > overload.6666: UDP, length 4
10:09:46.669783 IP 192.168.0.100.40370 > overload.6666: UDP, length 4
10:09:46.673865 IP 192.168.0.100.48494 > overload.6666: UDP, length 4
10:09:46.677915 IP 192.168.0.100.56135 > overload.6666: UDP, length 4
10:09:46.682077 IP 192.168.0.100.47605 > overload.6666: UDP, length 4
10:09:46.685637 IP 192.168.0.100.41423 > overload.7777: UDP, length 4
10:09:46.685666 IP 192.168.0.100.44903 > overload.7777: UDP, length 4
10:09:46.685670 IP 192.168.0.100.56850 > overload.7777: UDP, length 4
10:09:46.685674 IP 192.168.0.100.59252 > overload.7777: UDP, length 4
10:09:46.685678 IP 192.168.0.100.55195 > overload.7777: UDP, length 4
10:09:46.685681 IP 192.168.0.100.34567 > overload.7777: UDP, length 4
10:09:46.685685 IP 192.168.0.100.42774 > overload.7777: UDP, length 4
10:09:46.685688 IP 192.168.0.100.49767 > overload.7777: UDP, length 4
10:09:46.685692 IP 192.168.0.100.33303 > overload.7777: UDP, length 4
10:09:46.685695 IP 192.168.0.100.36929 > overload.7777: UDP, length 4
10:09:46.685699 IP 192.168.0.100.34151 > overload.7777: UDP, length 4
10:09:46.685703 IP 192.168.0.100.60890 > overload.7777: UDP, length 4
10:09:46.685706 IP 192.168.0.100.44261 > overload.7777: UDP, length 4
10:09:46.685710 IP 192.168.0.100.36539 > overload.7777: UDP, length 4
10:09:46.685713 IP 192.168.0.100.50568 > overload.7777: UDP, length 4
10:09:46.685717 IP 192.168.0.100.39731 > overload.7777: UDP, length 4
10:09:46.685721 IP 192.168.0.100.55629 > overload.7777: UDP, length 4
10:09:46.685725 IP 192.168.0.100.43354 > overload.7777: UDP, length 4
10:09:46.685728 IP 192.168.0.100.48778 > overload.7777: UDP, length 4
10:09:46.685732 IP 192.168.0.100.58127 > overload.7777: UDP, length 4
10:09:46.688490 IP 192.168.0.100.42704 > overload.7777: UDP, length 4
10:09:46.692745 IP 192.168.0.100.52750 > overload.7777: UDP, length 4
10:09:46.696876 IP 192.168.0.100.40205 > overload.7777: UDP, length 4
10:09:46.700984 IP 192.168.0.100.33668 > overload.7777: UDP, length 4
10:09:46.704829 IP 192.168.0.100.33195 > overload.7777: UDP, length 4
10:09:46.705420 IP 192.168.0.100.60954 > overload.6666: UDP, length 4
10:09:46.705439 IP 192.168.0.100.44737 > overload.6666: UDP, length 4
10:09:46.705443 IP 192.168.0.100.56625 > overload.6666: UDP, length 4
10:09:46.705447 IP 192.168.0.100.39315 > overload.6666: UDP, length 4
10:09:46.705450 IP 192.168.0.100.49134 > overload.6666: UDP, length 4
10:09:46.706973 IP 192.168.0.100.33203 > overload.6666: UDP, length 4
10:09:46.711095 IP 192.168.0.100.41215 > overload.6666: UDP, length 4
10:09:46.715046 IP 192.168.0.100.39903 > overload.6666: UDP, length 4
10:09:46.719548 IP 192.168.0.100.50139 > overload.6666: UDP, length 4
10:09:46.723671 IP 192.168.0.100.53671 > overload.6666: UDP, length 4
10:09:46.727837 IP 192.168.0.100.33222 > overload.6666: UDP, length 4
10:09:46.731726 IP 192.168.0.100.51656 > overload.6666: UDP, length 4
10:09:46.736329 IP 192.168.0.100.50606 > overload.6666: UDP, length 4
10:09:46.740428 IP 192.168.0.100.46405 > overload.6666: UDP, length 4
10:09:46.744353 IP 192.168.0.100.35535 > overload.6666: UDP, length 4
10:09:46.748782 IP 192.168.0.100.51696 > overload.6666: UDP, length 4
10:09:46.753119 IP 192.168.0.100.60803 > overload.6666: UDP, length 4
10:09:46.757182 IP 192.168.0.100.51201 > overload.6666: UDP, length 4
10:09:46.761292 IP 192.168.0.100.52772 > overload.6666: UDP, length 4
10:09:46.765413 IP 192.168.0.100.48846 > overload.6666: UDP, length 4
10:09:46.769822 IP 192.168.0.100.50869 > overload.6666: UDP, length 4
10:09:46.773888 IP 192.168.0.100.42258 > overload.6666: UDP, length 4
10:09:46.777965 IP 192.168.0.100.35558 > overload.6666: UDP, length 4
10:09:46.782001 IP 192.168.0.100.58078 > overload.6666: UDP, length 4
10:09:46.785655 IP 192.168.0.100.38878 > overload.7777: UDP, length 4
10:09:46.785685 IP 192.168.0.100.34509 > overload.7777: UDP, length 4
10:09:46.785689 IP 192.168.0.100.37295 > overload.7777: UDP, length 4
10:09:46.785693 IP 192.168.0.100.50890 > overload.7777: UDP, length 4
10:09:46.785696 IP 192.168.0.100.60392 > overload.7777: UDP, length 4
10:09:46.785700 IP 192.168.0.100.48589 > overload.7777: UDP, length 4
10:09:46.785704 IP 192.168.0.100.33263 > overload.7777: UDP, length 4
10:09:46.785707 IP 192.168.0.100.38297 > overload.7777: UDP, length 4
10:09:46.785711 IP 192.168.0.100.39726 > overload.7777: UDP, length 4
10:09:46.785714 IP 192.168.0.100.56338 > overload.7777: UDP, length 4
10:09:46.785718 IP 192.168.0.100.55010 > overload.7777: UDP, length 4
10:09:46.785721 IP 192.168.0.100.47651 > overload.7777: UDP, length 4
10:09:46.785725 IP 192.168.0.100.41407 > overload.7777: UDP, length 4
10:09:46.785729 IP 192.168.0.100.34709 > overload.7777: UDP, length 4
10:09:46.785733 IP 192.168.0.100.50172 > overload.7777: UDP, length 4
10:09:46.785736 IP 192.168.0.100.60092 > overload.7777: UDP, length 4
10:09:46.785741 IP 192.168.0.100.48862 > overload.7777: UDP, length 4
10:09:46.785744 IP 192.168.0.100.59447 > overload.7777: UDP, length 4
10:09:46.785748 IP 192.168.0.100.37001 > overload.7777: UDP, length 4
10:09:46.788325 IP 192.168.0.100.55021 > overload.7777: UDP, length 4
10:09:46.792398 IP 192.168.0.100.36311 > overload.7777: UDP, length 4
10:09:46.796848 IP 192.168.0.100.60360 > overload.7777: UDP, length 4
10:09:46.801175 IP 192.168.0.100.58758 > overload.7777: UDP, length 4
10:09:46.805361 IP 192.168.0.100.54541 > overload.7777: UDP, length 4
10:09:46.805392 IP 192.168.0.100.34906 > overload.6666: UDP, length 4
10:09:46.805396 IP 192.168.0.100.53033 > overload.6666: UDP, length 4
10:09:46.805400 IP 192.168.0.100.38046 > overload.6666: UDP, length 4
10:09:46.805403 IP 192.168.0.100.38353 > overload.6666: UDP, length 4
10:09:46.805407 IP 192.168.0.100.55181 > overload.6666: UDP, length 4
10:09:46.807180 IP 192.168.0.100.48107 > overload.6666: UDP, length 4
10:09:46.811395 IP 192.168.0.100.58473 > overload.6666: UDP, length 4
10:09:46.815528 IP 192.168.0.100.49198 > overload.6666: UDP, length 4
10:09:46.819644 IP 192.168.0.100.58527 > overload.6666: UDP, length 4
10:09:46.823599 IP 192.168.0.100.46765 > overload.6666: UDP, length 4
10:09:46.827747 IP 192.168.0.100.34338 > overload.6666: UDP, length 4
10:09:46.832202 IP 192.168.0.100.56761 > overload.6666: UDP, length 4
10:09:46.836481 IP 192.168.0.100.38574 > overload.6666: UDP, length 4
10:09:46.840593 IP 192.168.0.100.60688 > overload.6666: UDP, length 4
10:09:46.844653 IP 192.168.0.100.55577 > overload.6666: UDP, length 4
10:09:46.848745 IP 192.168.0.100.50343 > overload.6666: UDP, length 4
10:09:46.852779 IP 192.168.0.100.41279 > overload.6666: UDP, length 4
10:09:46.857044 IP 192.168.0.100.49572 > overload.6666: UDP, length 4
10:09:46.861191 IP 192.168.0.100.49491 > overload.6666: UDP, length 4
10:09:46.865218 IP 192.168.0.100.40826 > overload.6666: UDP, length 4
10:09:46.869507 IP 192.168.0.100.59872 > overload.6666: UDP, length 4
10:09:46.873615 IP 192.168.0.100.49347 > overload.6666: UDP, length 4
10:09:46.877690 IP 192.168.0.100.48863 > overload.6666: UDP, length 4
10:09:46.881732 IP 192.168.0.100.48041 > overload.6666: UDP, length 4
10:09:46.885658 IP 192.168.0.100.60589 > overload.7777: UDP, length 4
10:09:46.885687 IP 192.168.0.100.55762 > overload.7777: UDP, length 4
10:09:46.885691 IP 192.168.0.100.38886 > overload.7777: UDP, length 4
10:09:46.885695 IP 192.168.0.100.47111 > overload.7777: UDP, length 4
10:09:46.885698 IP 192.168.0.100.52003 > overload.7777: UDP, length 4
10:09:46.885702 IP 192.168.0.100.46911 > overload.7777: UDP, length 4
10:09:46.885705 IP 192.168.0.100.60477 > overload.7777: UDP, length 4
10:09:46.885709 IP 192.168.0.100.39288 > overload.7777: UDP, length 4
10:09:46.885713 IP 192.168.0.100.38125 > overload.7777: UDP, length 4
10:09:46.885716 IP 192.168.0.100.56958 > overload.7777: UDP, length 4
10:09:46.885720 IP 192.168.0.100.50227 > overload.7777: UDP, length 4
10:09:46.885723 IP 192.168.0.100.49298 > overload.7777: UDP, length 4
10:09:46.885727 IP 192.168.0.100.46784 > overload.7777: UDP, length 4
10:09:46.885731 IP 192.168.0.100.50079 > overload.7777: UDP, length 4
10:09:46.885734 IP 192.168.0.100.42096 > overload.7777: UDP, length 4
10:09:46.885738 IP 192.168.0.100.60693 > overload.7777: UDP, length 4
10:09:46.885742 IP 192.168.0.100.44637 > overload.7777: UDP, length 4
10:09:46.885746 IP 192.168.0.100.47518 > overload.7777: UDP, length 4
10:09:46.885750 IP 192.168.0.100.49422 > overload.7777: UDP, length 4
10:09:46.887787 IP 192.168.0.100.58840 > overload.7777: UDP, length 4
10:09:46.891966 IP 192.168.0.100.33407 > overload.7777: UDP, length 4
10:09:46.896483 IP 192.168.0.100.60172 > overload.7777: UDP, length 4
10:09:46.900664 IP 192.168.0.100.46559 > overload.7777: UDP, length 4
10:09:46.904459 IP 192.168.0.100.41029 > overload.7777: UDP, length 4
10:09:46.905453 IP 192.168.0.100.39608 > overload.6666: UDP, length 4
10:09:46.905472 IP 192.168.0.100.45931 > overload.6666: UDP, length 4
10:09:46.905475 IP 192.168.0.100.54818 > overload.6666: UDP, length 4
10:09:46.905479 IP 192.168.0.100.48731 > overload.6666: UDP, length 4
10:09:46.905483 IP 192.168.0.100.42246 > overload.6666: UDP, length 4
10:09:46.906678 IP 192.168.0.100.37885 > overload.6666: UDP, length 4
10:09:46.910797 IP 192.168.0.100.50973 > overload.6666: UDP, length 4
10:09:46.915031 IP 192.168.0.100.43707 > overload.6666: UDP, length 4
10:09:46.919171 IP 192.168.0.100.57317 > overload.6666: UDP, length 4
10:09:46.923342 IP 192.168.0.100.38058 > overload.6666: UDP, length 4
10:09:46.927427 IP 192.168.0.100.41728 > overload.6666: UDP, length 4
10:09:46.931828 IP 192.168.0.100.34051 > overload.6666: UDP, length 4
10:09:46.936095 IP 192.168.0.100.50129 > overload.6666: UDP, length 4
10:09:46.940057 IP 192.168.0.100.44284 > overload.6666: UDP, length 4
10:09:46.944242 IP 192.168.0.100.37110 > overload.6666: UDP, length 4
10:09:46.948238 IP 192.168.0.100.51213 > overload.6666: UDP, length 4
10:09:46.952415 IP 192.168.0.100.37713 > overload.6666: UDP, length 4
10:09:46.956812 IP 192.168.0.100.53636 > overload.6666: UDP, length 4
10:09:46.960867 IP 192.168.0.100.59017 > overload.6666: UDP, length 4
10:09:46.964884 IP 192.168.0.100.42488 > overload.6666: UDP, length 4
10:09:46.969319 IP 192.168.0.100.36141 > overload.6666: UDP, length 4
10:09:46.973357 IP 192.168.0.100.44273 > overload.6666: UDP, length 4
10:09:46.977444 IP 192.168.0.100.56562 > overload.6666: UDP, length 4
10:09:46.981493 IP 192.168.0.100.51181 > overload.6666: UDP, length 4
10:09:46.985687 IP 192.168.0.100.33305 > overload.7777: UDP, length 4
10:09:46.985716 IP 192.168.0.100.47371 > overload.7777: UDP, length 4
10:09:46.985720 IP 192.168.0.100.55843 > overload.7777: UDP, length 4
10:09:46.985724 IP 192.168.0.100.47858 > overload.7777: UDP, length 4
10:09:46.985728 IP 192.168.0.100.52265 > overload.7777: UDP, length 4
10:09:46.985731 IP 192.168.0.100.57686 > overload.7777: UDP, length 4
10:09:46.985735 IP 192.168.0.100.41110 > overload.7777: UDP, length 4
10:09:46.985738 IP 192.168.0.100.42702 > overload.7777: UDP, length 4
10:09:46.985742 IP 192.168.0.100.59382 > overload.7777: UDP, length 4
10:09:46.985745 IP 192.168.0.100.59983 > overload.7777: UDP, length 4
10:09:46.985749 IP 192.168.0.100.60592 > overload.7777: UDP, length 4
10:09:46.985752 IP 192.168.0.100.43797 > overload.7777: UDP, length 4
10:09:46.985756 IP 192.168.0.100.40449 > overload.7777: UDP, length 4
10:09:46.985760 IP 192.168.0.100.41335 > overload.7777: UDP, length 4
10:09:46.985763 IP 192.168.0.100.42767 > overload.7777: UDP, length 4
10:09:46.985767 IP 192.168.0.100.58062 > overload.7777: UDP, length 4
10:09:46.985771 IP 192.168.0.100.53221 > overload.7777: UDP, length 4
10:09:46.985775 IP 192.168.0.100.45036 > overload.7777: UDP, length 4
10:09:46.985779 IP 192.168.0.100.50467 > overload.7777: UDP, length 4
10:09:46.987845 IP 192.168.0.100.46220 > overload.7777: UDP, length 4
10:09:46.991899 IP 192.168.0.100.41294 > overload.7777: UDP, length 4
10:09:46.996095 IP 192.168.0.100.51054 > overload.7777: UDP, length 4
10:09:47.000289 IP 192.168.0.100.58934 > overload.7777: UDP, length 4
10:09:47.004587 IP 192.168.0.100.38258 > overload.7777: UDP, length 4
10:09:47.005668 IP 192.168.0.100.35898 > overload.6666: UDP, length 4
10:09:47.005697 IP 192.168.0.100.45707 > overload.6666: UDP, length 4
10:09:47.005701 IP 192.168.0.100.45501 > overload.6666: UDP, length 4
10:09:47.005704 IP 192.168.0.100.47715 > overload.6666: UDP, length 4
10:09:47.005708 IP 192.168.0.100.36372 > overload.6666: UDP, length 4
10:09:47.006503 IP 192.168.0.100.59303 > overload.6666: UDP, length 4
10:09:47.010859 IP 192.168.0.100.46149 > overload.6666: UDP, length 4
10:09:47.015330 IP 192.168.0.100.51272 > overload.6666: UDP, length 4
10:09:47.019594 IP 192.168.0.100.34194 > overload.6666: UDP, length 4
10:09:47.023602 IP 192.168.0.100.48088 > overload.6666: UDP, length 4
10:09:47.027639 IP 192.168.0.100.57801 > overload.6666: UDP, length 4
10:09:47.031730 IP 192.168.0.100.52426 > overload.6666: UDP, length 4
10:09:47.035760 IP 192.168.0.100.41265 > overload.6666: UDP, length 4
10:09:47.039810 IP 192.168.0.100.42095 > overload.6666: UDP, length 4
10:09:47.044004 IP 192.168.0.100.40380 > overload.6666: UDP, length 4
10:09:47.048425 IP 192.168.0.100.57842 > overload.6666: UDP, length 4
10:09:47.052728 IP 192.168.0.100.60308 > overload.6666: UDP, length 4
10:09:47.056906 IP 192.168.0.100.44758 > overload.6666: UDP, length 4
10:09:47.060771 IP 192.168.0.100.52178 > overload.6666: UDP, length 4
10:09:47.064821 IP 192.168.0.100.37609 > overload.6666: UDP, length 4
10:09:47.069153 IP 192.168.0.100.46147 > overload.6666: UDP, length 4
10:09:47.073020 IP 192.168.0.100.53298 > overload.6666: UDP, length 4
10:09:47.077384 IP 192.168.0.100.57352 > overload.6666: UDP, length 4
10:09:47.081881 IP 192.168.0.100.46775 > overload.6666: UDP, length 4
10:09:47.085506 IP 192.168.0.100.60219 > overload.7777: UDP, length 4
10:09:47.085535 IP 192.168.0.100.42287 > overload.7777: UDP, length 4
10:09:47.085539 IP 192.168.0.100.51613 > overload.7777: UDP, length 4
10:09:47.085542 IP 192.168.0.100.54986 > overload.7777: UDP, length 4
10:09:47.085546 IP 192.168.0.100.57419 > overload.7777: UDP, length 4
10:09:47.085549 IP 192.168.0.100.35153 > overload.7777: UDP, length 4
10:09:47.085553 IP 192.168.0.100.41839 > overload.7777: UDP, length 4
10:09:47.085556 IP 192.168.0.100.39586 > overload.7777: UDP, length 4
10:09:47.085560 IP 192.168.0.100.59660 > overload.7777: UDP, length 4
10:09:47.085563 IP 192.168.0.100.58674 > overload.7777: UDP, length 4
10:09:47.085567 IP 192.168.0.100.42319 > overload.7777: UDP, length 4
10:09:47.085570 IP 192.168.0.100.43103 > overload.7777: UDP, length 4
10:09:47.085574 IP 192.168.0.100.52429 > overload.7777: UDP, length 4
10:09:47.085577 IP 192.168.0.100.56320 > overload.7777: UDP, length 4
10:09:47.085581 IP 192.168.0.100.35787 > overload.7777: UDP, length 4
10:09:47.085584 IP 192.168.0.100.36678 > overload.7777: UDP, length 4
10:09:47.085589 IP 192.168.0.100.42054 > overload.7777: UDP, length 4
10:09:47.085593 IP 192.168.0.100.49985 > overload.7777: UDP, length 4
10:09:47.085596 IP 192.168.0.100.55745 > overload.7777: UDP, length 4
10:09:47.088298 IP 192.168.0.100.36855 > overload.7777: UDP, length 4
10:09:47.092441 IP 192.168.0.100.39394 > overload.7777: UDP, length 4
10:09:47.096662 IP 192.168.0.100.35544 > overload.7777: UDP, length 4
10:09:47.100770 IP 192.168.0.100.34503 > overload.7777: UDP, length 4
10:09:47.104925 IP 192.168.0.100.55831 > overload.7777: UDP, length 4
10:09:47.105615 IP 192.168.0.100.60039 > overload.6666: UDP, length 4
10:09:47.105644 IP 192.168.0.100.56932 > overload.6666: UDP, length 4
10:09:47.105648 IP 192.168.0.100.59288 > overload.6666: UDP, length 4
10:09:47.105652 IP 192.168.0.100.48414 > overload.6666: UDP, length 4
10:09:47.105655 IP 192.168.0.100.45795 > overload.6666: UDP, length 4
10:09:47.106777 IP 192.168.0.100.44621 > overload.6666: UDP, length 4
10:09:47.110954 IP 192.168.0.100.46909 > overload.6666: UDP, length 4
10:09:47.115115 IP 192.168.0.100.33677 > overload.6666: UDP, length 4
10:09:47.119457 IP 192.168.0.100.33655 > overload.6666: UDP, length 4
10:09:47.123496 IP 192.168.0.100.45040 > overload.6666: UDP, length 4
10:09:47.127660 IP 192.168.0.100.43198 > overload.6666: UDP, length 4
10:09:47.131588 IP 192.168.0.100.46822 > overload.6666: UDP, length 4
10:09:47.135729 IP 192.168.0.100.45878 > overload.6666: UDP, length 4
10:09:47.140021 IP 192.168.0.100.41413 > overload.6666: UDP, length 4
10:09:47.144140 IP 192.168.0.100.49079 > overload.6666: UDP, length 4
10:09:47.148278 IP 192.168.0.100.54388 > overload.6666: UDP, length 4
10:09:47.152323 IP 192.168.0.100.42148 > overload.6666: UDP, length 4
10:09:47.156618 IP 192.168.0.100.39848 > overload.6666: UDP, length 4
10:09:47.160708 IP 192.168.0.100.49514 > overload.6666: UDP, length 4
10:09:47.165004 IP 192.168.0.100.38731 > overload.6666: UDP, length 4
10:09:47.169204 IP 192.168.0.100.34409 > overload.6666: UDP, length 4
10:09:47.173318 IP 192.168.0.100.58501 > overload.6666: UDP, length 4
10:09:47.177371 IP 192.168.0.100.33545 > overload.6666: UDP, length 4
10:09:47.181576 IP 192.168.0.100.39218 > overload.6666: UDP, length 4
10:09:47.185666 IP 192.168.0.100.53609 > overload.7777: UDP, length 4
10:09:47.185696 IP 192.168.0.100.45940 > overload.7777: UDP, length 4
10:09:47.185700 IP 192.168.0.100.36240 > overload.7777: UDP, length 4
10:09:47.185703 IP 192.168.0.100.37324 > overload.7777: UDP, length 4
10:09:47.185707 IP 192.168.0.100.39821 > overload.7777: UDP, length 4
10:09:47.185711 IP 192.168.0.100.51187 > overload.7777: UDP, length 4
10:09:47.185714 IP 192.168.0.100.43162 > overload.7777: UDP, length 4
10:09:47.185718 IP 192.168.0.100.45717 > overload.7777: UDP, length 4
10:09:47.185721 IP 192.168.0.100.50454 > overload.7777: UDP, length 4
10:09:47.185725 IP 192.168.0.100.58096 > overload.7777: UDP, length 4
10:09:47.185728 IP 192.168.0.100.43832 > overload.7777: UDP, length 4
10:09:47.185732 IP 192.168.0.100.54185 > overload.7777: UDP, length 4
10:09:47.185735 IP 192.168.0.100.41183 > overload.7777: UDP, length 4
10:09:47.185739 IP 192.168.0.100.52107 > overload.7777: UDP, length 4
10:09:47.185742 IP 192.168.0.100.48548 > overload.7777: UDP, length 4
10:09:47.185746 IP 192.168.0.100.40283 > overload.7777: UDP, length 4
10:09:47.185751 IP 192.168.0.100.42595 > overload.7777: UDP, length 4
10:09:47.185754 IP 192.168.0.100.44133 > overload.7777: UDP, length 4
10:09:47.185758 IP 192.168.0.100.40559 > overload.7777: UDP, length 4
10:09:47.187817 IP 192.168.0.100.54418 > overload.7777: UDP, length 4
10:09:47.191865 IP 192.168.0.100.52497 > overload.7777: UDP, length 4
10:09:47.196143 IP 192.168.0.100.33934 > overload.7777: UDP, length 4
10:09:47.200369 IP 192.168.0.100.42727 > overload.7777: UDP, length 4
10:09:47.204345 IP 192.168.0.100.52955 > overload.7777: UDP, length 4
10:09:47.205400 IP 192.168.0.100.41266 > overload.6666: UDP, length 4
10:09:47.205429 IP 192.168.0.100.38538 > overload.6666: UDP, length 4
10:09:47.205433 IP 192.168.0.100.40865 > overload.6666: UDP, length 4
10:09:47.205437 IP 192.168.0.100.52871 > overload.6666: UDP, length 4
10:09:47.205440 IP 192.168.0.100.50526 > overload.6666: UDP, length 4
10:09:47.206362 IP 192.168.0.100.33626 > overload.6666: UDP, length 4
10:09:47.210412 IP 192.168.0.100.33250 > overload.6666: UDP, length 4
10:09:47.214496 IP 192.168.0.100.44820 > overload.6666: UDP, length 4
10:09:47.218733 IP 192.168.0.100.43557 > overload.6666: UDP, length 4
10:09:47.222990 IP 192.168.0.100.45810 > overload.6666: UDP, length 4
10:09:47.226805 IP 192.168.0.100.38757 > overload.6666: UDP, length 4
10:09:47.231280 IP 192.168.0.100.60448 > overload.6666: UDP, length 4
10:09:47.235562 IP 192.168.0.100.34187 > overload.6666: UDP, length 4
10:09:47.239635 IP 192.168.0.100.55782 > overload.6666: UDP, length 4
10:09:47.243732 IP 192.168.0.100.60621 > overload.6666: UDP, length 4
10:09:47.247792 IP 192.168.0.100.50010 > overload.6666: UDP, length 4
10:09:47.251596 IP 192.168.0.100.53614 > overload.6666: UDP, length 4
10:09:47.255683 IP 192.168.0.100.32983 > overload.6666: UDP, length 4
10:09:47.259882 IP 192.168.0.100.55505 > overload.6666: UDP, length 4
10:09:47.264117 IP 192.168.0.100.38231 > overload.6666: UDP, length 4
10:09:47.285788 IP 192.168.0.100.55231 > overload.7777: UDP, length 4
10:09:47.285817 IP 192.168.0.100.56602 > overload.7777: UDP, length 4
10:09:47.285822 IP 192.168.0.100.59741 > overload.7777: UDP, length 4
10:09:47.285825 IP 192.168.0.100.33474 > overload.7777: UDP, length 4
10:09:47.285829 IP 192.168.0.100.37081 > overload.7777: UDP, length 4
10:09:47.285832 IP 192.168.0.100.44678 > overload.7777: UDP, length 4
10:09:47.285836 IP 192.168.0.100.32866 > overload.7777: UDP, length 4
10:09:47.285840 IP 192.168.0.100.56280 > overload.7777: UDP, length 4
10:09:47.285843 IP 192.168.0.100.49569 > overload.7777: UDP, length 4
10:09:47.285847 IP 192.168.0.100.48761 > overload.7777: UDP, length 4
10:09:47.285851 IP 192.168.0.100.56734 > overload.7777: UDP, length 4
10:09:47.285854 IP 192.168.0.100.38775 > overload.7777: UDP, length 4
10:09:47.285858 IP 192.168.0.100.50911 > overload.7777: UDP, length 4
10:09:47.285861 IP 192.168.0.100.59419 > overload.7777: UDP, length 4
10:09:47.285865 IP 192.168.0.100.51122 > overload.7777: UDP, length 4
