17:58:42.870778 IP 192.168.0.100.54477 > overload.7777: UDP, length 4
17:58:42.890945 IP 192.168.0.100.42503 > overload.6666: UDP, length 4
17:58:42.970944 IP 192.168.0.100.49653 > overload.7777: UDP, length 4
17:58:42.990833 IP 192.168.0.100.54786 > overload.6666: UDP, length 4
17:58:43.070897 IP 192.168.0.100.35383 > overload.7777: UDP, length 4
17:58:43.090937 IP 192.168.0.100.59787 > overload.6666: UDP, length 4
17:58:43.170822 IP 192.168.0.100.38315 > overload.7777: UDP, length 4
17:58:43.190862 IP 192.168.0.100.32820 > overload.6666: UDP, length 4
17:58:43.270938 IP 192.168.0.100.41820 > overload.7777: UDP, length 4
17:58:43.290949 IP 192.168.0.100.45029 > overload.6666: UDP, length 4
17:58:43.370941 IP 192.168.0.100.49668 > overload.7777: UDP, length 4
17:58:43.390949 IP 192.168.0.100.48669 > overload.6666: UDP, length 4
17:58:43.470963 IP 192.168.0.100.39076 > overload.7777: UDP, length 4
17:58:43.490957 IP 192.168.0.100.33015 > overload.6666: UDP, length 4
17:58:43.570949 IP 192.168.0.100.52892 > overload.7777: UDP, length 4
17:58:43.590909 IP 192.168.0.100.42271 > overload.6666: UDP, length 4
17:58:43.670937 IP 192.168.0.100.58461 > overload.7777: UDP, length 4
17:58:43.690814 IP 192.168.0.100.57167 > overload.6666: UDP, length 4
17:58:43.770947 IP 192.168.0.100.39838 > overload.7777: UDP, length 4
17:58:43.790783 IP 192.168.0.100.60882 > overload.6666: UDP, length 4
17:58:43.870958 IP 192.168.0.100.44090 > overload.7777: UDP, length 4
17:58:43.890922 IP 192.168.0.100.44296 > overload.6666: UDP, length 4
17:58:43.970929 IP 192.168.0.100.38727 > overload.7777: UDP, length 4
17:58:43.990921 IP 192.168.0.100.45067 > overload.6666: UDP, length 4
17:58:44.070935 IP 192.168.0.100.37722 > overload.7777: UDP, length 4
17:58:44.090877 IP 192.168.0.100.40075 > overload.6666: UDP, length 4
17:58:44.170783 IP 192.168.0.100.41211 > overload.7777: UDP, length 4
17:58:44.190953 IP 192.168.0.100.58535 > overload.6666: UDP, length 4
17:58:44.270802 IP 192.168.0.100.42513 > overload.7777: UDP, length 4
17:58:44.290944 IP 192.168.0.100.39627 > overload.6666: UDP, length 4
17:58:44.370950 IP 192.168.0.100.49638 > overload.7777: UDP, length 4
17:58:44.390951 IP 192.168.0.100.55819 > overload.6666: UDP, length 4
17:58:44.470926 IP 192.168.0.100.60052 > overload.7777: UDP, length 4
17:58:44.490957 IP 192.168.0.100.57406 > overload.6666: UDP, length 4
17:58:44.570955 IP 192.168.0.100.60465 > overload.7777: UDP, length 4
17:58:44.590940 IP 192.168.0.100.46696 > overload.6666: UDP, length 4
17:58:44.670940 IP 192.168.0.100.53407 > overload.7777: UDP, length 4
17:58:44.690930 IP 192.168.0.100.54987 > overload.6666: UDP, length 4
17:58:44.770958 IP 192.168.0.100.59807 > overload.7777: UDP, length 4
17:58:44.790894 IP 192.168.0.100.47191 > overload.6666: UDP, length 4
17:58:44.870900 IP 192.168.0.100.59160 > overload.7777: UDP, length 4
17:58:44.890904 IP 192.168.0.100.49819 > overload.6666: UDP, length 4
17:58:44.970891 IP 192.168.0.100.55676 > overload.7777: UDP, length 4
17:58:44.990910 IP 192.168.0.100.38134 > overload.6666: UDP, length 4
17:58:45.070953 IP 192.168.0.100.45673 > overload.7777: UDP, length 4
17:58:45.090816 IP 192.168.0.100.39663 > overload.6666: UDP, length 4
17:58:45.170781 IP 192.168.0.100.41979 > overload.7777: UDP, length 4
17:58:45.190941 IP 192.168.0.100.50848 > overload.6666: UDP, length 4
17:58:45.270939 IP 192.168.0.100.38911 > overload.7777: UDP, length 4
17:58:45.290947 IP 192.168.0.100.52858 > overload.6666: UDP, length 4
17:58:45.370932 IP 192.168.0.100.55085 > overload.7777: UDP, length 4
17:58:45.390942 IP 192.168.0.100.42444 > overload.6666: UDP, length 4
17:58:45.470894 IP 192.168.0.100.47122 > overload.7777: UDP, length 4
17:58:45.490913 IP 192.168.0.100.55272 > overload.6666: UDP, length 4
17:58:45.570940 IP 192.168.0.100.44879 > overload.7777: UDP, length 4
17:58:45.590870 IP 192.168.0.100.55132 > overload.6666: UDP, length 4
17:58:45.670932 IP 192.168.0.100.41427 > overload.7777: UDP, length 4
17:58:45.690916 IP 192.168.0.100.51835 > overload.6666: UDP, length 4
17:58:45.770887 IP 192.168.0.100.38472 > overload.7777: UDP, length 4
17:58:45.790946 IP 192.168.0.100.60437 > overload.6666: UDP, length 4
17:58:45.870944 IP 192.168.0.100.42930 > overload.7777: UDP, length 4
17:58:45.890942 IP 192.168.0.100.37611 > overload.6666: UDP, length 4
17:58:45.970937 IP 192.168.0.100.46704 > overload.7777: UDP, length 4
17:58:45.990944 IP 192.168.0.100.49526 > overload.6666: UDP, length 4
17:58:46.070818 IP 192.168.0.100.48401 > overload.7777: UDP, length 4
17:58:46.090814 IP 192.168.0.100.40112 > overload.6666: UDP, length 4
17:58:46.170932 IP 192.168.0.100.53908 > overload.7777: UDP, length 4
17:58:46.190942 IP 192.168.0.100.53615 > overload.6666: UDP, length 4
17:58:46.270936 IP 192.168.0.100.54769 > overload.7777: UDP, length 4
17:58:46.290935 IP 192.168.0.100.56145 > overload.6666: UDP, length 4
17:58:46.370927 IP 192.168.0.100.34934 > overload.7777: UDP, length 4
17:58:46.390946 IP 192.168.0.100.50055 > overload.6666: UDP, length 4
17:58:46.470936 IP 192.168.0.100.41900 > overload.7777: UDP, length 4
17:58:46.490946 IP 192.168.0.100.45959 > overload.6666: UDP, length 4
17:58:46.570933 IP 192.168.0.100.50021 > overload.7777: UDP, length 4
17:58:46.590942 IP 192.168.0.100.53109 > overload.6666: UDP, length 4
