17:32:52.677909 IP 192.168.0.100.48465 > c309-pc-04.7777: UDP, length 4
17:32:52.678493 IP 192.168.0.100.51914 > c309-pc-04.6666: UDP, length 4
17:32:52.683823 IP 192.168.0.100.49191 > c309-pc-04.7777: UDP, length 4
17:32:52.684028 IP 192.168.0.100.50184 > c309-pc-04.6666: UDP, length 4
17:32:52.685852 IP 192.168.0.100.48018 > c309-pc-04.7777: UDP, length 4
17:32:52.685972 IP 192.168.0.100.43362 > c309-pc-04.6666: UDP, length 4
17:32:52.687536 IP 192.168.0.100.60788 > c309-pc-04.6666: UDP, length 4
17:32:52.687677 IP 192.168.0.100.58298 > c309-pc-04.7777: UDP, length 4
17:32:52.688802 IP 192.168.0.100.55946 > c309-pc-04.7777: UDP, length 4
17:32:52.688889 IP 192.168.0.100.32776 > c309-pc-04.6666: UDP, length 4
17:32:52.690269 IP 192.168.0.100.46642 > c309-pc-04.6666: UDP, length 4
17:32:52.690806 IP 192.168.0.100.53894 > c309-pc-04.7777: UDP, length 4
17:32:52.691595 IP 192.168.0.100.49864 > c309-pc-04.6666: UDP, length 4
17:32:52.691683 IP 192.168.0.100.48676 > c309-pc-04.7777: UDP, length 4
17:32:52.692813 IP 192.168.0.100.52239 > c309-pc-04.7777: UDP, length 4
17:32:52.692905 IP 192.168.0.100.60253 > c309-pc-04.6666: UDP, length 4
17:32:52.693961 IP 192.168.0.100.44297 > c309-pc-04.7777: UDP, length 4
17:32:52.694115 IP 192.168.0.100.40762 > c309-pc-04.6666: UDP, length 4
17:32:52.695586 IP 192.168.0.100.39757 > c309-pc-04.6666: UDP, length 4
17:32:52.695672 IP 192.168.0.100.49041 > c309-pc-04.7777: UDP, length 4
17:32:52.696765 IP 192.168.0.100.34350 > c309-pc-04.6666: UDP, length 4
17:32:52.696854 IP 192.168.0.100.55828 > c309-pc-04.7777: UDP, length 4
17:32:52.697948 IP 192.168.0.100.44853 > c309-pc-04.7777: UDP, length 4
17:32:52.698034 IP 192.168.0.100.39184 > c309-pc-04.6666: UDP, length 4
17:32:52.699442 IP 192.168.0.100.51124 > c309-pc-04.6666: UDP, length 4
17:32:52.699718 IP 192.168.0.100.51797 > c309-pc-04.7777: UDP, length 4
17:32:52.700767 IP 192.168.0.100.33353 > c309-pc-04.7777: UDP, length 4
17:32:52.700855 IP 192.168.0.100.52290 > c309-pc-04.6666: UDP, length 4
17:32:52.702519 IP 192.168.0.100.35786 > c309-pc-04.6666: UDP, length 4
17:32:52.702676 IP 192.168.0.100.50952 > c309-pc-04.7777: UDP, length 4
17:32:52.704495 IP 192.168.0.100.37426 > c309-pc-04.6666: UDP, length 4
17:32:52.704667 IP 192.168.0.100.39109 > c309-pc-04.7777: UDP, length 4
17:32:52.705850 IP 192.168.0.100.47679 > c309-pc-04.7777: UDP, length 4
17:32:52.705937 IP 192.168.0.100.53421 > c309-pc-04.6666: UDP, length 4
17:32:52.707183 IP 192.168.0.100.43423 > c309-pc-04.6666: UDP, length 4
17:32:52.707811 IP 192.168.0.100.35163 > c309-pc-04.7777: UDP, length 4
17:32:52.708469 IP 192.168.0.100.44955 > c309-pc-04.6666: UDP, length 4
17:32:52.708672 IP 192.168.0.100.59947 > c309-pc-04.7777: UDP, length 4
17:32:52.709869 IP 192.168.0.100.48317 > c309-pc-04.7777: UDP, length 4
17:32:52.709957 IP 192.168.0.100.50882 > c309-pc-04.6666: UDP, length 4
17:32:52.711156 IP 192.168.0.100.58519 > c309-pc-04.6666: UDP, length 4
17:32:52.711799 IP 192.168.0.100.56446 > c309-pc-04.7777: UDP, length 4
17:32:52.712438 IP 192.168.0.100.52831 > c309-pc-04.6666: UDP, length 4
17:32:52.712712 IP 192.168.0.100.33951 > c309-pc-04.7777: UDP, length 4
17:32:52.713844 IP 192.168.0.100.43554 > c309-pc-04.7777: UDP, length 4
17:32:52.713931 IP 192.168.0.100.41974 > c309-pc-04.6666: UDP, length 4
17:32:52.715161 IP 192.168.0.100.35397 > c309-pc-04.6666: UDP, length 4
17:32:52.715814 IP 192.168.0.100.41567 > c309-pc-04.7777: UDP, length 4
17:32:52.716439 IP 192.168.0.100.56292 > c309-pc-04.6666: UDP, length 4
17:32:52.716696 IP 192.168.0.100.41301 > c309-pc-04.7777: UDP, length 4
17:32:52.717762 IP 192.168.0.100.34603 > c309-pc-04.6666: UDP, length 4
17:32:52.717849 IP 192.168.0.100.35460 > c309-pc-04.7777: UDP, length 4
17:32:52.719161 IP 192.168.0.100.55192 > c309-pc-04.6666: UDP, length 4
17:32:52.719813 IP 192.168.0.100.32849 > c309-pc-04.7777: UDP, length 4
17:32:52.720447 IP 192.168.0.100.41398 > c309-pc-04.6666: UDP, length 4
17:32:52.720719 IP 192.168.0.100.58871 > c309-pc-04.7777: UDP, length 4
17:32:52.721923 IP 192.168.0.100.44367 > c309-pc-04.7777: UDP, length 4
17:32:52.722009 IP 192.168.0.100.48380 > c309-pc-04.6666: UDP, length 4
17:32:52.723195 IP 192.168.0.100.55216 > c309-pc-04.6666: UDP, length 4
17:32:52.723752 IP 192.168.0.100.52949 > c309-pc-04.7777: UDP, length 4
17:32:52.724507 IP 192.168.0.100.57107 > c309-pc-04.6666: UDP, length 4
17:32:52.724628 IP 192.168.0.100.36352 > c309-pc-04.7777: UDP, length 4
17:32:52.725972 IP 192.168.0.100.46788 > c309-pc-04.6666: UDP, length 4
17:32:52.726831 IP 192.168.0.100.38796 > c309-pc-04.7777: UDP, length 4
17:32:52.727240 IP 192.168.0.100.45407 > c309-pc-04.6666: UDP, length 4
17:32:52.727806 IP 192.168.0.100.39211 > c309-pc-04.7777: UDP, length 4
17:32:52.728395 IP 192.168.0.100.40724 > c309-pc-04.6666: UDP, length 4
17:32:52.728679 IP 192.168.0.100.50094 > c309-pc-04.7777: UDP, length 4
17:32:52.729875 IP 192.168.0.100.39140 > c309-pc-04.6666: UDP, length 4
17:32:52.730719 IP 192.168.0.100.55305 > c309-pc-04.7777: UDP, length 4
17:32:52.731034 IP 192.168.0.100.52708 > c309-pc-04.6666: UDP, length 4
17:32:52.731718 IP 192.168.0.100.60162 > c309-pc-04.7777: UDP, length 4
17:32:52.732354 IP 192.168.0.100.43923 > c309-pc-04.6666: UDP, length 4
17:32:52.732677 IP 192.168.0.100.55350 > c309-pc-04.7777: UDP, length 4
17:32:52.733646 IP 192.168.0.100.43487 > c309-pc-04.6666: UDP, length 4
17:32:52.734733 IP 192.168.0.100.56243 > c309-pc-04.7777: UDP, length 4
17:32:52.734977 IP 192.168.0.100.60709 > c309-pc-04.6666: UDP, length 4
17:32:52.735720 IP 192.168.0.100.40239 > c309-pc-04.7777: UDP, length 4
17:32:52.736353 IP 192.168.0.100.34806 > c309-pc-04.6666: UDP, length 4
17:32:52.736678 IP 192.168.0.100.42969 > c309-pc-04.7777: UDP, length 4
17:32:52.737856 IP 192.168.0.100.41159 > c309-pc-04.7777: UDP, length 4
17:32:52.737914 IP 192.168.0.100.35782 > c309-pc-04.6666: UDP, length 4
17:32:52.739505 IP 192.168.0.100.49423 > c309-pc-04.6666: UDP, length 4
17:32:52.739639 IP 192.168.0.100.50643 > c309-pc-04.7777: UDP, length 4
17:32:52.741089 IP 192.168.0.100.33801 > c309-pc-04.6666: UDP, length 4
17:32:52.741728 IP 192.168.0.100.48258 > c309-pc-04.7777: UDP, length 4
17:32:52.742509 IP 192.168.0.100.35501 > c309-pc-04.6666: UDP, length 4
17:32:52.742643 IP 192.168.0.100.44876 > c309-pc-04.7777: UDP, length 4
17:32:52.743806 IP 192.168.0.100.58566 > c309-pc-04.7777: UDP, length 4
17:32:52.743863 IP 192.168.0.100.47815 > c309-pc-04.6666: UDP, length 4
17:32:52.745233 IP 192.168.0.100.53580 > c309-pc-04.6666: UDP, length 4
17:32:52.745720 IP 192.168.0.100.36502 > c309-pc-04.7777: UDP, length 4
17:32:52.746548 IP 192.168.0.100.50758 > c309-pc-04.6666: UDP, length 4
17:32:52.746636 IP 192.168.0.100.49353 > c309-pc-04.7777: UDP, length 4
17:32:52.747824 IP 192.168.0.100.50792 > c309-pc-04.7777: UDP, length 4
17:32:52.747880 IP 192.168.0.100.45053 > c309-pc-04.6666: UDP, length 4
17:32:52.749206 IP 192.168.0.100.60078 > c309-pc-04.6666: UDP, length 4
17:32:52.749716 IP 192.168.0.100.41041 > c309-pc-04.7777: UDP, length 4
17:32:52.750560 IP 192.168.0.100.45647 > c309-pc-04.6666: UDP, length 4
17:32:52.750632 IP 192.168.0.100.51158 > c309-pc-04.7777: UDP, length 4
17:32:52.751776 IP 192.168.0.100.56833 > c309-pc-04.7777: UDP, length 4
17:32:52.751845 IP 192.168.0.100.39059 > c309-pc-04.6666: UDP, length 4
17:32:52.753257 IP 192.168.0.100.42755 > c309-pc-04.6666: UDP, length 4
17:32:52.753719 IP 192.168.0.100.41011 > c309-pc-04.7777: UDP, length 4
17:32:52.754553 IP 192.168.0.100.43541 > c309-pc-04.6666: UDP, length 4
17:32:52.754635 IP 192.168.0.100.49944 > c309-pc-04.7777: UDP, length 4
17:32:52.756000 IP 192.168.0.100.42573 > c309-pc-04.6666: UDP, length 4
17:32:52.756679 IP 192.168.0.100.34406 > c309-pc-04.7777: UDP, length 4
17:32:52.757390 IP 192.168.0.100.41716 > c309-pc-04.6666: UDP, length 4
17:32:52.757715 IP 192.168.0.100.35275 > c309-pc-04.7777: UDP, length 4
17:32:52.758732 IP 192.168.0.100.40064 > c309-pc-04.7777: UDP, length 4
17:32:52.758819 IP 192.168.0.100.33062 > c309-pc-04.6666: UDP, length 4
17:32:52.760086 IP 192.168.0.100.57902 > c309-pc-04.6666: UDP, length 4
17:32:52.760700 IP 192.168.0.100.48158 > c309-pc-04.7777: UDP, length 4
17:32:52.761442 IP 192.168.0.100.37220 > c309-pc-04.6666: UDP, length 4
17:32:52.761677 IP 192.168.0.100.37322 > c309-pc-04.7777: UDP, length 4
17:32:52.762748 IP 192.168.0.100.36424 > c309-pc-04.7777: UDP, length 4
17:32:52.762833 IP 192.168.0.100.47976 > c309-pc-04.6666: UDP, length 4
17:32:52.764112 IP 192.168.0.100.48984 > c309-pc-04.6666: UDP, length 4
17:32:52.764702 IP 192.168.0.100.56576 > c309-pc-04.7777: UDP, length 4
17:32:52.765452 IP 192.168.0.100.42722 > c309-pc-04.6666: UDP, length 4
17:32:52.765680 IP 192.168.0.100.41553 > c309-pc-04.7777: UDP, length 4
17:32:52.766775 IP 192.168.0.100.57959 > c309-pc-04.7777: UDP, length 4
17:32:52.766842 IP 192.168.0.100.55240 > c309-pc-04.6666: UDP, length 4
17:32:52.768194 IP 192.168.0.100.32963 > c309-pc-04.6666: UDP, length 4
17:32:52.768727 IP 192.168.0.100.56883 > c309-pc-04.7777: UDP, length 4
17:32:52.769501 IP 192.168.0.100.40037 > c309-pc-04.6666: UDP, length 4
17:32:52.769678 IP 192.168.0.100.47624 > c309-pc-04.7777: UDP, length 4
17:32:52.770873 IP 192.168.0.100.42755 > c309-pc-04.6666: UDP, length 4
17:32:52.771716 IP 192.168.0.100.47381 > c309-pc-04.7777: UDP, length 4
17:32:52.772403 IP 192.168.0.100.34422 > c309-pc-04.6666: UDP, length 4
17:32:52.772700 IP 192.168.0.100.57092 > c309-pc-04.7777: UDP, length 4
17:32:52.774340 IP 192.168.0.100.43288 > c309-pc-04.6666: UDP, length 4
17:32:52.774717 IP 192.168.0.100.47607 > c309-pc-04.7777: UDP, length 4
17:32:52.775758 IP 192.168.0.100.36697 > c309-pc-04.7777: UDP, length 4
17:32:52.775837 IP 192.168.0.100.47455 > c309-pc-04.6666: UDP, length 4
17:32:52.777107 IP 192.168.0.100.60032 > c309-pc-04.6666: UDP, length 4
17:32:52.777717 IP 192.168.0.100.38293 > c309-pc-04.7777: UDP, length 4
17:32:52.778420 IP 192.168.0.100.56450 > c309-pc-04.6666: UDP, length 4
17:32:52.778717 IP 192.168.0.100.38620 > c309-pc-04.7777: UDP, length 4
17:32:52.779853 IP 192.168.0.100.51087 > c309-pc-04.6666: UDP, length 4
17:32:52.780700 IP 192.168.0.100.49657 > c309-pc-04.7777: UDP, length 4
17:32:52.781068 IP 192.168.0.100.36382 > c309-pc-04.6666: UDP, length 4
17:32:52.781719 IP 192.168.0.100.58048 > c309-pc-04.7777: UDP, length 4
17:32:52.782389 IP 192.168.0.100.33177 > c309-pc-04.6666: UDP, length 4
17:32:52.782678 IP 192.168.0.100.57446 > c309-pc-04.7777: UDP, length 4
17:32:52.783898 IP 192.168.0.100.34298 > c309-pc-04.6666: UDP, length 4
17:32:52.784701 IP 192.168.0.100.45844 > c309-pc-04.7777: UDP, length 4
17:32:52.785045 IP 192.168.0.100.46232 > c309-pc-04.6666: UDP, length 4
17:32:52.785718 IP 192.168.0.100.36069 > c309-pc-04.7777: UDP, length 4
17:32:52.786355 IP 192.168.0.100.37808 > c309-pc-04.6666: UDP, length 4
17:32:52.786677 IP 192.168.0.100.35375 > c309-pc-04.7777: UDP, length 4
17:32:52.787830 IP 192.168.0.100.51864 > c309-pc-04.7777: UDP, length 4
17:32:52.787881 IP 192.168.0.100.42043 > c309-pc-04.6666: UDP, length 4
17:32:52.789216 IP 192.168.0.100.38158 > c309-pc-04.6666: UDP, length 4
17:32:52.789724 IP 192.168.0.100.55384 > c309-pc-04.7777: UDP, length 4
17:32:52.790747 IP 192.168.0.100.51933 > c309-pc-04.7777: UDP, length 4
17:32:52.790828 IP 192.168.0.100.53649 > c309-pc-04.6666: UDP, length 4
17:32:52.792237 IP 192.168.0.100.58025 > c309-pc-04.6666: UDP, length 4
17:32:52.792718 IP 192.168.0.100.47905 > c309-pc-04.7777: UDP, length 4
17:32:52.793537 IP 192.168.0.100.37071 > c309-pc-04.6666: UDP, length 4
17:32:52.793618 IP 192.168.0.100.41324 > c309-pc-04.7777: UDP, length 4
17:32:52.794886 IP 192.168.0.100.46939 > c309-pc-04.6666: UDP, length 4
17:32:52.795732 IP 192.168.0.100.60993 > c309-pc-04.7777: UDP, length 4
17:32:52.796227 IP 192.168.0.100.55626 > c309-pc-04.6666: UDP, length 4
17:32:52.796719 IP 192.168.0.100.47412 > c309-pc-04.7777: UDP, length 4
17:32:52.797529 IP 192.168.0.100.41565 > c309-pc-04.6666: UDP, length 4
17:32:52.797637 IP 192.168.0.100.47440 > c309-pc-04.7777: UDP, length 4
17:32:52.798829 IP 192.168.0.100.38123 > c309-pc-04.7777: UDP, length 4
17:32:52.798881 IP 192.168.0.100.51430 > c309-pc-04.6666: UDP, length 4
17:32:52.800306 IP 192.168.0.100.48093 > c309-pc-04.6666: UDP, length 4
17:32:52.800700 IP 192.168.0.100.51535 > c309-pc-04.7777: UDP, length 4
17:32:52.801602 IP 192.168.0.100.60742 > c309-pc-04.6666: UDP, length 4
17:32:52.801653 IP 192.168.0.100.39288 > c309-pc-04.7777: UDP, length 4
17:32:52.802738 IP 192.168.0.100.49565 > c309-pc-04.7777: UDP, length 4
17:32:52.802982 IP 192.168.0.100.60116 > c309-pc-04.6666: UDP, length 4
17:32:52.804224 IP 192.168.0.100.60329 > c309-pc-04.6666: UDP, length 4
17:32:52.804700 IP 192.168.0.100.53919 > c309-pc-04.7777: UDP, length 4
17:32:52.805601 IP 192.168.0.100.34522 > c309-pc-04.6666: UDP, length 4
17:32:52.805652 IP 192.168.0.100.57833 > c309-pc-04.7777: UDP, length 4
17:32:52.806706 IP 192.168.0.100.50410 > c309-pc-04.7777: UDP, length 4
17:32:52.806841 IP 192.168.0.100.43459 > c309-pc-04.6666: UDP, length 4
17:32:52.808215 IP 192.168.0.100.37802 > c309-pc-04.6666: UDP, length 4
17:32:52.808702 IP 192.168.0.100.36108 > c309-pc-04.7777: UDP, length 4
17:32:52.809479 IP 192.168.0.100.57282 > c309-pc-04.6666: UDP, length 4
17:32:52.809721 IP 192.168.0.100.60864 > c309-pc-04.7777: UDP, length 4
17:32:52.810698 IP 192.168.0.100.54575 > c309-pc-04.7777: UDP, length 4
17:32:52.810870 IP 192.168.0.100.41500 > c309-pc-04.6666: UDP, length 4
17:32:52.811999 IP 192.168.0.100.44049 > c309-pc-04.6666: UDP, length 4
17:32:52.812702 IP 192.168.0.100.51331 > c309-pc-04.7777: UDP, length 4
17:32:52.813298 IP 192.168.0.100.35097 > c309-pc-04.6666: UDP, length 4
17:32:52.813717 IP 192.168.0.100.45656 > c309-pc-04.7777: UDP, length 4
17:32:52.814573 IP 192.168.0.100.46346 > c309-pc-04.6666: UDP, length 4
17:32:52.814647 IP 192.168.0.100.57383 > c309-pc-04.7777: UDP, length 4
17:32:52.815765 IP 192.168.0.100.45352 > c309-pc-04.7777: UDP, length 4
17:32:52.815839 IP 192.168.0.100.44736 > c309-pc-04.6666: UDP, length 4
17:32:52.817151 IP 192.168.0.100.37566 > c309-pc-04.6666: UDP, length 4
17:32:52.817722 IP 192.168.0.100.53867 > c309-pc-04.7777: UDP, length 4
17:32:52.818474 IP 192.168.0.100.50394 > c309-pc-04.6666: UDP, length 4
17:32:52.818685 IP 192.168.0.100.51605 > c309-pc-04.7777: UDP, length 4
17:32:52.820026 IP 192.168.0.100.58012 > c309-pc-04.6666: UDP, length 4
17:32:52.820710 IP 192.168.0.100.59873 > c309-pc-04.7777: UDP, length 4
17:32:52.821532 IP 192.168.0.100.38169 > c309-pc-04.6666: UDP, length 4
17:32:52.821619 IP 192.168.0.100.51958 > c309-pc-04.7777: UDP, length 4
17:32:52.823298 IP 192.168.0.100.48949 > c309-pc-04.6666: UDP, length 4
17:32:52.823716 IP 192.168.0.100.56006 > c309-pc-04.7777: UDP, length 4
17:32:52.824972 IP 192.168.0.100.53017 > c309-pc-04.6666: UDP, length 4
17:32:52.825716 IP 192.168.0.100.54100 > c309-pc-04.7777: UDP, length 4
17:32:52.826649 IP 192.168.0.100.33880 > c309-pc-04.6666: UDP, length 4
17:32:52.826701 IP 192.168.0.100.45248 > c309-pc-04.7777: UDP, length 4
17:32:52.828003 IP 192.168.0.100.39802 > c309-pc-04.6666: UDP, length 4
17:32:52.828702 IP 192.168.0.100.45252 > c309-pc-04.7777: UDP, length 4
17:32:52.829402 IP 192.168.0.100.42969 > c309-pc-04.6666: UDP, length 4
17:32:52.829716 IP 192.168.0.100.46095 > c309-pc-04.7777: UDP, length 4
17:32:52.830714 IP 192.168.0.100.43422 > c309-pc-04.7777: UDP, length 4
17:32:52.830837 IP 192.168.0.100.51173 > c309-pc-04.6666: UDP, length 4
17:32:52.832070 IP 192.168.0.100.50225 > c309-pc-04.6666: UDP, length 4
17:32:52.832717 IP 192.168.0.100.56739 > c309-pc-04.7777: UDP, length 4
17:32:52.833365 IP 192.168.0.100.42148 > c309-pc-04.6666: UDP, length 4
17:32:52.833716 IP 192.168.0.100.49184 > c309-pc-04.7777: UDP, length 4
17:32:52.834655 IP 192.168.0.100.51777 > c309-pc-04.7777: UDP, length 4
17:32:52.834873 IP 192.168.0.100.60303 > c309-pc-04.6666: UDP, length 4
17:32:52.836047 IP 192.168.0.100.55727 > c309-pc-04.6666: UDP, length 4
17:32:52.836710 IP 192.168.0.100.54340 > c309-pc-04.7777: UDP, length 4
17:32:52.837530 IP 192.168.0.100.53921 > c309-pc-04.6666: UDP, length 4
17:32:52.837623 IP 192.168.0.100.46633 > c309-pc-04.7777: UDP, length 4
17:32:52.838790 IP 192.168.0.100.44646 > c309-pc-04.7777: UDP, length 4
17:32:52.838842 IP 192.168.0.100.47315 > c309-pc-04.6666: UDP, length 4
17:32:52.840114 IP 192.168.0.100.36924 > c309-pc-04.6666: UDP, length 4
17:32:52.840708 IP 192.168.0.100.37129 > c309-pc-04.7777: UDP, length 4
17:32:52.841401 IP 192.168.0.100.46949 > c309-pc-04.6666: UDP, length 4
17:32:52.841717 IP 192.168.0.100.49074 > c309-pc-04.7777: UDP, length 4
17:32:52.842656 IP 192.168.0.100.57650 > c309-pc-04.6666: UDP, length 4
17:32:52.842708 IP 192.168.0.100.38121 > c309-pc-04.7777: UDP, length 4
17:32:52.843826 IP 192.168.0.100.59956 > c309-pc-04.7777: UDP, length 4
17:32:52.844038 IP 192.168.0.100.49760 > c309-pc-04.6666: UDP, length 4
17:32:52.845207 IP 192.168.0.100.41364 > c309-pc-04.6666: UDP, length 4
17:32:52.845722 IP 192.168.0.100.36558 > c309-pc-04.7777: UDP, length 4
17:32:52.846573 IP 192.168.0.100.37056 > c309-pc-04.6666: UDP, length 4
17:32:52.846641 IP 192.168.0.100.39873 > c309-pc-04.7777: UDP, length 4
17:32:52.848030 IP 192.168.0.100.50272 > c309-pc-04.6666: UDP, length 4
17:32:52.848700 IP 192.168.0.100.38611 > c309-pc-04.7777: UDP, length 4
17:32:52.849308 IP 192.168.0.100.56335 > c309-pc-04.6666: UDP, length 4
17:32:52.849716 IP 192.168.0.100.57422 > c309-pc-04.7777: UDP, length 4
17:32:52.850523 IP 192.168.0.100.40584 > c309-pc-04.6666: UDP, length 4
17:32:52.850653 IP 192.168.0.100.50162 > c309-pc-04.7777: UDP, length 4
17:32:52.851873 IP 192.168.0.100.51899 > c309-pc-04.6666: UDP, length 4
17:32:52.852715 IP 192.168.0.100.60635 > c309-pc-04.7777: UDP, length 4
17:32:52.853267 IP 192.168.0.100.34064 > c309-pc-04.6666: UDP, length 4
17:32:52.853719 IP 192.168.0.100.45410 > c309-pc-04.7777: UDP, length 4
17:32:52.854542 IP 192.168.0.100.39817 > c309-pc-04.6666: UDP, length 4
17:32:52.854622 IP 192.168.0.100.48152 > c309-pc-04.7777: UDP, length 4
17:32:52.855969 IP 192.168.0.100.34570 > c309-pc-04.6666: UDP, length 4
17:32:52.856680 IP 192.168.0.100.33679 > c309-pc-04.7777: UDP, length 4
17:32:52.857459 IP 192.168.0.100.56201 > c309-pc-04.6666: UDP, length 4
17:32:52.857679 IP 192.168.0.100.58088 > c309-pc-04.7777: UDP, length 4
17:32:52.859173 IP 192.168.0.100.53905 > c309-pc-04.6666: UDP, length 4
17:32:52.859723 IP 192.168.0.100.56438 > c309-pc-04.7777: UDP, length 4
17:32:52.860841 IP 192.168.0.100.60610 > c309-pc-04.7777: UDP, length 4
17:32:52.860893 IP 192.168.0.100.44010 > c309-pc-04.6666: UDP, length 4
17:32:52.862529 IP 192.168.0.100.53318 > c309-pc-04.6666: UDP, length 4
17:32:52.862637 IP 192.168.0.100.57733 > c309-pc-04.7777: UDP, length 4
17:32:52.863971 IP 192.168.0.100.50895 > c309-pc-04.6666: UDP, length 4
17:32:52.864703 IP 192.168.0.100.36003 > c309-pc-04.7777: UDP, length 4
17:32:52.865337 IP 192.168.0.100.37989 > c309-pc-04.6666: UDP, length 4
17:32:52.865723 IP 192.168.0.100.51304 > c309-pc-04.7777: UDP, length 4
17:32:52.866790 IP 192.168.0.100.34648 > c309-pc-04.7777: UDP, length 4
17:32:52.866968 IP 192.168.0.100.40559 > c309-pc-04.6666: UDP, length 4
17:32:52.868201 IP 192.168.0.100.36885 > c309-pc-04.6666: UDP, length 4
17:32:52.868695 IP 192.168.0.100.35082 > c309-pc-04.7777: UDP, length 4
17:32:52.869571 IP 192.168.0.100.49334 > c309-pc-04.6666: UDP, length 4
17:32:52.869641 IP 192.168.0.100.52545 > c309-pc-04.7777: UDP, length 4
17:32:52.870850 IP 192.168.0.100.42203 > c309-pc-04.6666: UDP, length 4
17:32:52.871718 IP 192.168.0.100.36637 > c309-pc-04.7777: UDP, length 4
17:32:52.872546 IP 192.168.0.100.58221 > c309-pc-04.6666: UDP, length 4
17:32:52.872633 IP 192.168.0.100.47578 > c309-pc-04.7777: UDP, length 4
17:32:52.873786 IP 192.168.0.100.36112 > c309-pc-04.7777: UDP, length 4
17:32:52.873841 IP 192.168.0.100.36371 > c309-pc-04.6666: UDP, length 4
17:32:52.875199 IP 192.168.0.100.49079 > c309-pc-04.6666: UDP, length 4
17:32:52.875718 IP 192.168.0.100.41718 > c309-pc-04.7777: UDP, length 4
17:32:52.876829 IP 192.168.0.100.56077 > c309-pc-04.7777: UDP, length 4
17:32:52.876881 IP 192.168.0.100.46003 > c309-pc-04.6666: UDP, length 4
17:32:52.878179 IP 192.168.0.100.41323 > c309-pc-04.6666: UDP, length 4
17:32:52.878720 IP 192.168.0.100.45507 > c309-pc-04.7777: UDP, length 4
17:32:52.879619 IP 192.168.0.100.34505 > c309-pc-04.6666: UDP, length 4
17:32:52.879671 IP 192.168.0.100.55812 > c309-pc-04.7777: UDP, length 4
17:32:52.880866 IP 192.168.0.100.59927 > c309-pc-04.7777: UDP, length 4
17:32:52.880918 IP 192.168.0.100.47839 > c309-pc-04.6666: UDP, length 4
17:32:52.882258 IP 192.168.0.100.52751 > c309-pc-04.6666: UDP, length 4
17:32:52.882714 IP 192.168.0.100.49532 > c309-pc-04.7777: UDP, length 4
17:32:52.883755 IP 192.168.0.100.35477 > c309-pc-04.7777: UDP, length 4
17:32:52.883838 IP 192.168.0.100.53175 > c309-pc-04.6666: UDP, length 4
17:32:52.885064 IP 192.168.0.100.41935 > c309-pc-04.6666: UDP, length 4
17:32:52.885722 IP 192.168.0.100.38956 > c309-pc-04.7777: UDP, length 4
17:32:52.886468 IP 192.168.0.100.38198 > c309-pc-04.6666: UDP, length 4
17:32:52.886663 IP 192.168.0.100.36407 > c309-pc-04.7777: UDP, length 4
17:32:52.887830 IP 192.168.0.100.57117 > c309-pc-04.7777: UDP, length 4
17:32:52.887882 IP 192.168.0.100.39997 > c309-pc-04.6666: UDP, length 4
17:32:52.889477 IP 192.168.0.100.39376 > c309-pc-04.6666: UDP, length 4
17:32:52.889673 IP 192.168.0.100.57710 > c309-pc-04.7777: UDP, length 4
17:32:52.891118 IP 192.168.0.100.42061 > c309-pc-04.6666: UDP, length 4
17:32:52.891714 IP 192.168.0.100.47992 > c309-pc-04.7777: UDP, length 4
17:32:52.892735 IP 192.168.0.100.56381 > c309-pc-04.7777: UDP, length 4
17:32:52.892816 IP 192.168.0.100.57434 > c309-pc-04.6666: UDP, length 4
17:32:52.894467 IP 192.168.0.100.59508 > c309-pc-04.6666: UDP, length 4
17:32:52.894681 IP 192.168.0.100.44527 > c309-pc-04.7777: UDP, length 4
17:32:52.895721 IP 192.168.0.100.53241 > c309-pc-04.7777: UDP, length 4
17:32:52.895837 IP 192.168.0.100.43189 > c309-pc-04.6666: UDP, length 4
17:32:52.897412 IP 192.168.0.100.44698 > c309-pc-04.6666: UDP, length 4
17:32:52.897716 IP 192.168.0.100.40470 > c309-pc-04.7777: UDP, length 4
17:32:52.899002 IP 192.168.0.100.38183 > c309-pc-04.6666: UDP, length 4
17:32:52.899718 IP 192.168.0.100.33930 > c309-pc-04.7777: UDP, length 4
17:32:52.900273 IP 192.168.0.100.36792 > c309-pc-04.6666: UDP, length 4
17:32:52.900726 IP 192.168.0.100.47212 > c309-pc-04.7777: UDP, length 4
17:32:52.901605 IP 192.168.0.100.35641 > c309-pc-04.6666: UDP, length 4
17:32:52.901729 IP 192.168.0.100.34020 > c309-pc-04.7777: UDP, length 4
17:32:52.902898 IP 192.168.0.100.37024 > c309-pc-04.6666: UDP, length 4
17:32:52.903722 IP 192.168.0.100.32973 > c309-pc-04.7777: UDP, length 4
17:32:52.904254 IP 192.168.0.100.46903 > c309-pc-04.6666: UDP, length 4
17:32:52.904722 IP 192.168.0.100.41272 > c309-pc-04.7777: UDP, length 4
17:32:52.905599 IP 192.168.0.100.34973 > c309-pc-04.6666: UDP, length 4
17:32:52.905651 IP 192.168.0.100.42571 > c309-pc-04.7777: UDP, length 4
17:32:52.907000 IP 192.168.0.100.56722 > c309-pc-04.6666: UDP, length 4
17:32:52.907717 IP 192.168.0.100.51754 > c309-pc-04.7777: UDP, length 4
17:32:52.908337 IP 192.168.0.100.54119 > c309-pc-04.6666: UDP, length 4
17:32:52.908719 IP 192.168.0.100.43643 > c309-pc-04.7777: UDP, length 4
17:32:52.909681 IP 192.168.0.100.59124 > c309-pc-04.7777: UDP, length 4
17:32:52.909873 IP 192.168.0.100.38169 > c309-pc-04.6666: UDP, length 4
17:32:52.911157 IP 192.168.0.100.46226 > c309-pc-04.6666: UDP, length 4
17:32:52.911717 IP 192.168.0.100.41167 > c309-pc-04.7777: UDP, length 4
17:32:52.912470 IP 192.168.0.100.42675 > c309-pc-04.6666: UDP, length 4
17:32:52.912720 IP 192.168.0.100.47003 > c309-pc-04.7777: UDP, length 4
17:32:52.913634 IP 192.168.0.100.52894 > c309-pc-04.6666: UDP, length 4
17:32:52.913680 IP 192.168.0.100.36650 > c309-pc-04.7777: UDP, length 4
17:32:52.914841 IP 192.168.0.100.44601 > c309-pc-04.7777: UDP, length 4
17:32:52.915023 IP 192.168.0.100.51995 > c309-pc-04.6666: UDP, length 4
17:32:52.916248 IP 192.168.0.100.52819 > c309-pc-04.6666: UDP, length 4
17:32:52.916698 IP 192.168.0.100.40470 > c309-pc-04.7777: UDP, length 4
17:32:52.917524 IP 192.168.0.100.35959 > c309-pc-04.6666: UDP, length 4
17:32:52.917636 IP 192.168.0.100.33793 > c309-pc-04.7777: UDP, length 4
17:32:52.918674 IP 192.168.0.100.33992 > c309-pc-04.7777: UDP, length 4
17:32:52.918868 IP 192.168.0.100.51526 > c309-pc-04.6666: UDP, length 4
17:32:52.919839 IP 192.168.0.100.44544 > c309-pc-04.7777: UDP, length 4
17:32:52.920034 IP 192.168.0.100.51593 > c309-pc-04.6666: UDP, length 4
17:32:52.921316 IP 192.168.0.100.35696 > c309-pc-04.6666: UDP, length 4
17:32:52.921717 IP 192.168.0.100.45160 > c309-pc-04.7777: UDP, length 4
17:32:52.922680 IP 192.168.0.100.43006 > c309-pc-04.7777: UDP, length 4
17:32:52.922873 IP 192.168.0.100.46933 > c309-pc-04.6666: UDP, length 4
17:32:52.923767 IP 192.168.0.100.36574 > c309-pc-04.7777: UDP, length 4
17:32:52.923957 IP 192.168.0.100.38231 > c309-pc-04.6666: UDP, length 4
17:32:52.925311 IP 192.168.0.100.33131 > c309-pc-04.6666: UDP, length 4
17:32:52.925715 IP 192.168.0.100.44366 > c309-pc-04.7777: UDP, length 4
17:32:52.926585 IP 192.168.0.100.58385 > c309-pc-04.6666: UDP, length 4
17:32:52.926637 IP 192.168.0.100.40865 > c309-pc-04.7777: UDP, length 4
17:32:52.927968 IP 192.168.0.100.56358 > c309-pc-04.6666: UDP, length 4
17:32:52.928699 IP 192.168.0.100.56759 > c309-pc-04.7777: UDP, length 4
17:32:52.929238 IP 192.168.0.100.54338 > c309-pc-04.6666: UDP, length 4
17:32:52.929718 IP 192.168.0.100.53866 > c309-pc-04.7777: UDP, length 4
17:32:52.930569 IP 192.168.0.100.56708 > c309-pc-04.6666: UDP, length 4
17:32:52.930643 IP 192.168.0.100.49015 > c309-pc-04.7777: UDP, length 4
17:32:52.932082 IP 192.168.0.100.38403 > c309-pc-04.6666: UDP, length 4
17:32:52.932699 IP 192.168.0.100.57674 > c309-pc-04.7777: UDP, length 4
17:32:52.933437 IP 192.168.0.100.60676 > c309-pc-04.6666: UDP, length 4
17:32:52.933678 IP 192.168.0.100.51206 > c309-pc-04.7777: UDP, length 4
17:32:52.934721 IP 192.168.0.100.43097 > c309-pc-04.7777: UDP, length 4
17:32:52.934837 IP 192.168.0.100.33100 > c309-pc-04.6666: UDP, length 4
17:32:52.936186 IP 192.168.0.100.42255 > c309-pc-04.6666: UDP, length 4
17:32:52.936699 IP 192.168.0.100.56720 > c309-pc-04.7777: UDP, length 4
17:32:52.937631 IP 192.168.0.100.47125 > c309-pc-04.6666: UDP, length 4
17:32:52.937683 IP 192.168.0.100.37442 > c309-pc-04.7777: UDP, length 4
17:32:52.939025 IP 192.168.0.100.51300 > c309-pc-04.6666: UDP, length 4
17:32:52.939717 IP 192.168.0.100.58966 > c309-pc-04.7777: UDP, length 4
17:32:52.940469 IP 192.168.0.100.41920 > c309-pc-04.6666: UDP, length 4
17:32:52.940671 IP 192.168.0.100.32913 > c309-pc-04.7777: UDP, length 4
17:32:52.941706 IP 192.168.0.100.49833 > c309-pc-04.7777: UDP, length 4
17:32:52.941842 IP 192.168.0.100.56826 > c309-pc-04.6666: UDP, length 4
17:32:52.943140 IP 192.168.0.100.48226 > c309-pc-04.6666: UDP, length 4
17:32:52.943719 IP 192.168.0.100.46074 > c309-pc-04.7777: UDP, length 4
17:32:52.944501 IP 192.168.0.100.52359 > c309-pc-04.6666: UDP, length 4
17:32:52.944679 IP 192.168.0.100.58726 > c309-pc-04.7777: UDP, length 4
17:32:52.945678 IP 192.168.0.100.55311 > c309-pc-04.7777: UDP, length 4
17:32:52.945874 IP 192.168.0.100.50801 > c309-pc-04.6666: UDP, length 4
17:32:52.946712 IP 192.168.0.100.60160 > c309-pc-04.7777: UDP, length 4
17:32:52.947163 IP 192.168.0.100.33827 > c309-pc-04.6666: UDP, length 4
17:32:52.948437 IP 192.168.0.100.33695 > c309-pc-04.6666: UDP, length 4
17:32:52.948700 IP 192.168.0.100.56965 > c309-pc-04.7777: UDP, length 4
17:32:52.949715 IP 192.168.0.100.44275 > c309-pc-04.7777: UDP, length 4
17:32:52.949839 IP 192.168.0.100.59301 > c309-pc-04.6666: UDP, length 4
17:32:52.950678 IP 192.168.0.100.36980 > c309-pc-04.7777: UDP, length 4
17:32:52.950990 IP 192.168.0.100.48889 > c309-pc-04.6666: UDP, length 4
17:32:52.951857 IP 192.168.0.100.34451 > c309-pc-04.7777: UDP, length 4
17:32:52.952226 IP 192.168.0.100.46874 > c309-pc-04.6666: UDP, length 4
17:32:52.953519 IP 192.168.0.100.52498 > c309-pc-04.6666: UDP, length 4
17:32:52.953648 IP 192.168.0.100.53872 > c309-pc-04.7777: UDP, length 4
17:32:52.954716 IP 192.168.0.100.43230 > c309-pc-04.7777: UDP, length 4
17:32:52.954844 IP 192.168.0.100.53160 > c309-pc-04.6666: UDP, length 4
17:32:52.955809 IP 192.168.0.100.37969 > c309-pc-04.7777: UDP, length 4
17:32:52.956200 IP 192.168.0.100.50061 > c309-pc-04.6666: UDP, length 4
17:32:52.957471 IP 192.168.0.100.35361 > c309-pc-04.6666: UDP, length 4
17:32:52.957716 IP 192.168.0.100.55163 > c309-pc-04.7777: UDP, length 4
17:32:52.958721 IP 192.168.0.100.55391 > c309-pc-04.7777: UDP, length 4
17:32:52.958833 IP 192.168.0.100.35959 > c309-pc-04.6666: UDP, length 4
17:32:52.959757 IP 192.168.0.100.42310 > c309-pc-04.7777: UDP, length 4
17:32:52.960145 IP 192.168.0.100.37169 > c309-pc-04.6666: UDP, length 4
17:32:52.961474 IP 192.168.0.100.48272 > c309-pc-04.6666: UDP, length 4
17:32:52.961720 IP 192.168.0.100.43512 > c309-pc-04.7777: UDP, length 4
17:32:52.962712 IP 192.168.0.100.41415 > c309-pc-04.7777: UDP, length 4
17:32:52.962846 IP 192.168.0.100.40763 > c309-pc-04.6666: UDP, length 4
17:32:52.963678 IP 192.168.0.100.56742 > c309-pc-04.7777: UDP, length 4
17:32:52.964100 IP 192.168.0.100.58327 > c309-pc-04.6666: UDP, length 4
17:32:52.965340 IP 192.168.0.100.34167 > c309-pc-04.6666: UDP, length 4
17:32:52.965717 IP 192.168.0.100.38540 > c309-pc-04.7777: UDP, length 4
17:32:52.966585 IP 192.168.0.100.54261 > c309-pc-04.6666: UDP, length 4
17:32:52.966636 IP 192.168.0.100.58264 > c309-pc-04.7777: UDP, length 4
17:32:52.967679 IP 192.168.0.100.46257 > c309-pc-04.7777: UDP, length 4
17:32:52.967872 IP 192.168.0.100.54289 > c309-pc-04.6666: UDP, length 4
17:32:52.968747 IP 192.168.0.100.52454 > c309-pc-04.7777: UDP, length 4
17:32:52.969212 IP 192.168.0.100.36653 > c309-pc-04.6666: UDP, length 4
17:32:52.970516 IP 192.168.0.100.43264 > c309-pc-04.6666: UDP, length 4
17:32:52.970645 IP 192.168.0.100.42963 > c309-pc-04.7777: UDP, length 4
17:32:52.971720 IP 192.168.0.100.32837 > c309-pc-04.7777: UDP, length 4
17:32:52.971910 IP 192.168.0.100.60517 > c309-pc-04.6666: UDP, length 4
17:32:52.972711 IP 192.168.0.100.47650 > c309-pc-04.7777: UDP, length 4
17:32:52.973312 IP 192.168.0.100.60007 > c309-pc-04.6666: UDP, length 4
17:32:52.974616 IP 192.168.0.100.37330 > c309-pc-04.6666: UDP, length 4
17:32:52.974661 IP 192.168.0.100.49614 > c309-pc-04.7777: UDP, length 4
17:32:52.975719 IP 192.168.0.100.44075 > c309-pc-04.7777: UDP, length 4
17:32:52.976063 IP 192.168.0.100.37272 > c309-pc-04.6666: UDP, length 4
17:32:52.976738 IP 192.168.0.100.37766 > c309-pc-04.7777: UDP, length 4
17:32:52.977406 IP 192.168.0.100.49346 > c309-pc-04.6666: UDP, length 4
17:32:52.978654 IP 192.168.0.100.38045 > c309-pc-04.6666: UDP, length 4
17:32:52.978706 IP 192.168.0.100.58026 > c309-pc-04.7777: UDP, length 4
17:32:52.979718 IP 192.168.0.100.57534 > c309-pc-04.7777: UDP, length 4
17:32:52.980036 IP 192.168.0.100.56067 > c309-pc-04.6666: UDP, length 4
17:32:52.980725 IP 192.168.0.100.34796 > c309-pc-04.7777: UDP, length 4
17:32:52.981303 IP 192.168.0.100.45942 > c309-pc-04.6666: UDP, length 4
17:32:52.982491 IP 192.168.0.100.44889 > c309-pc-04.6666: UDP, length 4
17:32:52.982671 IP 192.168.0.100.59612 > c309-pc-04.7777: UDP, length 4
17:32:52.983719 IP 192.168.0.100.57852 > c309-pc-04.7777: UDP, length 4
17:32:52.983833 IP 192.168.0.100.52429 > c309-pc-04.6666: UDP, length 4
17:32:52.984677 IP 192.168.0.100.34231 > c309-pc-04.7777: UDP, length 4
17:32:52.985261 IP 192.168.0.100.40904 > c309-pc-04.6666: UDP, length 4
17:32:52.985977 IP 192.168.0.100.40376 > c309-pc-04.7777: UDP, length 4
17:32:52.986597 IP 192.168.0.100.55512 > c309-pc-04.6666: UDP, length 4
17:32:52.987916 IP 192.168.0.100.43836 > c309-pc-04.7777: UDP, length 4
17:32:52.987998 IP 192.168.0.100.40781 > c309-pc-04.6666: UDP, length 4
17:32:52.988898 IP 192.168.0.100.39537 > c309-pc-04.7777: UDP, length 4
17:32:52.989011 IP 192.168.0.100.41166 > c309-pc-04.6666: UDP, length 4
17:32:52.989937 IP 192.168.0.100.60758 > c309-pc-04.7777: UDP, length 4
17:32:52.990547 IP 192.168.0.100.33363 > c309-pc-04.6666: UDP, length 4
17:32:52.991815 IP 192.168.0.100.52480 > c309-pc-04.6666: UDP, length 4
17:32:52.991888 IP 192.168.0.100.51163 > c309-pc-04.7777: UDP, length 4
17:32:52.992919 IP 192.168.0.100.36771 > c309-pc-04.7777: UDP, length 4
17:32:52.992997 IP 192.168.0.100.49766 > c309-pc-04.6666: UDP, length 4
17:32:52.993883 IP 192.168.0.100.53675 > c309-pc-04.7777: UDP, length 4
17:32:52.994494 IP 192.168.0.100.42680 > c309-pc-04.6666: UDP, length 4
17:32:52.995731 IP 192.168.0.100.38132 > c309-pc-04.6666: UDP, length 4
17:32:52.995803 IP 192.168.0.100.53865 > c309-pc-04.7777: UDP, length 4
17:32:52.996899 IP 192.168.0.100.52548 > c309-pc-04.7777: UDP, length 4
17:32:52.996981 IP 192.168.0.100.54285 > c309-pc-04.6666: UDP, length 4
17:32:52.997870 IP 192.168.0.100.49337 > c309-pc-04.7777: UDP, length 4
17:32:52.998033 IP 192.168.0.100.57493 > c309-pc-04.6666: UDP, length 4
17:32:52.999552 IP 192.168.0.100.55871 > c309-pc-04.6666: UDP, length 4
17:32:52.999671 IP 192.168.0.100.51324 > c309-pc-04.7777: UDP, length 4
17:32:53.000748 IP 192.168.0.100.33361 > c309-pc-04.6666: UDP, length 4
17:32:53.000831 IP 192.168.0.100.57997 > c309-pc-04.7777: UDP, length 4
17:32:53.001693 IP 192.168.0.100.42578 > c309-pc-04.7777: UDP, length 4
17:32:53.001833 IP 192.168.0.100.49815 > c309-pc-04.6666: UDP, length 4
17:32:53.003221 IP 192.168.0.100.49509 > c309-pc-04.6666: UDP, length 4
17:32:53.003886 IP 192.168.0.100.45728 > c309-pc-04.7777: UDP, length 4
17:32:53.004548 IP 192.168.0.100.35427 > c309-pc-04.6666: UDP, length 4
17:32:53.004669 IP 192.168.0.100.43128 > c309-pc-04.7777: UDP, length 4
17:32:53.005863 IP 192.168.0.100.59771 > c309-pc-04.7777: UDP, length 4
17:32:53.005946 IP 192.168.0.100.47429 > c309-pc-04.6666: UDP, length 4
17:32:53.007395 IP 192.168.0.100.45135 > c309-pc-04.6666: UDP, length 4
17:32:53.007799 IP 192.168.0.100.43954 > c309-pc-04.7777: UDP, length 4
17:32:53.008809 IP 192.168.0.100.40464 > c309-pc-04.7777: UDP, length 4
17:32:53.008898 IP 192.168.0.100.42489 > c309-pc-04.6666: UDP, length 4
17:32:53.010282 IP 192.168.0.100.55791 > c309-pc-04.6666: UDP, length 4
17:32:53.010808 IP 192.168.0.100.54338 > c309-pc-04.7777: UDP, length 4
17:32:53.011572 IP 192.168.0.100.57648 > c309-pc-04.6666: UDP, length 4
17:32:53.011650 IP 192.168.0.100.38439 > c309-pc-04.7777: UDP, length 4
17:32:53.012875 IP 192.168.0.100.45656 > c309-pc-04.7777: UDP, length 4
17:32:53.012916 IP 192.168.0.100.37167 > c309-pc-04.6666: UDP, length 4
17:32:53.014252 IP 192.168.0.100.37829 > c309-pc-04.6666: UDP, length 4
17:32:53.014827 IP 192.168.0.100.41857 > c309-pc-04.7777: UDP, length 4
17:32:53.015658 IP 192.168.0.100.57354 > c309-pc-04.6666: UDP, length 4
17:32:53.015735 IP 192.168.0.100.57911 > c309-pc-04.7777: UDP, length 4
17:32:53.016845 IP 192.168.0.100.55069 > c309-pc-04.7777: UDP, length 4
17:32:53.016932 IP 192.168.0.100.42470 > c309-pc-04.6666: UDP, length 4
17:32:53.018388 IP 192.168.0.100.47715 > c309-pc-04.6666: UDP, length 4
17:32:53.018803 IP 192.168.0.100.46156 > c309-pc-04.7777: UDP, length 4
17:32:53.019666 IP 192.168.0.100.56428 > c309-pc-04.6666: UDP, length 4
17:32:53.019752 IP 192.168.0.100.51757 > c309-pc-04.7777: UDP, length 4
17:32:53.020797 IP 192.168.0.100.60889 > c309-pc-04.7777: UDP, length 4
17:32:53.020885 IP 192.168.0.100.34498 > c309-pc-04.6666: UDP, length 4
17:32:53.022334 IP 192.168.0.100.52895 > c309-pc-04.6666: UDP, length 4
17:32:53.022799 IP 192.168.0.100.49678 > c309-pc-04.7777: UDP, length 4
17:32:53.023608 IP 192.168.0.100.53404 > c309-pc-04.6666: UDP, length 4
17:32:53.023694 IP 192.168.0.100.44970 > c309-pc-04.7777: UDP, length 4
17:32:53.024680 IP 192.168.0.100.35427 > c309-pc-04.7777: UDP, length 4
17:32:53.024879 IP 192.168.0.100.41851 > c309-pc-04.6666: UDP, length 4
17:32:53.026211 IP 192.168.0.100.40774 > c309-pc-04.6666: UDP, length 4
17:32:53.026722 IP 192.168.0.100.60007 > c309-pc-04.7777: UDP, length 4
17:32:53.027579 IP 192.168.0.100.36216 > c309-pc-04.6666: UDP, length 4
17:32:53.027648 IP 192.168.0.100.40093 > c309-pc-04.7777: UDP, length 4
17:32:53.028754 IP 192.168.0.100.56841 > c309-pc-04.7777: UDP, length 4
17:32:53.028972 IP 192.168.0.100.42894 > c309-pc-04.6666: UDP, length 4
17:32:53.030399 IP 192.168.0.100.45161 > c309-pc-04.6666: UDP, length 4
17:32:53.030718 IP 192.168.0.100.33540 > c309-pc-04.7777: UDP, length 4
17:32:53.031680 IP 192.168.0.100.42376 > c309-pc-04.7777: UDP, length 4
17:32:53.031877 IP 192.168.0.100.46684 > c309-pc-04.6666: UDP, length 4
17:32:53.033154 IP 192.168.0.100.56390 > c309-pc-04.6666: UDP, length 4
17:32:53.033720 IP 192.168.0.100.41903 > c309-pc-04.7777: UDP, length 4
17:32:53.034322 IP 192.168.0.100.52523 > c309-pc-04.6666: UDP, length 4
17:32:53.034720 IP 192.168.0.100.46275 > c309-pc-04.7777: UDP, length 4
17:32:53.035644 IP 192.168.0.100.43335 > c309-pc-04.6666: UDP, length 4
17:32:53.035693 IP 192.168.0.100.57828 > c309-pc-04.7777: UDP, length 4
17:32:53.036907 IP 192.168.0.100.51876 > c309-pc-04.6666: UDP, length 4
17:32:53.037733 IP 192.168.0.100.57611 > c309-pc-04.7777: UDP, length 4
17:32:53.038285 IP 192.168.0.100.46637 > c309-pc-04.6666: UDP, length 4
17:32:53.038718 IP 192.168.0.100.34470 > c309-pc-04.7777: UDP, length 4
17:32:53.039680 IP 192.168.0.100.38651 > c309-pc-04.7777: UDP, length 4
17:32:53.039877 IP 192.168.0.100.50197 > c309-pc-04.6666: UDP, length 4
17:32:53.041023 IP 192.168.0.100.58521 > c309-pc-04.6666: UDP, length 4
17:32:53.041716 IP 192.168.0.100.47005 > c309-pc-04.7777: UDP, length 4
17:32:53.042391 IP 192.168.0.100.37796 > c309-pc-04.6666: UDP, length 4
17:32:53.042679 IP 192.168.0.100.46001 > c309-pc-04.7777: UDP, length 4
17:32:53.043802 IP 192.168.0.100.45251 > c309-pc-04.7777: UDP, length 4
17:32:53.043859 IP 192.168.0.100.48014 > c309-pc-04.6666: UDP, length 4
17:32:53.045202 IP 192.168.0.100.38335 > c309-pc-04.6666: UDP, length 4
17:32:53.045718 IP 192.168.0.100.59297 > c309-pc-04.7777: UDP, length 4
17:32:53.046509 IP 192.168.0.100.54716 > c309-pc-04.6666: UDP, length 4
17:32:53.046644 IP 192.168.0.100.58969 > c309-pc-04.7777: UDP, length 4
17:32:53.047801 IP 192.168.0.100.44625 > c309-pc-04.7777: UDP, length 4
17:32:53.047853 IP 192.168.0.100.45088 > c309-pc-04.6666: UDP, length 4
17:32:53.049124 IP 192.168.0.100.59195 > c309-pc-04.6666: UDP, length 4
17:32:53.049718 IP 192.168.0.100.55741 > c309-pc-04.7777: UDP, length 4
17:32:53.050456 IP 192.168.0.100.32923 > c309-pc-04.6666: UDP, length 4
17:32:53.050678 IP 192.168.0.100.47720 > c309-pc-04.7777: UDP, length 4
17:32:53.051754 IP 192.168.0.100.36702 > c309-pc-04.7777: UDP, length 4
17:32:53.051833 IP 192.168.0.100.55197 > c309-pc-04.6666: UDP, length 4
17:32:53.053075 IP 192.168.0.100.60966 > c309-pc-04.6666: UDP, length 4
17:32:53.053715 IP 192.168.0.100.39305 > c309-pc-04.7777: UDP, length 4
17:32:53.054465 IP 192.168.0.100.46487 > c309-pc-04.6666: UDP, length 4
17:32:53.054676 IP 192.168.0.100.35688 > c309-pc-04.7777: UDP, length 4
17:32:53.055754 IP 192.168.0.100.35886 > c309-pc-04.7777: UDP, length 4
17:32:53.055833 IP 192.168.0.100.38145 > c309-pc-04.6666: UDP, length 4
17:32:53.057081 IP 192.168.0.100.51088 > c309-pc-04.6666: UDP, length 4
17:32:53.057718 IP 192.168.0.100.57400 > c309-pc-04.7777: UDP, length 4
17:32:53.058441 IP 192.168.0.100.42645 > c309-pc-04.6666: UDP, length 4
17:32:53.058679 IP 192.168.0.100.40826 > c309-pc-04.7777: UDP, length 4
17:32:53.059738 IP 192.168.0.100.40368 > c309-pc-04.7777: UDP, length 4
17:32:53.059824 IP 192.168.0.100.43747 > c309-pc-04.6666: UDP, length 4
17:32:53.061099 IP 192.168.0.100.46923 > c309-pc-04.6666: UDP, length 4
